battleNum,battleDetail,beginDate,endDate,unknownDay,lat,lng,shrtNm,desc,type,killed,usCasTot,csCasTot
3145,,1864-06-11,1864-06-11,False,0.0980510262454056,-0.215307659745186,,"Action at Keller's Bridge, near Cynthiana.",Skirmish,0,0,0
3146,KY011,1864-06-11,1864-06-12,False,0.240874952883588,-0.528930949348708,,Action at Cynthiana,Skirmish,2092,1092,1000
3147,,1862-04-26,1862-04-26,False,0.0461565074397109,-0.0947511705067317,,Skirmish at the Gordonsville and Keezletown Cross-Roads Va,Skirmish,0,0,0
3148,,1861-06-27,1861-06-27,False,0.367299247580975,-0.737106107397875,,"Attack on Mathias Point, Va.",Skirmish,0,0,0
3149,,1863-10-10,1863-10-10,False,0.350330341402297,-0.713690349450856,,"Skirmish at Russell's Ford, on Robertson's River, VA",Skirmish,0,0,0
3150,,1863-08-28,1863-08-28,False,0.0151838660403945,-0.0306698708146034,,Skirmish at Hartwood Church.,Skirmish,0,0,0
3151,,1863-11-05,1863-11-05,False,0.204034585978301,-0.412129188772993,,"Skirmish at Hartwood Church, Va.",Skirmish,0,0,0
3152,,1863-08-15,1863-08-15,False,0.113925496156606,-0.230117958121944,,"Skirmish at Hartwood Church, Va.",Skirmish,0,0,0
3153,,1863-08-25,1863-08-25,False,0.307405957290285,-0.620928884162336,,"Skirmish at Hartwood Church, Va.",Skirmish,0,0,0
3154,,1862-11-28,1862-11-28,False,0.372200991149435,-0.751808286852086,,"Affair near Hartwood Church, Va.",Skirmish,0,0,0
3155,,1863-02-25,1863-02-25,False,0.0271595618688644,-0.0548595628862423,,"Skirmish at Hartwood Church, Va.",Skirmish,0,0,0
3156,,1863-10-12,1863-10-12,False,0.308716597381432,-0.623576244338788,,"Skirmish at Hartwood Church, VA",Skirmish,0,0,0
3157,VA022,1862-08-09,1862-08-09,False,0.187506041222347,-0.381134399729126,Cedar Mtn.,Battle of Cedar Mountain,Battle,3695,2381,1314
3158,,1864-02-08,1864-02-08,False,0.38021008559255,-0.814612512902533,,"Skirmish at Barboursville, Ky.",Skirmish,0,0,0
3159,,1863-06-16,1863-06-16,False,0.243313709667363,-0.528991013587489,,"Skirmish at Fox Springs, Ky.",Skirmish,0,0,0
3160,,1861-07-16,1861-07-16,False,0.00161465519717045,-0.00345930489600049,,Skirmish at Barboursville.,Skirmish,0,0,0
3161,,1862-04-12,1862-04-12,False,0.190908078721675,-0.395521568226574,,"Skirmish at Monterey, Va.",Skirmish,0,0,0
3162,,1862-04-21,1862-04-21,False,0.0729005229995485,-0.151034620296795,,"Skirmish at Monterey, Va.",Skirmish,0,0,0
3163,,1862-05-12,1862-05-12,False,0.0272991059906001,-0.0565580319328817,,"Skirmish at Monterey, Va.",Skirmish,0,0,0
3164,,1863-08-22,1863-08-22,False,0.0661201018115123,-0.133211585729894,,"Skirmish at Stafford Court-House, Va.",Skirmish,0,0,0
3165,,1862-06-11,1862-06-11,False,0.255943163346483,-0.565360715095946,,"Skirmish near Monterey, Ky.",Skirmish,0,0,0
3166,,1862-06-06,1862-06-06,False,0.116524846797194,-0.239171465664193,,Action near Harrisonburg.,Skirmish,122,52,70
3167,,1863-12-03,1863-12-03,False,0.232085698313997,-0.469270272023989,,"Skirmish at Ellis' Ford, Va.",Skirmish,0,0,0
3168,,1864-01-12,1864-01-12,False,0.355192906551444,-0.718189328723212,,"Affair near Ellis' Ford, Va.",Skirmish,0,0,0
3169,,1864-01-17,1864-01-17,False,0.12826376651998,-0.259345461796697,,"Affair near Ellis' Ford, Va.",Skirmish,0,0,0
3170,,1864-01-22,1864-01-22,False,0.158915517510059,-0.321322376486483,,"Affair at Ellis' Ford, Va.",Skirmish,0,0,0
3171,,1864-04-17,1864-04-17,False,0.315027631077602,-0.63697635487582,,"Affair near Ellis' Ford, Va.",Skirmish,0,0,0
3172,,1861-11-10,1861-11-10,False,0.299014457037347,-0.641084710732143,,"Affair at Guyandotte, W. Va.",Skirmish,0,0,0
3173,,1862-09-12,1862-09-12,False,0.0945759210332253,-0.201888463864122,,Skirmish at Hurricane Bridge.,Skirmish,0,0,0
3174,,1863-12-13,1863-12-13,False,0.088854145892486,-0.189674357132516,,"Affair at Hurricane Bridge, W. Va,",Skirmish,0,0,0
3175,,1864-02-20,1864-02-20,False,0.00125066869131566,-0.0026697660264283,,"Affair near Hurricane Bridge, W. Va.",Skirmish,0,0,0
3176,,1863-03-28,1863-03-28,False,0.0668329459980163,-0.14266634314154,,"Skirmish at Hurricane Bridge, W. Va.",Skirmish,0,0,0
3177,,1862-11-15,1862-11-15,False,0.0848133988352498,-0.181832387188401,,"Skirmish on the Guyandotte, W. Va.",Skirmish,0,0,0
3178,,1864-07-13,1864-07-13,False,0.0843154311803434,-0.203685698642488,,"Affair at Versailles, MO",Skirmish,0,0,0
3179,,1863-09-13,1863-09-13,False,0.28195821076098,-0.572030411740273,,"Skirmish at Pony Mountain, VA",Skirmish,0,0,0
3180,,1861-07-17,1861-07-17,False,0.198269276101383,-0.422260261808843,,Action at Scarey Creek.,Skirmish,0,0,0
3181,,1863-10-08,1863-10-08,False,0.226986910536263,-0.461450098407316,,"Skirmish near James City, Va.",Skirmish,0,0,0
3182,,1863-10-10,1863-10-10,False,0.347608316013967,-0.706665821623317,,"Skirmish at James City, VA",Skirmish,0,0,0
3183,,1863-10-09,1863-10-09,False,0.336543912546097,-0.684172585969311,,Skirmish near James City.,Skirmish,0,0,0
3184,,1863-09-13,1863-09-13,False,0.0658909425169625,-0.133529292072103,,"Skirmish at Stevensburg, VA",Skirmish,0,0,0
3185,,1863-11-08,1863-11-08,False,0.240631407549612,-0.487644284222248,,Skirmish at Stevensburg.,Skirmish,0,0,0
3186,,1862-08-20,1862-08-20,False,0.377684893204805,-0.765385870796773,,"Skirmish at Stevensburg, VA",Skirmish,0,0,0
3187,,1863-10-11,1863-10-11,False,0.18963021284917,-0.38428935920462,,"Skirmish at Stevensburg, VA",Skirmish,0,0,0
3188,,1863-06-09,1863-06-09,False,0.376165190164225,-0.762306162669722,,"Skirmish at Stevensburg, Va.",Skirmish,0,0,0
3189,,1863-04-29,1863-04-29,False,0.256466501309677,-0.519734413440426,,"Skirmishes near Stevensburg, VA",Skirmish,0,0,0
3190,,1863-11-19,1863-11-19,False,0.209686419897214,-0.423497151386706,,"Skirmish near Grove Church, Va.",Skirmish,0,0,0
3191,,1863-01-26,1863-01-26,False,0.174191336205072,-0.351808832995733,,"Skirmish at Grove Church, near Morrisville, Va.",Skirmish,0,0,0
3192,,1863-05-08,1863-05-08,False,0.293985395680933,-0.593753175247107,,"Skirmish near Grove Church, Va.",Skirmish,0,0,0
3193,,1863-10-14,1863-10-14,False,0.304063508109505,-0.61410762598811,,"Skirmish at Grove Church, VA",Skirmish,0,0,0
3194,,1864-10-01,1864-10-01,False,0.0428224254076978,-0.101357575510772,,"Skirmish at Union, Mo.",Skirmish,0,0,0
3195,,1861-09-01,1861-09-01,False,0.0871784506189959,-0.184688943198598,,"Skirmish at Blue Creek, W. Va. ",Skirmish,0,0,0
3196,,1865-03-05,1865-03-05,False,0.357361483112931,-0.732984671839311,,"Skirmish at Harrisonburg, VA",Skirmish,0,0,0
3197,,1864-06-04,1864-06-04,False,0.176195133478987,-0.36139410147894,,"Affair at Harrisonburg, Va.",Skirmish,0,0,0
3198,,1862-05-06,1862-05-06,False,0.134858584767308,-0.27659385459768,,"Skirmish near Harrisonburg, Va.",Skirmish,0,0,0
3199,,1862-09-05,1862-09-05,False,0.359355502695027,-0.870846459260841,,"Skirmish at Cole Camp, Mo.",Skirmish,0,0,0
3200,,1863-06-08,1863-06-08,False,0.196779290595304,-0.476866354308236,,"Skirmish at Cole Camp, Mo. near Fort Scott, Kans.",Skirmish,0,0,0
3201,,1863-10-09,1863-10-09,False,0.326008276841928,-0.790034245888424,,"Skirmish near Cole Camp, Mo.",Skirmish,0,0,0
3202,,1864-10-23,1864-10-23,False,0.203184325243785,-0.417330808164106,,"Skirmish at Dry Run, Va.",Skirmish,0,0,0
3203,,1863-10-01,1863-10-01,False,0.228433187247133,-0.463135630657865,,"Skirmish near Culpeper Court-House, Va.",Skirmish,0,0,0
3204,,1863-09-13,1863-09-13,False,0.300846987915206,-0.609948138008064,,"Skirmish at Culpeper Court- House, VA",Skirmish,0,0,0
3205,,1863-12-18,1863-12-18,False,0.141436321774021,-0.286753148870111,,"Affair near Culpeper, Va.",Skirmish,0,0,0
3206,,1863-12-23,1863-12-23,False,0.331210449197764,-0.671508125033749,,"Skirmish near Culpeper Court-House, Va.",Skirmish,0,0,0
3207,,1864-09-19,1864-09-19,False,0.192219827777288,-0.389713478115437,,"Skirmish at Culpeper, Va.",Skirmish,0,0,0
3208,,1863-10-11,1863-10-11,False,0.109630177284583,-0.222268213378532,,Skirmish near Culpeper Court-House.,Skirmish,0,0,0
3209,,1863-10-11,1863-10-11,False,0.346034498427595,-0.701562942228807,,"Skirmish at Culpeper, VA",Skirmish,0,0,0
3210,WV008,1861-12-13,1861-12-13,False,0.359578079717585,-0.745106960205457,,"Engagement at Camp Alleghany, W. Va.",Battle,281,137,144
3211,,1863-11-07,1863-11-07,False,0.364125885311316,-0.736068528697423,,Action at Kelly's Ford.,Skirmish,0,0,0
3212,,1862-08-20,1862-08-20,False,0.0872256530735701,-0.176323795457832,,"Skirmish near Kelly's Ford, VA",Skirmish,0,0,0
3213,,1862-08-21,1862-08-21,False,0.221156006166739,-0.447059609433076,,"Skirmish along the Rappahannock at Kelly's Ford, VA",Skirmish,0,0,0
3214,,1862-12-20,1862-12-22,False,0.014420704182981,-0.0291509803036179,,"Skirmishes at Kelly's Ford, Va.",Skirmish,0,0,0
3215,VA029,1863-03-17,1863-03-17,False,0.11081641169166,-0.224011739895035,,"Engagement at Kelly's Ford , Va.",Battle,78,78,0
3216,,1863-03-29,1863-03-29,False,0.273029654424625,-0.551920487199852,,"Skirmish at Kelly's Ford, Va.",Skirmish,0,0,0
3217,,1863-10-11,1863-10-11,False,0.0269023648724738,-0.0543822478130962,,"Skirmish at Kelly's Ford, VA",Skirmish,0,0,0
3218,,1863-07-31,1863-08-01,False,0.335592383200457,-0.678388990481213,,"Skirmishes at Kelly's Ford, Va.",Skirmish,0,0,0
3219,,1863-04-29,1863-04-29,False,0.358760858598528,-0.725240021723284,,"Skirmishes near Kellysville, VA",Skirmish,0,0,0
3220,,1863-02-06,1863-02-06,False,0.0943695706660411,-0.189774704917004,,"Skirmish at Wiggenton's Mills, Aquia Creek, Va.",Skirmish,0,0,0
3221,,1863-06-16,1863-06-16,False,0.236516158199344,-0.51403300114892,,"Skirmish at Mount Carmel, Ky.",Skirmish,0,0,0
3222,,1861-12-23,1861-12-23,False,0.330734715339958,-0.809506616190693,,"Skirmish at Dayton, Mo.",Skirmish,0,0,0
3223,,1863-08-10,1863-08-10,False,0.322700667720236,-0.789832243417353,,"Skirmish at Dayton, Mo.",Skirmish,0,0,0
3224,,1864-04-27,1864-04-27,False,0.351029351976952,-0.859168660963725,,"Skirmish at Dayton, Mo.",Skirmish,0,0,0
3225,,1864-10-05,1864-10-06,False,0.34619848463561,-0.82751373360258,,"Skirmishes on the Osage River, Mo.",Skirmish,0,0,0
3226,,1863-08-01,1863-08-01,False,0.216171878110913,-0.437346403948268,,"Action at Brandy Station, Va.",Skirmish,0,0,0
3227,,1863-04-29,1863-04-29,False,0.140719123641049,-0.284694768019679,,"Skirmishes near Brandy Station, VA",Skirmish,0,0,0
3228,,1863-09-13,1863-09-13,False,0.270284509354204,-0.546805243559516,,"Skirmish at Brandy Station, VA",Skirmish,0,0,0
3229,,1863-11-08,1863-11-08,False,0.237298786899786,-0.480072725133764,,Skirmish at Brandy Station. ,Skirmish,0,0,0
3230,,1863-08-04,1863-08-04,False,0.083941712055713,-0.169820195819198,,"Skirmish at Brandy Station, Va.",Skirmish,0,0,0
3231,,1863-08-09,1863-08-09,False,0.15120046841594,-0.305889557474208,,"Skirmish at Brandy Station, Va.",Skirmish,0,0,0
3232,,1863-09-08,1863-09-08,False,0.0100172822051128,-0.0202656913230381,,"Skirmish at Brandy Station, Va. ",Skirmish,0,0,0
3233,,1863-10-11,1863-10-11,False,0.281719805670914,-0.56993968068495,,"Skirmish at Brandy Station, VA",Skirmish,0,0,0
3234,,1863-10-12,1863-10-12,False,0.118336113306431,-0.239402574024736,,"Skirmish at Brandy Station, or Fleetwood, VA",Skirmish,0,0,0
3235,,1863-07-11,1863-07-11,False,0.347261831250212,-0.775774783950946,,"Skirmish at Pekin, Ind.",Skirmish,0,0,0
3236,VA035,1863-06-09,1863-06-09,False,0.278641015280864,-0.563466328308517,,Battle of Brandy Station,Battle,1299,866,433
3237,,1863-02-09,1863-02-09,False,0.0306754497946948,-0.0618031070841114,,"Skirmish near Somerville, Va.",Skirmish,0,0,0
3238,,1863-10-11,1863-10-11,False,0.110271906357141,-0.223562346594302,,"Skirmish at Griffinsburg, VA",Skirmish,0,0,0
3239,,1861-10-28,1861-10-28,False,0.211481584614011,-0.424273202181689,,"Skirmish near Budd's Ferry, Md. ",Skirmish,0,0,0
3240,VA043,1863-11-07,1863-11-07,False,0.228816037447563,-0.462172231938328,Rappahannock Station,Engagement at Rappahannock Station,Battle,2091,417,1674
3241,,1863-10-22,1863-10-22,False,0.359459822015248,-0.725981815925488,,"Skirmish at Rappahannock Bridge, VA",Skirmish,0,0,0
3242,,1863-10-23,1863-10-23,False,0.0255904895209452,-0.0516741344058721,,"Skirmish near Rappahannock Station, VA",Skirmish,0,0,0
3243,,1863-10-27,1863-10-27,False,0.178250574868732,-0.35993622381283,,"Skirmishes near Rappahannock Station, Va.",Skirmish,0,0,0
3244,,1862-11-07,1862-11-07,False,0.180378621552284,-0.364246605819274,,"Skirmish at Rappahannock Station, VA",Skirmish,0,0,0
3245,,1862-11-09,1862-11-09,False,0.259923514251792,-0.524875159950096,,"Skirmish near Rappahannock Station, VA",Skirmish,0,0,0
3246,,1862-08-22,1862-08-22,False,0.0396317800732637,-0.0800455871062773,,Skirmishes along the Rappahannock.,Skirmish,0,0,0
3247,,1862-08-20,1862-08-20,False,0.122602046588943,-0.247562411193017,,"Skirmish at Rappahannock Station, VA",Skirmish,0,0,0
3248,VA023,1862-08-23,1862-08-23,False,0.368185534651592,-0.743453321218527,,"Engagement at Rappahannock Station, VA",Skirmish,0,0,0
3249,,1862-11-08,1862-11-08,False,0.0437047979243402,-0.0882502817520587,,"Skirmish at Rappahannock Station, VA",Skirmish,0,0,0
3250,,1864-10-07,1864-10-07,False,0.036517460008803,-0.0872715806719878,,"Skirmish at Moreau Creek, Mo.",Skirmish,0,0,0
3251,,1864-12-21,1864-12-21,False,0.0425693292503052,-0.0869999549673151,,Action at Lacey's Springs .,Skirmish,0,0,0
3252,,1863-09-13,1863-09-13,False,0.368504640583977,-0.745516035188915,,"Skirmish at Muddy Run, VA",Skirmish,0,0,0
3253,,1863-11-08,1863-11-08,False,0.211909667441814,-0.428711168573251,,"Skirmish at Muddy Run, near Culpeper Court-House ",Skirmish,0,0,0
3254,,1863-08-05,1863-08-05,False,0.222697238255089,-0.450535336131324,,"Skirmish at Muddy Run, Va.",Skirmish,0,0,0
3255,,1862-08-23,1862-08-23,False,0.169764511621764,-0.342824358345399,,"Action at Beverly Ford, VA",Skirmish,0,0,0
3256,,1862-08-21,1862-08-21,False,0.114204118919969,-0.230625078322441,,"Skirmish along the Rappahannock at Beverly  Ford, VA.",Skirmish,0,0,0
3257,,1863-08-15,1863-08-15,False,0.302970434595648,-0.611821892842323,,"Skirmish at Beverly Ford, Va.",Skirmish,0,0,0
3258,,1863-06-09,1863-06-09,False,0.377475725442194,-0.76227871260871,,"Engagements at Beverly Ford, Va.",Battle,0,0,0
3259,,1862-04-24,1862-04-24,False,0.057087300933553,-0.116636575740623,,"Skirmish nine miles from Harrisonburg, Va.",Skirmish,0,0,0
3260,,1862-08-22,1862-08-22,False,0.232865694487712,-0.470344344586417,,"Action at Hazel River, VA",Skirmish,0,0,0
3261,,1862-11-08,1862-11-08,False,0.0199017728445148,-0.0401977900834811,,"Skirmish at Hazel River, VA",Skirmish,0,0,0
3262,,1863-10-07,1863-10-07,False,0.0669570650070808,-0.135240516751373,,"Skirmish at Hazel River, Va.",Skirmish,0,0,0
3263,,1863-09-24,1863-09-24,False,0.317597892791707,-0.657586300232952,,"Skirmish at Greenbrier Bridge, W. Va.",Skirmish,0,0,0
3264,,1863-08-09,1863-08-09,False,0.0143714801082431,-0.0290357944944284,,"Skirmish near Welford's Ford, Va.",Skirmish,0,0,0
3265,,1864-05-20,1864-05-20,False,0.103935500824589,-0.215183179947215,,"Skirmish at Greenbrier River, W. Va.",Skirmish,0,0,0
3266,,1861-11-04,1861-11-04,False,0.176392764983626,-0.353252153631528,,"Affair at the mouth of Mattawoman Creek, Md",Skirmish,0,0,0
3267,,1862-12-12,1862-12-12,False,0.122090260414253,-0.244799126035942,,"Skirmish at Dumfries, Va.",Skirmish,0,0,0
3268,,1862-12-02,1862-12-02,False,0.0986763834118181,-0.197852738929704,,"Capture of Union pickets near Dumfries, Va.",Skirmish,0,0,0
3269,,1863-03-15,1863-03-15,False,0.00709790250263822,-0.0142317685574477,,"Affair near Dumfries, Va.",Skirmish,0,0,0
3270,,1863-03-29,1863-03-29,False,0.370372023447432,-0.742620642633265,,"Affair near Dumfries, Va.",Skirmish,0,0,0
3271,,1863-05-17,1863-05-17,False,0.302206712268023,-0.605944641238323,,"Skirmish near Dumfries, Va.",Skirmish,0,0,0
3272,,1862-03-22,1862-03-22,False,0.355247488806852,-0.863526154845272,,"Skirmish on the Post Oak, Mo.",Skirmish,0,0,0
3273,,1863-10-24,1863-10-24,False,0.36449331504564,-0.734863853091143,,"Skirmish at Bealeton, Va.",Skirmish,0,0,0
3274,,1863-10-25,1863-10-26,False,0.363462412484849,-0.732785425321104,,"Skirmishes at and near Bealeton, Va.",Skirmish,0,0,0
3275,,1863-10-27,1863-10-27,False,0.267479062957998,-0.539271055772067,,"Skirmish near Bealeton, Va.",Skirmish,0,0,0
3276,,1863-03-17,1863-03-17,False,0.295009159756597,-0.594775154679499,,"Skirmish at Bealeton Station, Va",Skirmish,0,0,0
3277,,1863-10-22,1863-10-22,False,0.284012868798867,-0.572605264562592,,"Skirmish near Bealeton, VA",Skirmish,0,0,0
3278,,1863-08-21,1863-08-21,False,0.0176795201464435,-0.0434875717348531,,"Skirmish near Paola, Kans.",Skirmish,0,0,0
3279,,1864-10-07,1864-10-07,False,0.292114876395177,-0.697966633279727,,"Skirmish at Jefferson City, Mo.",Skirmish,0,0,0
3280,,1864-10-08,1864-10-08,False,0.18820947490544,-0.449699567417389,,"Skirmish near Jefferson City, Mo.",Skirmish,0,0,0
3281,,1864-08-10,1864-08-10,False,0.288829958455256,-0.589471531591456,,"Skirmish near Stone Chapel, Va.",Skirmish,0,0,0
3282,,1862-05-07,1862-05-07,False,0.102708970735155,-0.209160437466764,,"Action at Somerville Heights, Va.",Skirmish,0,0,0
3283,,1863-11-08,1863-11-08,False,0.354622846666255,-0.716782135104187,,Skirmish at Rixeyville.,Skirmish,0,0,0
3284,,1862-08-22,1862-08-22,False,0.266207840342312,-0.537318084427145,,"Action at Freeman's Ford, VA",Skirmish,0,0,0
3285,,1862-08-21,1862-08-21,False,0.15392770532757,-0.310690097108044,,"Skirmishes along the Rappahannock at Freeman's Ford, VA",Skirmish,0,0,0
3286,,1862-05-05,1862-05-05,False,0.14053450056826,-0.286134585322789,,"Skirmish at Columbia Bridge, Va.",Skirmish,0,0,0
3287,,1863-07-10,1863-07-10,False,0.307750348133174,-0.741521813096606,,"Skirmish at Florence, Mo.",Skirmish,0,0,0
3288,VA002,1861-05-29,1861-06-01,False,0.368405999458409,-0.73750293776228,,"Attack on Aquia Creek batteries, Va.",Skirmish,0,0,0
3289,,1861-09-25,1861-09-25,False,0.0911064653063749,-0.182377319653903,,"Engagement at Freestone Point, Va.",Skirmish,0,0,0
3290,,1863-09-02,1863-09-02,False,0.326190552650237,-0.658974694744422,,Affair near Rixey's Ford.,Skirmish,0,0,0
3291,,1863-09-02,1863-09-02,False,0.00956923560765878,-0.0193256341121479,,"Skirmish near Oak Shade,Va.",Skirmish,0,0,0
3292,,1863-10-24,1863-10-24,False,0.263310130882181,-0.530520384490334,,"Skirmish at Liberty, Va.",Skirmish,0,0,0
3293,,1863-11-21,1863-11-21,False,0.237506409973998,-0.478530740599207,,"Affair at Liberty, Va.",Skirmish,0,0,0
3294,,1864-12-22,1864-12-22,False,0.0350518507056675,-0.0706228858387117,,"Skirmish at Liberty Mills, VA",Skirmish,0,0,0
3295,,1863-09-23,1863-09-23,False,0.0139496064345162,-0.0281058330127061,,"Skirmish near Liberty Mills, VA",Skirmish,0,0,0
3296,,1864-06-19,1864-06-19,False,0.0507173294576981,-0.102185878811706,,"Skirmish at Liberty, Va.",Skirmish,0,0,0
3297,,1862-08-23,1862-08-23,False,0.236701179216914,-0.477477306059893,,"Skirmish at Fant's Ford, VA",Skirmish,0,0,0
3298,,1863-07-10,1863-07-10,False,0.0335579389484511,-0.0748430998394675,,"Skirmish at Salem, Ind.",Skirmish,0,0,0
3299,,1863-11-24,1863-11-24,False,0.0650563420428804,-0.131733275945302,,"Skirmish near Woodville, Va.",Skirmish,0,0,0
3300,,1863-09-30,1863-09-30,False,0.0594833769794666,-0.120448519971037,,"Skirmish at Woodville, Va.",Skirmish,0,0,0
3301,,1863-11-30,1863-11-30,False,0.148870637626744,-0.299654641964994,,"Skirmish at Licking Run Bridge, Va,",Skirmish,0,0,0
3302,,1864-07-14,1864-07-14,False,0.331792360552402,-0.787565577011758,,"Skirmish near Fredericksburg, MO",Skirmish,0,0,0
3303,,1864-10-03,1864-10-03,False,0.193674844782872,-0.457590642581808,,"Affair at Miller's Station, Mo.",Skirmish,0,0,0
3304,,1863-10-13,1863-10-13,False,0.0908163993810382,-0.183112060044691,,"Skirmish at Fox's Ford, VA",Skirmish,0,0,0
3305,,1862-09-26,1862-09-27,False,0.341813345620366,-0.725630769103081,,"Expedition from Point Pleasant to Buffalo, W. Va., and skirmish.",Skirmish,0,0,0
3306,,1864-01-22,1864-01-22,False,0.373654692944692,-0.751783057456275,,"Skirmish at Germantown, Va.",Skirmish,0,0,0
3307,,1863-11-16,1863-11-16,False,0.217426287438396,-0.437455752585386,,"Affair at Germantown, Va.",Skirmish,0,0,0
3308,,1863-12-13,1863-12-13,False,0.209973886580096,-0.422461725577686,,"Affair at Germantown, Va.",Skirmish,0,0,0
3309,,1863-12-24,1863-12-24,False,0.00885335722360149,-0.0178127129556733,,"Affair near Germantown, Va,",Skirmish,0,0,0
3310,,1863-10-23,1863-10-23,False,0.13887889129495,-0.279770144484995,,"Skirmish at Fayetteville, Va.",Skirmish,0,0,0
3311,,1863-06-03,1863-06-03,False,0.355282830885125,-0.71571372728394,,"Skirmish near Fayetteville, Va.",Skirmish,0,0,0
3312,,1864-10-09,1864-10-09,False,0.0287956619154047,-0.0690056015061087,,"Skirmish at California, Mo.",Skirmish,0,0,0
3313,,1863-07-23,1863-07-23,False,0.163815043822823,-0.353092956221221,,"Skirmish at Rockville, Ohio.",Skirmish,0,0,0
3314,WV005,1863-09-14,1863-09-14,False,0.0389566936140808,-0.0805986717726182,,"Skirmish at Cheat Mountain Pass, W. Va,",Skirmish,0,0,0
3315,,1863-05-03,1863-05-03,False,0.2466134264671,-0.495811030752277,,"Skirmish at Warrenton Junction, Va.",Skirmish,0,0,0
3316,,1861-09-17,1861-09-17,False,0.279750313594021,-0.683700378442008,,"Skirmish at Morristown, Mo.",Skirmish,0,0,0
3317,,1862-11-07,1862-11-07,False,0.163386643033398,-0.329508537292095,,"Skirmish at Jefferson, VA",Skirmish,0,0,0
3318,,1862-11-11,1862-11-11,False,0.184005178673166,-0.371090782900604,,"Skirmish at Jefferson, Va.",Skirmish,0,0,0
3319,,1862-11-14,1862-11-14,False,0.230447216827662,-0.464752344072551,,"Skirmish at Jefferson, Va.",Skirmish,0,0,0
3320,,1863-10-31,1863-10-31,False,0.056560475149791,-0.113642303821366,,"Affair near Weaverville, Va.",Skirmish,0,0,0
3321,,1863-08-27,1863-08-27,False,0.358616794438807,-0.720539185732247,,"Skirmish at Weaverville,Va.",Skirmish,0,0,0
3322,,1863-11-08,1863-11-08,False,0.359542973469194,-0.725052117510891,,Skirmish near Jeffersonton. ,Skirmish,0,0,0
3323,,1863-10-12,1863-10-12,False,0.113284847490496,-0.228449516791684,,"Skirmiss at Jeffersonton, VA",Skirmish,0,0,0
3324,,1864-09-24,1864-09-24,False,0.291508531145615,-0.594307964419695,,"Skirmish at Forest Hill , Va.",Skirmish,0,0,0
3325,,1863-03-04,1863-03-04,False,0.254843498168362,-0.510788609857399,,"Skirmish at Independent Hill, Prince William County, Va.",Skirmish,0,0,0
3326,,1863-03-17,1863-03-17,False,0.267193076428,-0.548528428287046,,"Skirmish near Franklin, Va.",Skirmish,0,0,0
3327,,1862-05-10,1862-05-12,False,0.331888582785945,-0.681343712628145,,"Skirmishes near Franklin, W. Va.",Skirmish,0,0,0
3328,,1862-05-26,1862-05-26,False,0.0307350741574719,-0.0630969265606209,,"Skirmish near Franklin, W. Va.",Skirmish,0,0,0
3329,,1862-05-05,1862-05-05,False,0.129769373928142,-0.266407317405842,,"Skirmish at Franklin, W. Va.",Skirmish,0,0,0
3330,,1864-08-19,1864-08-19,False,0.103809251677119,-0.213113028321483,,"Skirmish at Franklin, W. Va.",Skirmish,0,0,0
3331,,1862-05-26,1862-05-26,False,0.192595224383294,-0.39538433083249,,"Skirmish near Franklin, W. Va.",Skirmish,0,0,0
3332,,1864-10-06,1864-10-06,False,0.375788965080476,-0.766933233022174,,"Skirmish near Brock's Gap, Va.",Skirmish,0,0,0
3333,,1862-04-19,1862-04-19,False,0.284936644260423,-0.579073824450851,,"Skirmish on South Fork of Shenandoah, near Luray, Va.",Skirmish,0,0,0
3334,,1863-06-16,1863-06-16,False,0.0409009452535429,-0.0886434145304109,,"Skirmish at Maysville, Ky.",Skirmish,0,0,0
3335,,1862-10-19,1862-10-19,False,0.258205104043866,-0.518797084805625,,"Skirmish between Catlett's Station and Warrenton Junction, Va.",Skirmish,0,0,0
3336,,1862-08-23,1862-08-24,False,0.313919125726108,-0.632550009611385,,Actions at Sulphur  Springs,Skirmish,0,0,0
3337,,1862-08-25,1862-08-25,False,0.230396577143715,-0.464251283669291,,Skirmish at Sulphur Springs.,Skirmish,0,0,0
3338,,1862-08-26,1862-08-26,False,0.0394182894587756,-0.0794282263571528,,"Skirmish at Sulpher Springs, VA",Skirmish,0,0,0
3339,,1862-11-13,1862-11-14,False,0.354754315667418,-0.714833303851937,,"Skirmishes at Sulphur Springs, Va.",Skirmish,0,0,0
3340,,1862-11-15,1862-11-15,False,0.11956313074606,-0.240920840129294,,"Action at Warrenton, or Sulphur Springs, Va.",Skirmish,0,0,0
3341,,1863-10-11,1863-10-11,False,0.223004208089218,-0.44935559005503,,"Skirmish near Warrenton, or Sulphur, Springs.",Skirmish,0,0,0
3342,,1863-11-08,1863-11-08,False,0.0948461726091018,-0.191115920699449,,"Skirmish at Warrenton, or Sulphur, Springs. ",Skirmish,0,0,0
3343,,1863-10-12,1863-10-12,False,0.179257211361539,-0.361204949540457,,"Action at Warrenton, or Sulphur Springs.",Skirmish,0,0,0
3344,,1863-07-24,1863-07-24,False,0.207293972959663,-0.418752193923249,,"Skirmish at Battle Mountain, near Newby's Cross-Roads, Va.",Skirmish,0,0,0
3345,,1862-11-09,1862-11-09,False,0.267002882951838,-0.539368485257979,,"Skirmish at Newby's Cross-Roads, VA",Skirmish,0,0,0
3346,,1864-05-13,1864-05-13,False,0.359766106994529,-0.732234001887777,,"Skirmish near New Market, Va.",Skirmish,0,0,0
3347,,1864-05-14,1864-05-14,False,0.160728510971252,-0.327131651697621,,"Skirmish at New Market, Va.",Skirmish,0,0,0
3348,,1862-06-13,1862-06-13,False,0.0466664663708122,-0.0949805241803416,,Skirmish at New Market.,Skirmish,0,0,0
3349,,1864-09-24,1864-09-24,False,0.366255945450335,-0.745442806974501,,"Skirmish at New Market, Va.",Skirmish,0,0,0
3350,,1862-08-22,1862-08-22,False,0.121551262207534,-0.244157602898943,,Raid on Catlett's Station,Skirmish,312,300,12
3351,,1863-10-30,1863-10-30,False,0.243878351893362,-0.489873595023331,,"Skirmish near Catlett's Station, Va.",Skirmish,0,0,0
3352,,1863-10-06,1863-10-06,False,0.294951956414103,-0.592464128636232,,"Affair near Catlett's Station, Va.",Skirmish,0,0,0
3353,,1863-11-01,1863-11-01,False,0.177879254609086,-0.357302520945054,,"Skirmish at Catlett's Station, Va.",Skirmish,0,0,0
3354,,1863-11-27,1863-11-27,False,0.322171077538504,-0.647138635885715,,"Skirmish at Catlett's Station, Va.",Skirmish,0,0,0
