battleNum,battleDetail,beginDate,endDate,unknownDay,lat,lng,shrtNm,desc,type,killed,usCasTot,csCasTot
1045,,1863-12-01,1863-12-01,False,0.168955270391,-0.375632102196946,,"Skirmish at Cedar Point, N. C.",Skirmish,0,0,0
1046,,1863-09-13,1863-09-13,False,0.076110597303078,-0.187220435352459,,"Skirmish during reconnaissance from Henderson's Gap, Ala., to La Fayette, Ga.",Skirmish,0,0,0
1047,,1863-04-06,1863-04-06,False,0.281040504066667,-0.708298223816266,,"Skirmish at Town Creek, Ala.",Skirmish,0,0,0
1048,,1863-04-27,1863-04-27,False,0.0215848123506312,-0.0543995759619502,,"Skirmish at Town Creek, Ala.",Skirmish,0,0,0
1049,,1863-04-08,1863-04-08,False,0.155771855901017,-0.392587286383036,,"Action at Town Creek, Ala.",Skirmish,0,0,0
1050,,1863-09-26,1863-09-26,False,0.345917508102715,-0.858414969311528,,"Skirmish at Hunt's Mill, near Larkinsville, Ala.",Skirmish,0,0,0
1051,,1862-12-20,1862-12-20,False,0.133149912235117,-0.345369392615453,,"Skirmish at Cold Water, Miss.",Skirmish,0,0,0
1052,,1863-05-11,1863-05-11,False,0.0169958114226832,-0.0440861543656111,,"Skirmish at Coldwater, Miss.",Skirmish,0,0,0
1053,,1863-08-21,1863-08-21,False,0.298382964333703,-0.773988196181547,,"Skirmish at Coldwater, Miss. ",Skirmish,0,0,0
1054,,1863-12-29,1863-12-29,False,0.280287721705427,-0.727050180693291,,"Skirmish at Coldwater, Miss.",Skirmish,0,0,0
1055,,1862-08-30,1862-08-30,False,0.132438748993771,-0.32879864974817,,"Skirmish near Larkinsville, Ala,",Skirmish,0,0,0
1056,,1864-02-14,1864-02-14,False,0.00126367264533134,-0.00313725297668119,,"Affair near Larkinsville, Ala.",Skirmish,0,0,0
1057,,1864-06-24,1864-06-24,False,0.314738021220663,-0.828453830531798,,"Capture of the U.S. Steamer Queen City, at Clarendon, AR",Skirmish,0,0,0
1058,,1864-06-24,1864-06-25,False,0.107223808677423,-0.282234649244176,,"Engagement between U.S. Steamers Fawn, Naumkeag, and Tyler and Shelby's forces.",Battle,0,0,0
1059,,1864-06-26,1864-06-26,False,0.182502122050522,-0.48038232402476,,"Skirmish near Clarendon, AR",Skirmish,0,0,0
1060,,1864-09-09,1864-09-09,False,0.194716628728049,-0.512533364454537,,"Attack on steamer J.D. Perry, at Clarendon, Ark.",Skirmish,0,0,0
1061,,1864-10-11,1864-10-11,False,0.00496919587411975,-0.0130799238700527,,"Attack on the steamer Resolute, on the White River, near Clarendon, Ark.",Skirmish,0,0,0
1062,,1862-04-07,1862-04-07,False,0.0773781559816007,-0.172812375233293,,Skirmish at Foy's Plantation.,Skirmish,0,0,0
1063,,1862-08-15,1862-08-15,False,0.32892505387774,-0.865774029439152,,"Skirmish at Clarendon, Ark. ",Skirmish,0,0,0
1064,,1863-04-01,1863-04-01,False,0.108720981967248,-0.286167932581239,,"Skirmish near Clarendon, Ark.",Skirmish,0,0,0
1065,,1864-03-15,1864-03-15,False,0.0924894596343606,-0.243444429678664,,"Skirmish at Clarendon, Ark.",Skirmish,0,0,0
1066,,1864-05-17,1864-05-17,False,0.0673601534150224,-0.168436715807865,,"Affair at Madison Station, Ala.",Skirmish,0,0,0
1067,NC004,1862-03-23,1862-04-26,False,0.256746770894676,-0.567428341006302,,Siege of Fort Macon,Siege,462,12,450
1068,,1865-02-28,1865-02-28,False,0.160643212910689,-0.369853947608078,,"Skirmish near Cheraw, S.C.",Skirmish,0,0,0
1069,,1865-03-05,1865-03-05,False,0.163496853599288,-0.376423974779534,,"Skirmish near Cheraw, S.C.",Skirmish,0,0,0
1070,,1864-10-16,1864-10-16,False,0.130088119638232,-0.319381872889272,,"Skirmish at Ship's Gap, Ga.",Skirmish,0,0,0
1071,,1863-04-23,1863-04-23,False,0.131730420079192,-0.332264580756196,,"Skirmish at Leighton, AL",Skirmish,0,0,0
1072,,1864-12-30,1864-12-30,False,0.202624645832146,-0.511081593437699,,"Skirmish near Leighton, Ala.",Skirmish,0,0,0
1073,,1864-06-24,1864-06-24,False,0.343265688265478,-0.843561560193151,,"Action at La Fayette, GA",Skirmish,0,0,0
1074,,1863-09-14,1863-09-14,False,0.0886473825520817,-0.217836420327905,,"Skirmish near La Fayette, Ga.",Skirmish,0,0,0
1075,,1863-12-12,1863-12-12,False,0.225827637236661,-0.554934423222716,,"Skirmish at La Fayette, Ga.",Skirmish,0,0,0
1076,,1864-10-12,1864-10-12,False,0.0694439803100669,-0.170647205236758,,"Skirmish at La Fayette, Ga.",Skirmish,0,0,0
1077,,1863-10-27,1863-10-27,False,0.127660448326175,-0.322755551971844,,"Skirmish at Little Bear Creek, Ala.",Skirmish,0,0,0
1078,,1862-11-05,1862-11-05,False,0.0872695914967677,-0.222915815916789,,"Skirmish at Jumpertown, Miss.",Skirmish,0,0,0
1079,,1863-06-19,1863-06-19,False,0.134160705544049,-0.34792749414997,,"Action on the Coldwater, near Hernando, Miss.",Skirmish,0,0,0
1080,,1863-09-06,1863-09-06,False,0.0425192295793009,-0.104671078385928,,"Skirmish at Stevens' Gap, Ga.",Skirmish,0,0,0
1081,,1863-09-18,1863-09-18,False,0.231373506177878,-0.569580273236216,,"Skirmish near Stevens' Gap, Ga.",Skirmish,0,0,0
1082,,1864-02-12,1864-02-12,False,0.296288201583704,-0.765411358124833,,"Affair at Wall Hill, MS",Skirmish,0,0,0
1083,,1863-06-18,1863-06-18,False,0.31755973783587,-0.823132665826857,,"Skirmish at Coldwater Bridge, Miss.",Skirmish,0,0,0
1084,,1864-02-08,1864-02-08,False,0.134665388054396,-0.34901792530151,,"Affair at Coldwater Ferry, MS",Skirmish,0,0,0
1085,,1863-09-11,1863-09-11,False,0.289818117958094,-0.712380557240082,,"Skirmish near Blue Bird Gap, Ga.",Skirmish,0,0,0
1086,,1862-09-12,1862-09-12,False,0.239018378668643,-0.619273279481203,,"Skirmish at Coldwater Railroad Bridge, Miss.",Skirmish,0,0,0
1087,,1863-03-19,1863-03-19,False,0.126739298165079,-0.328369145715953,,"Skirmish near Coldwater River, Miss.",Skirmish,0,0,0
1088,,1862-12-23,1862-12-23,False,0.27574796212854,-0.70629185003758,,"Skirmish at Ripley, Miss.",Skirmish,0,0,0
1089,,1862-10-07,1862-10-07,False,0.321060268830694,-0.822353316759194,,"Skirmish near Ripley, Miss.",Skirmish,0,0,0
1090,,1862-12-25,1862-12-25,False,0.186899999774667,-0.478719572735547,,"Skirmish at Ripley, Miss.",Skirmish,0,0,0
1091,,1863-07-07,1863-07-07,False,0.0574140494172393,-0.147058476400083,,"Skirmish at Ripley, Miss.",Skirmish,0,0,0
1092,,1863-08-03,1863-08-03,False,0.0861566644046574,-0.220678874381187,,"Skirmish at Ripley, Miss.",Skirmish,0,0,0
1093,,1863-12-04,1863-12-04,False,0.213003638594696,-0.545580583103838,,"Affair at Ripley, Miss.",Skirmish,0,0,0
1094,,1864-06-07,1864-06-07,False,0.311084275566126,-0.796801132494963,,"Skirmish at Ripley, Miss.",Skirmish,0,0,0
1095,,1864-06-11,1864-06-11,False,0.200219025474479,-0.512834491408394,,"Action at Ripley, Miss.",Skirmish,0,0,0
1096,,1864-07-07,1864-07-07,False,0.126184713458929,-0.323205415653529,,"Skirmish near Ripley, Miss.",Skirmish,0,0,0
1097,,1864-02-02,1864-02-02,False,0.270063255170377,-0.598008611294341,,Skirmish at Gales' Creek.,Skirmish,0,0,0
1098,,1863-12-01,1863-12-01,False,0.173328073390253,-0.443930399028844,,"Skirmish at Rilpley, Miss.",Skirmish,0,0,0
1099,,1862-06-04,1862-06-05,False,0.25492432570914,-0.635547703064055,,"Skirmishes at Huntsville, Ala.",Skirmish,0,0,0
1100,,1862-07-02,1862-07-02,False,0.142573579924361,-0.355447880411118,,"Skirmish at Huntsville, Ala.",Skirmish,0,0,0
1101,,1862-09-01,1862-09-01,False,0.0842169403694732,-0.209959888535589,,"Skirmish at Huntsville, Ala.",Skirmish,0,0,0
1102,,1864-10-01,1864-10-01,False,0.257147542066141,-0.641090367716305,,"Skirmish near Huntsville, Ala.",Skirmish,0,0,0
1103,,1864-10-18,1864-10-18,False,0.224546584327105,-0.559813448571394,,"Skirmish near Huntsville, Ala.",Skirmish,0,0,0
1104,,1862-04-24,1862-04-24,False,0.0532867591996914,-0.134559175561043,,"Skirmish at Tuscumbia, Ala.",Skirmish,0,0,0
1105,,1862-04-25,1862-04-25,False,0.267641429655145,-0.675845381878352,,"Skirmish at Tuscumbia, Ala.",Skirmish,0,0,0
1106,,1864-02-02,1864-02-02,False,0.116248703738944,-0.257174250179255,,"Skirmish at, Bogue Sound Block-house.",Skirmish,0,0,0
1107,,1863-10-20,1863-10-20,False,0.0316712934656749,-0.0801206938699392,,"Skirmish at Cane Creek, Ala.",Skirmish,0,0,0
1108,,1863-10-26,1863-10-26,False,0.135993517599457,-0.344030628357228,,"Skirmish near Cane Creek, Ala.",Skirmish,0,0,0
1109,,1865-03-02,1865-03-02,False,0.196383227617313,-0.45279152260412,,"Skirmish at Chesterfield, S.C.",Skirmish,0,0,0
1110,,1863-02-22,1863-02-22,False,0.218930922856077,-0.552822304807126,,"Attack on Tuscumbia, Ala.",Skirmish,0,0,0
1111,,1863-04-23,1863-04-23,False,0.317839040581642,-0.80257511675287,,"Skirmish at Tuscumbia, AL",Skirmish,0,0,0
1112,,1863-10-24,1863-10-25,False,0.284348594297178,-0.718008416615365,,"Skirmishes at Tuscumbia, Ala.",Skirmish,0,0,0
1113,,1865-02-20,1865-02-20,False,0.147062267977391,-0.371346819685541,,"Skirmishes near Tuscumbia, Ala.",Skirmish,0,0,0
1114,,1863-04-07,1863-04-07,False,0.0377813168807345,-0.0955888384275542,,"Skirmish at Barton Station, AL",Skirmish,0,0,0
1115,,1863-10-31,1863-10-31,False,0.311252093805484,-0.787485153017038,,"Skirmish at Barton's Station, Ala.",Skirmish,0,0,0
1116,,1863-10-20,1863-10-20,False,0.0664239959902047,-0.16805641371537,,"Skirmish at Barton's Station, Ala.",Skirmish,0,0,0
1117,,1863-10-26,1863-10-26,False,0.193418653694725,-0.489359979041066,,"Skirmishes at Barton's Station, Ala.",Skirmish,0,0,0
1118,,1864-02-24,1864-02-24,False,0.192529431648448,-0.494244718077219,,"Skirmish at Tippah River, MS",Skirmish,0,0,0
1119,,1863-11-04,1863-11-04,False,0.0925153345003648,-0.20588711551036,,"Skirmish near Rocky Run, N. C.",Skirmish,0,0,0
1120,,1864-04-26,1864-04-26,False,0.27547048300593,-0.731486182952974,,"Skirmish near Little Rock, Ark.",Skirmish,0,0,0
1121,,1864-05-24,1864-05-24,False,0.145063461097764,-0.385202495332564,,"Skirmish near Little Rock, Ark.",Skirmish,0,0,0
1122,,1864-05-28,1864-05-28,False,0.104180963435376,-0.276642834644705,,"Skirmish near Little Rock, Ark.",Skirmish,0,0,0
1123,,1864-07-10,1864-07-10,False,0.203491668652771,-0.540353152690929,,"Skirmish near Little Rock, AR",Skirmish,0,0,0
1124,,1863-01-20,1863-01-20,False,0.00680367838953721,-0.0151584615435639,,"Skirmishes near Jacksonville, NC",Skirmish,0,0,0
1125,,1863-09-11,1863-09-11,False,0.141052982715847,-0.346460329876082,,"Skirmish at Davis' Cross-Roads , near Dug Gap, Ga.",Skirmish,0,0,0
1126,,1862-12-12,1862-12-12,False,0.0857021441433081,-0.216925961756229,,"Skirmish at Cherokee Station, Ala.",Skirmish,0,0,0
1127,,1862-12-12,1862-12-12,False,0.253600106317222,-0.641902807849888,,"Skirmish at Cherokee Station, Ala.",Skirmish,0,0,0
1128,,1863-04-07,1863-04-07,False,0.150217530722507,-0.380224819931418,,"Skirmish at Cherokee Station, AL",Skirmish,0,0,0
1129,,1863-10-21,1863-10-21,False,0.244375471864082,-0.618553768912766,,"Action at Cherokee Station, Ala.",Skirmish,0,0,0
1130,,1863-10-29,1863-10-29,False,0.11833099479176,-0.299514850035152,,"Skirmish at Cherokee Station, Ala.",Skirmish,0,0,0
1131,,1863-08-13,1863-08-13,False,0.0550233269938955,-0.139945669116766,,"Skirmish at Jacinto, Miss.",Skirmish,0,0,0
1132,,1863-09-07,1863-09-07,False,0.209872266259687,-0.533786601708444,,"Skirmish near Jacinto , Miss.",Skirmish,0,0,0
1133,,1864-02-12,1864-02-12,False,0.155665549983373,-0.400487776518356,,"Skirmish at Holly Springs, MS",Skirmish,0,0,0
1134,,1862-06-02,1862-06-02,False,0.178709188595511,-0.45503682257514,,"Affair near Rienzi, Miss.",Skirmish,0,0,0
1135,,1862-08-26,1862-08-26,False,0.01778424666834,-0.0452829938933382,,"Skirmish near Rienzi, Miss.",Skirmish,0,0,0
1136,,1862-09-09,1862-09-09,False,0.0951305483934194,-0.24222538757506,,"Skirmish at Rienzi, Miss.",Skirmish,0,0,0
1137,,1862-09-18,1862-09-18,False,0.0934403068341111,-0.237921623708318,,"Skirmish at Rienzi, Miss.",Skirmish,0,0,0
1138,,1863-08-08,1863-08-08,False,0.185519000328483,-0.472376250489615,,"Skirmish at Rienzi, Miss.",Skirmish,0,0,0
1139,,1862-07-01,1862-07-01,False,0.102469281112468,-0.263624108276508,,"Skirmish near Holly Springs, Miss.",Skirmish,0,0,0
1140,,1862-11-13,1862-11-13,False,0.0290109134691307,-0.074636770264761,,"Skirmish at Holly Springs, Miss.",Skirmish,0,0,0
1141,,1862-11-28,1862-11-29,False,0.337644423943595,-0.868662385549172,,"Skirmishes at Holly Springs, Miss.",Skirmish,0,0,0
1142,,1863-06-16,1863-06-17,False,0.141591692639662,-0.364274866635621,,"Skirmishes near Holly Springs, Miss.",Skirmish,0,0,0
1143,,1863-09-07,1863-09-07,False,0.0429206509814176,-0.110422540480248,,"Skirmish at Holly Springs, Miss.",Skirmish,0,0,0
1144,,1863-11-05,1863-11-05,False,0.212022888115466,-0.545474157784917,,"Skirmish at Holly Springs, Miss,",Skirmish,0,0,0
1145,,1864-04-17,1864-04-17,False,0.0583754231881033,-0.150183242393754,,"Skirmish at Holly Springs, Miss.",Skirmish,0,0,0
1146,,1864-05-24,1864-05-24,False,0.139608472988209,-0.359172610559901,,"Skirmish at Holly Springs, Miss.",Skirmish,0,0,0
1147,,1864-08-28,1864-08-28,False,0.293729866636389,-0.755682808794231,,"Affair near Holly Springs, Miss.",Skirmish,0,0,0
1148,,1863-08-21,1863-08-21,False,0.25665229892636,-0.63800869124051,,"Skirmish at Maysville, Ala.",Skirmish,0,0,0
1149,,1863-10-13,1863-10-13,False,0.198995684416678,-0.494680845284861,,"Skirmish at Maysville, Ala.",Skirmish,0,0,0
1150,,1863-11-04,1863-11-04,False,0.237723928984898,-0.590954896732583,,"Skirmish at Maysville, Ala",Skirmish,0,0,0
1151,,1864-11-17,1864-11-17,False,0.246784873341076,-0.613479383262692,,"Skirmish near Maysville, Ala.",Skirmish,0,0,0
1152,,1864-01-06,1864-01-06,False,0.178943175552175,-0.437311330283688,,"Skirmish at Dalton, Ga.",Skirmish,0,0,0
1153,,1864-02-23,1864-02-23,False,0.189913612634858,-0.464121497363922,,"Skirmish near Dalton, GA",Skirmish,0,0,0
1154,,1864-05-13,1864-05-13,False,0.0659179895118838,-0.161094065722909,,"Combat at Dalton, GA",Skirmish,0,0,0
1155,GA020,1864-08-14,1864-08-15,False,0.273375565359678,-0.668090480598621,,Combats at Dalton [Wheeler's raid],Skirmish,0,0,0
1156,,1864-11-30,1864-11-30,False,0.0732556182545679,-0.179026172810476,,"Skirmish near Dalton, Ga.",Skirmish,0,0,0
1157,,1864-12-05,1864-12-05,False,0.140236172471708,-0.342716993527445,,"Skirmish near Dalton, Ga.",Skirmish,0,0,0
1158,,1865-03-13,1865-03-13,False,0.10859907033267,-0.265400475699641,,"Affair near Dalton, Ga.",Skirmish,0,0,0
1159,,1865-03-14,1865-03-14,False,0.275663322879242,-0.67368143024596,,"Skirmish near Dalton, Ga.",Skirmish,0,0,0
1160,,1864-10-13,1864-10-13,False,0.203576197249163,-0.497523158040451,,"Surrender of Dalton, Ga.",Surrender,0,0,0
1161,,1863-09-15,1863-09-18,False,0.234660950700409,-0.575823779523083,,"Skirmishes at Catlett's Gap, Pigeon Mountain, Ga.",Skirmish,0,0,0
1162,,1862-11-08,1862-11-08,False,0.00594610904121374,-0.0155189071344698,,"Skirmish at Marianna, Ark.",Skirmish,0,0,0
1163,,1864-02-02,1864-02-02,False,0.166712537530462,-0.368443533853067,,Skirmish at Newport Barracks.,Skirmish,0,0,0
1164,,1864-02-06,1864-02-06,False,0.158841148412161,-0.351047347183247,,Skirmish near Newport Barracks.,Skirmish,0,0,0
1165,,1863-03-25,1863-03-25,False,0.275915589780253,-0.695466386856309,,"Affair with Union gunboats near Florence, Ala.",Skirmish,0,0,0
1166,,1864-06-26,1864-06-28,False,0.233453817880946,-0.61263374567372,,Pursuit of Confederates to Bayou De View.,Movement,91,17,74
1167,,1862-07-07,1862-07-07,False,0.0961472276322321,-0.25279493777317,,"Skirmish near Devall's Bluff, AR",Skirmish,0,0,0
1168,,1863-12-01,1863-12-01,False,0.320876781196241,-0.843664741386319,,"Skirmish near Devall's Bluff, Ark.",Skirmish,0,0,0
1169,,1863-12-12,1863-12-12,False,0.147354468271928,-0.387431489755331,,"Skirmish at Devall's Bluff, Ark.",Skirmish,0,0,0
1170,,1864-05-22,1864-05-22,False,0.00727895462117839,-0.019138179288465,,"Affair near Devall's Bluff, Ark.",Skirmish,0,0,0
1171,,1864-12-13,1864-12-13,False,0.0486979883459266,-0.128039104576949,,"Affair near Devall's Bluff, Ark.",Skirmish,0,0,0
1172,,1862-04-07,1862-04-07,False,0.0540437630962239,-0.119410284438152,,Skirmish near Newport.,Skirmish,0,0,0
1173,,1864-04-12,1864-04-12,False,0.047429368025118,-0.119508230354748,,"Skirmish near Florence, Ala.",Skirmish,0,0,0
1174,,1864-05-07,1864-05-07,False,0.171489274909554,-0.432103159342248,,"Skirmish near Florence, Ala.",Skirmish,0,0,0
1175,,1864-10-06,1864-10-07,False,0.314202225882951,-0.791698341181953,,"Skirmishes at Florence, Ala.",Skirmish,0,0,0
1176,,1864-11-09,1864-11-09,False,0.268073645180353,-0.675467717033129,,"Skirmish at Florence, Ala.",Skirmish,0,0,0
1177,,1864-10-27,1864-10-27,False,0.060300447054331,-0.147446303145571,,Skirmish near Trickum's Cross-Roads,Skirmish,0,0,0
1178,MS001,1862-09-19,1862-09-19,False,0.0950931383033232,-0.241050626839992,,Battle of Iuka,Battle,1483,790,693
1179,,1865-03-03,1865-03-03,False,0.3095768667957,-0.71428121600859,,"Skirmish near Hornsborough, S.C.",Skirmish,0,0,0
1180,,1864-10-13,1864-10-14,False,0.193709433189564,-0.473182132633759,,"Combat at Buzzard Roost Gap, Ga.",Battle,0,0,0
1181,AL002,1864-01-26,1864-01-26,False,0.248229102564407,-0.620317446753915,,"Attack on Athens, AL",Skirmish,0,0,0
1182,,1862-05-08,1862-05-08,False,0.0509740400887677,-0.127384196955306,,"Skirmish at Athens, Ala.",Skirmish,0,0,0
1183,,1864-09-23,1864-09-23,False,0.00343079654572527,-0.00857356533116062,,"Skirmish at Athens, Ala.",Skirmish,0,0,0
1184,,1864-09-24,1864-09-24,False,0.00866426310254736,-0.0216520055229188,,"Action at and surrender of Athens, Ala.",Skirmish,0,0,0
1185,,1864-10-01,1864-10-02,False,0.292408646033295,-0.730729612423783,,"Skirmishes at Athens, Ala.",Skirmish,0,0,0
1186,,1864-04-23,1864-04-23,False,0.00924808080622919,-0.0226235778767244,,"Attack on Union pickets at Nickajack Trace, Ga.",Skirmish,52,32,20
1187,,1864-01-25,1864-01-25,False,0.0929451426644933,-0.234066588363886,,"Skirmish near the Sweet Water, AL",Skirmish,0,0,0
1188,,1864-03-09,1864-03-09,False,0.288542125604103,-0.705673575838887,,"Skirmish near Nickajack Gap, Ga.",Skirmish,0,0,0
1189,,1864-05-07,1864-05-07,False,0.242348322844598,-0.592699617853902,,"Skirmish near Nickajack Gap, TN",Skirmish,0,0,0
1190,,1862-09-13,1862-09-13,False,0.124302418766852,-0.314928804500418,,"Skirmish near Iuka, Miss.",Skirmish,0,0,0
1191,,1862-09-27,1862-09-27,False,0.264293711599901,-0.669606460251209,,"Skirmish near Iuka, Miss.",Skirmish,0,0,0
1192,,1863-07-07,1863-07-07,False,0.309544422642579,-0.784252277065069,,"Action at Iuka, Miss.",Skirmish,0,0,0
1193,,1864-10-30,1864-10-30,False,0.218844789194645,-0.549847705720687,,"Skirmish at Muscle Shoals , near Florence, Ala.",Skirmish,0,0,0
1194,,1864-01-25,1864-01-25,False,0.0620390380940253,-0.156052009077384,,"Skirmish at Bainbridge Ferry, AL",Skirmish,11,0,11
1195,,1864-10-30,1864-10-30,False,0.0387200909912087,-0.0973959006533845,,"Skirmish at Bainbridge, Tenn.",Skirmish,0,0,0
1196,,1864-04-20,1864-04-20,False,0.140510724558775,-0.342037048838688,,"Skirmish at Waterhouse's Mill, Tenn.",Skirmish,0,0,0
1197,,1862-04-13,1862-04-13,False,0.00693884192558312,-0.0153760905689214,,"Skirmish at Gillett's Farm, Pebbly Run.",Skirmish,0,0,0
1198,,1863-09-12,1863-09-12,False,0.232071854641593,-0.56811553372768,,"Skirmish near Leet's Tan-yard, or Rock Spring, Ga.",Skirmish,0,0,0
1199,,1863-03-15,1863-03-16,False,0.0381807822891179,-0.0986706857212454,,"Skirmishes near Hernando, Miss.",Skirmish,0,0,0
1200,,1863-04-18,1863-04-18,False,0.0210434986039703,-0.0543827630744911,,"Action at Hernando, MS",Skirmish,0,0,0
1201,,1864-10-15,1864-10-15,False,0.271350477517841,-0.701251679044404,,"Skirmish at Hernando, Miss.",Skirmish,0,0,0
1202,GA007,1864-02-24,1864-02-25,False,0.141667801715423,-0.345928760164863,,"Skirmishes at Tunnel Hill, Buzzard Roost, and Rocky Face Ridge .",Skirmish,456,361,95
1203,,1863-06-17,1863-06-17,False,0.27655288437074,-0.717872629888219,,"Attack on transports, Mississippi River, near Commerce, Miss.",Skirmish,0,0,0
1204,,1863-11-26,1863-11-26,False,0.134432892600053,-0.329111048180297,,"Skirmish at Pigeon Hills, Tenn.",Skirmish,0,0,0
1205,,1863-08-29,1863-08-29,False,0.106447401659066,-0.262207334255992,,"Skirmish at Caperton's Ferry, Ala.",Skirmish,0,0,0
1206,,1864-03-29,1864-03-29,False,0.291524361870754,-0.718099498958503,,"Affair at Caperton's Ferry, Ala.",Skirmish,0,0,0
1207,,1864-04-19,1864-04-19,False,0.126726100119239,-0.308548715608901,,"Skirmish at Boiling Springs, Tenn.",Skirmish,3,0,3
1208,,1863-10-11,1863-10-11,False,0.112102310812363,-0.28963060751959,,"Skirmish near Hernando, during expedition from Memphis, Tenn., to Hernando, Miss.",Skirmish,0,0,0
1209,,1864-06-11,1864-06-11,False,0.151583721893023,-0.388068236007324,,"Skirmish at Salem, Miss.",Skirmish,0,0,0
1210,,1863-09-17,1863-09-17,False,0.100869438358581,-0.247005339512082,,"Skirmish at Owens' Ford, West Chickamauga Creek, Ga.",Skirmish,0,0,0
1211,,1864-03-05,1864-03-05,False,0.281366461963079,-0.688032117191951,,"Skirmish at Leet's Tan-yard, Ga.",Skirmish,0,0,0
1212,,1864-02-23,1864-02-23,False,0.0901850640955223,-0.220135206298594,,"Skirmish at Tunnel Hill, GA",Skirmish,0,0,0
1213,,1864-05-05,1864-05-05,False,0.225765618486654,-0.551077514875957,,"Skirmish near Tunnel Hill, GA",Skirmish,0,0,0
1214,,1864-05-06,1864-05-07,False,0.0836196336811086,-0.204109466413493,,"Skirmishes at Tunnel Hill, GA",Skirmish,0,0,0
1215,,1865-03-03,1865-03-03,False,0.294108302237594,-0.71789705353679,,"Skirmish near Tunnel Hill, Ga.",Skirmish,0,0,0
1216,,1862-09-14,1862-09-14,False,0.340693849830517,-0.863591004503398,,"Skirmish at Burnsville, Miss.",Skirmish,0,0,0
1217,,1863-01-03,1863-01-03,False,0.133115687287175,-0.337421735545502,,"Skirmish at Burnsville, Miss.",Skirmish,0,0,0
1218,,1863-06-11,1863-06-11,False,0.204179447767689,-0.517554204410688,,"Skirmish at Burnsville, Miss.",Skirmish,0,0,0
1219,,1863-11-22,1863-11-22,False,0.271515822323586,-0.688238371098224,,"Skirmish at Camp Davies, Miss.",Skirmish,0,0,0
1220,,1862-10-01,1862-10-01,False,0.0976645248192541,-0.249290429957503,,"Skirmish at Ruckersville, Miss.",Skirmish,0,0,0
1221,,1862-10-07,1862-10-07,False,0.018473202379108,-0.0471531763688253,,"Skirmish near Ruckersville, Miss. ",Skirmish,0,0,0
1222,,1864-04-11,1864-04-11,False,0.141553166992343,-0.351411551791683,,"Affair near Kelly's Plantation, Sulphur Springs Road, Ala.",Skirmish,3,3,0
1223,,1864-10-31,1864-10-31,False,0.292683211233297,-0.735416232804501,,"Skirmish near Shoal Creek, Ala.",Skirmish,0,0,0
1224,,1864-11-05,1864-11-06,False,0.0132348836573197,-0.0332548909787436,,"Skirmishes at Shoal Creek, Ala.",Skirmish,0,0,0
1225,,1864-11-09,1864-11-09,False,0.307293991290717,-0.772128296960439,,"Skirmish at Shoal Creek, Ala.",Skirmish,0,0,0
1226,,1864-11-11,1864-11-11,False,0.033101973699156,-0.0831743258988047,,"Skirmish at Shoal Creek, Ala.",Skirmish,0,0,0
1227,,1863-09-13,1863-09-13,False,0.0843392818439087,-0.206315124413876,,"Skirmish during reconnaissance from Lee and Gordon's Mills toward La Fayette, Ga.",Skirmish,0,0,0
1228,,1862-12-01,1862-12-01,False,0.149434518528715,-0.383113239985294,,"Skirmish at Hudsonville, Miss.",Skirmish,0,0,0
1229,,1863-06-21,1863-06-21,False,0.00771998571805293,-0.0197921388592364,,"Skirmish at Hudsonville, Miss.",Skirmish,0,0,0
1230,,1864-02-25,1864-02-25,False,0.219446583370686,-0.562606902251245,,"Affair near Hudsonville, MS",Skirmish,0,0,0
1231,,1863-09-21,1863-09-21,False,0.144011589888887,-0.352614134492487,,"Skirmish at Lookout Church, Ga.",Skirmish,0,0,0
1232,,1862-07-28,1862-07-28,False,0.104143145880882,-0.256377982299128,,"Skirmish at Stevenson, Ala.",Skirmish,0,0,0
1233,,1862-08-31,1862-08-31,False,0.206712580395646,-0.50888182634985,,"Skirmish at Stevenson, Ala.",Skirmish,0,0,0
1234,,1863-09-07,1863-09-07,False,0.225494153859141,-0.555118012785788,,"Skirmish at Stevenson, Ala.",Skirmish,0,0,0
1235,,1863-11-18,1863-11-18,False,0.220551512667972,-0.540810511674897,,"Skirmish at Trenton, Ga.",Skirmish,0,0,0
1236,,1862-08-27,1862-08-27,False,0.199713760120062,-0.507647750220268,,"Skirmish near Kossuth, Miss.",Skirmish,0,0,0
1237,,1864-02-11,1864-02-11,False,0.248234066283602,-0.638408491621637,,"Affair at Raiford's Plantation, near Byhalia, MS",Skirmish,0,0,0
1238,,1864-08-09,1864-08-09,False,0.070159728244955,-0.181029168942587,,"Skirmish at Hurricane Creek, Miss.",Skirmish,0,0,0
1239,,1864-08-13,1864-08-14,False,0.0398879071674471,-0.102920505338491,,"Skirmishes at Hurricane Creek, Miss.",Skirmish,0,0,0
1240,,1864-08-19,1864-08-19,False,0.347364838707141,-0.89628579876307,,"Skirmish at Hurricane Creek, Miss.",Skirmish,0,0,0
1241,,1863-11-01,1863-11-01,False,0.232843679397156,-0.58801774418387,,"Skirmish at Eastport, Tenn.",Skirmish,0,0,0
1242,,1864-10-10,1864-10-10,False,0.0496799878314498,-0.125445705681764,,"Action at Eastport, Miss.",Skirmish,0,0,0
1243,,1862-05-15,1862-05-16,False,0.320342873078419,-0.709112575023607,,"Skirmish near Trenton Bridge, at Young's Cross-Roads, NC",Skirmish,0,0,0
1244,,1863-01-19,1863-01-19,False,0.0708189106804338,-0.156763550576954,,"Skirmish at White Oak Creek, NC",Skirmish,0,0,0
1245,,1863-11-26,1863-11-26,False,0.282132549654875,-0.688842439952853,,"Skirmish in Pea Vine Valley, Tenn.",Skirmish,0,0,0
1246,,1864-05-04,1864-05-04,False,0.0504428250714426,-0.122886992317718,,"Skirmish on the Varnell's Station Road, GA",Skirmish,0,0,0
1247,,1863-09-11,1863-09-11,False,0.0740032478081927,-0.199507654357077,,"Skirmish at Waldron, Ark.",Skirmish,0,0,0
1248,,1863-10-06,1863-10-06,False,0.282022767576004,-0.760313938926213,,"Skirmish at Waldron, Ark.",Skirmish,0,0,0
1249,,1863-12-29,1863-12-29,False,0.136693435062464,-0.368516077375519,,"Attack on Waldron, Ark.",Skirmish,0,0,0
1250,,1864-02-01,1864-02-01,False,0.152605133384621,-0.411412919110342,,"Skirmish at Waldron, Ark.",Skirmish,0,0,0
1251,,1864-05-07,1864-05-07,False,0.117326926387928,-0.285646515374478,,"Skirmish at Varnell's Station, GA",Skirmish,0,0,0
1252,,1864-05-09,1864-05-09,False,0.246878945770222,-0.601056490182163,,"Combat near Varnell's Station, GA",Skirmish,0,0,0
1253,,1864-05-12,1864-05-12,False,0.064677702259532,-0.157465646136319,,"Combat near Varnell's Station, GA",Skirmish,0,0,0
