battleNum,battleDetail,beginDate,endDate,unknownDay,lat,lng,shrtNm,desc,type,killed,usCasTot,csCasTot
2095,,1863-12-18,1863-12-18,False,0.0184022639506243,-0.0385303403593707,,"Skirmish at Indiantown or Sandy Swamp, N. C.",Skirmish,0,0,0
2096,,1864-09-09,1864-09-09,False,0.223189529967746,-0.46644311547332,,"Capture of Steamer Fawn and skirmish at Currituck Bridge, Va.",Skirmish,0,0,0
2097,,1863-12-09,1863-12-13,False,0.0133027295708693,-0.0304846708532458,,"Skirmishes at and near Bean's Station, TN",Skirmish,0,0,0
2098,TN026,1863-12-14,1863-12-14,False,0.184012703414788,-0.421685389192586,,Engagement at Bean's Station,Battle,1015,115,900
2099,,1863-12-15,1863-12-15,False,0.347665397096187,-0.796713572284376,,"Skirmish at Bean's Station, TN",Skirmish,0,0,0
2100,,1863-12-18,1863-12-18,False,0.12376735408796,-0.283626531806737,,"Skirmish at Bean's Station, TN",Skirmish,0,0,0
2101,,1864-06-14,1864-06-14,False,0.0395665749321418,-0.090671166933886,,"Skirmish at Bean's Station, Tenn.",Skirmish,0,0,0
2102,,1863-06-09,1863-06-09,False,0.0584763307012173,-0.138394828717579,,"Skirmish at Dixon Springs, Tenn.",Skirmish,0,0,0
2103,,1863-09-20,1863-09-21,False,0.0626143322197566,-0.141679188880827,,"Skirmishes at Carter's Depot, Tenn.",Skirmish,0,0,0
2104,,1863-09-22,1863-09-22,False,0.30363406381789,-0.687041230869092,,"Skirmish at Carter's Depot, Tenn.",Skirmish,0,0,0
2105,,1864-09-30,1864-10-01,False,0.124877504164149,-0.282563797651686,,"Skirmishes at Carter's Station, Tenn.",Skirmish,0,0,0
2106,,1864-05-29,1864-05-29,False,0.161486624756769,-0.407691617612087,,"Capture of wagon train at Salem, Ark.",Skirmish,0,0,0
2107,,1862-02-18,1862-02-18,False,0.127704732267901,-0.330785964698329,,"Action at Bentonville, Ark.",Skirmish,0,0,0
2108,,1863-08-15,1863-08-15,False,0.166935914291827,-0.432379869689008,,"Skirmish at Bentonville, Ark.",Skirmish,0,0,0
2109,,1865-01-01,1865-01-01,False,0.0262491720641371,-0.0679878481792436,,"Skirmish at Bentonville, Ark.",Skirmish,0,0,0
2110,,1862-03-17,1862-03-17,False,0.0941243799631712,-0.231614514810785,,"Action at Riddle's Point, Mo.",Skirmish,0,0,0
2111,,1863-12-15,1863-12-15,False,0.318222538224138,-0.746256197563765,,"Skirmish near Livingston, Tenn.",Skirmish,0,0,0
2112,,1865-03-18,1865-03-18,False,0.0585423017718941,-0.137286176399464,,"Skirmish at Livingston, Tenn.",Skirmish,0,0,0
2113,,1862-08-13,1862-08-13,False,0.275994561377962,-0.655676965147874,,"Skirmish at or near Gallatin, Tenn.",Skirmish,0,0,0
2114,,1862-11-07,1862-11-07,False,0.237977834449873,-0.565361083513784,,"Skirmish at Gallatin, Tenn.",Skirmish,0,0,0
2115,TN008,1862-12-07,1862-12-07,False,0.214547361004854,-0.508012372280149,Hartsville,Action at Hartsville,Skirmish,2235,2096,139
2116,,1863-04-18,1863-04-18,False,0.268086125086223,-0.634783237335479,,"Skirmish at Hartsville, Tenn.",Skirmish,0,0,0
2117,,1863-04-22,1863-04-22,False,0.07489978215445,-0.177350193623158,,"Skirmish at Hartsville, Tenn,",Skirmish,0,0,0
2118,,1862-02-19,1862-02-19,False,0.180808846272136,-0.382126448279057,,"Skirmish at Winton, NC",Skirmish,0,0,0
2119,,1863-11-06,1863-11-06,False,0.103769608231874,-0.236646341884079,,"Action near Rogersville, Tenn.",Skirmish,0,0,0
2120,,1864-08-21,1864-08-21,False,0.325630760859517,-0.742600166612796,,"Skirmish at Rogersville, TN",Skirmish,0,0,0
2121,,1864-10-08,1864-10-08,False,0.102722518905298,-0.234258457194312,,"Skirmish at Rogersville, Tenn.",Skirmish,0,0,0
2122,,1864-10-08,1864-10-08,False,0.140006831886829,-0.319285243235798,,"Skirmish at Rogersville, Tenn.",Skirmish,0,0,0
2123,,1863-01-15,1863-01-15,True,0.327534670124995,-0.851159419822988,,"Skirmish near Maysville, Ark.",Skirmish,0,0,0
2124,,1863-09-05,1863-09-05,False,0.263320780737621,-0.684287751505626,,"Skirmish near Maysville, Ark.",Skirmish,0,0,0
2125,,1864-05-08,1864-05-08,False,0.187762309079548,-0.487935087909267,,"Skirmish near Maysville, Ark.",Skirmish,0,0,0
2126,,1864-07-20,1864-07-20,False,0.0317369227376102,-0.0824742636680337,,"Skirmishes near Maysville, Ark.",Skirmish,0,0,0
2127,,1862-08-13,1862-08-13,False,0.077932841636463,-0.180847927556534,,"Skirmish at Huntsville, Scott County, Tenn.",Skirmish,0,0,0
2128,,1864-01-19,1864-01-19,False,0.254836029153721,-0.584401895739932,,"Skirmish at Big Springs, near Tazewell, Tenn.",Skirmish,73,73,0
2129,,1863-09-12,1863-09-12,False,0.111090698854188,-0.232896002397046,,"Skirmish at South Mills, N.C. ",Skirmish,0,0,0
2130,NC005,1862-04-19,1862-04-19,False,0.0606451429146708,-0.12704523829682,,Battle of South Mills,Battle,155,127,28
2131,,1863-07-10,1863-07-10,False,0.352029232828507,-0.860760247986015,,"Capture of outpost at Union City, Tenn.",Skirmish,0,0,0
2132,,1863-07-10,1863-07-10,False,0.0861562704515505,-0.21066401822247,,"Capture of outpost at Union City, Tenn.",Skirmish,0,0,0
2133,,1864-03-12,1864-03-12,False,0.243249098023093,-0.594777746877439,,"Skirmish near Union City, Tenn.",Skirmish,0,0,0
2134,,1864-09-02,1864-09-02,False,0.213311631583624,-0.521576493590998,,"Skirmishes at and near Union City, Tenn.",Skirmish,0,0,0
2135,,1863-11-13,1863-11-13,False,0.211795295569415,-0.508449036357574,,"Skirmish at Palmyra, Tenn.",Skirmish,0,0,0
2136,AR001,1862-03-06,1862-03-08,False,0.231533071876084,-0.597529445844399,Pea Ridge,Battle of Pea Ridge,Battle,3384,1384,2000
2137,,1862-03-07,1862-03-07,False,0.262795023306198,-0.645746112963716,,"Engagement at Point Pleasant, Mo.",Battle,0,0,0
2138,,1862-03-18,1862-03-18,False,0.0554836225921971,-0.136335662568128,,"Engagement at Point Pleasant, Mo.",Battle,0,0,0
2139,,1862-07-26,1862-07-26,False,0.0637053391540132,-0.146039513200792,,"Skirmish at Tazewell, Tenn.",Skirmish,0,0,0
2140,,1862-08-06,1862-08-06,False,0.0820638484544954,-0.188124961562552,,"Skirmish near Tazewell, Tenn.",Skirmish,0,0,0
2141,,1863-09-05,1863-09-05,False,0.0986715568935123,-0.226196835726052,,"Skirmish at Tazewell, Tenn.",Skirmish,0,0,0
2142,,1864-01-24,1864-01-24,False,0.122811349560795,-0.281535424558852,,"Skirmish at Tazewell, Tenn.",Skirmish,9,9,0
2143,,1864-12-12,1864-12-12,False,0.0688377420957141,-0.156581985547489,,"Skirmish at Big Creek, near Rogersville, Tenn.",Skirmish,0,0,0
2144,,1862-11-07,1862-11-07,False,0.0565426093487166,-0.134349379695851,,"Skirmish at Tyree Springs, Tenn.",Skirmish,0,0,0
2145,,1862-03-15,1862-04-07,False,0.0590130006022554,-0.144778517812843,,Siege and capture of Island No. 10.,Siege,0,0,0
2146,,1863-10-16,1863-10-16,False,0.328401383704323,-0.805662647340344,,"Skirmish near Island No. 10, Tenn.",Skirmish,0,0,0
2147,,1863-09-20,1863-09-21,False,0.353696895526888,-0.797656041181406,,"Action at Zollicoffer, Tenn.",Skirmish,0,0,0
2148,,1863-09-24,1863-09-24,False,0.316232299381322,-0.713166010808322,,"Skirmish at Zollicoffer, Tenn.",Skirmish,0,0,0
2149,,1863-10-19,1863-10-19,False,0.305408596508906,-0.688756432739298,,"Skirmish at Zollicoffer, Tenn.",Skirmish,0,0,0
2150,,1864-01-25,1864-01-25,False,0.153837723747177,-0.398327001836507,,"Skirmish at Sulphur Springs, Ark.",Skirmish,0,0,0
2151,OK006,1863-07-01,1863-07-02,False,0.173570960199826,-0.452616310330106,,Battle of Cabin Creek,Battle,86,21,65
2152,,1863-07-20,1863-07-20,False,0.226338525395824,-0.590216866532709,,"Skirmish at Cabin Creek, Ind. T.",Skirmish,0,0,0
2153,,1864-09-19,1864-09-19,False,0.287903313385614,-0.750757703283937,,"Action at Cabin Creek, OK",Skirmish,0,0,0
2154,TN002,1862-02-12,1862-02-16,False,0.129016195226988,-0.310590114335809,Fort Donelson,Siege of Fort Donelson,Siege,18661,2832,15829
2155,,1862-08-23,1862-08-23,False,0.102704866427221,-0.247248929875446,,"Skirmish near Fort Donelson, Tenn.",Skirmish,0,0,0
2156,,1862-08-25,1862-08-25,False,0.100114083131369,-0.241011947931729,,"Skirmish at Fort Donelson, Tenn. ",Skirmish,0,0,0
2157,,1863-01-02,1863-01-02,False,0.301633750573741,-0.726144968958437,,"Skirmish near Fort Donelson, Tenn.",Skirmish,0,0,0
2158,,1863-02-03,1863-02-03,False,0.358318993769471,-0.862607497049111,,"Attack on Fort Donelson, Tenn.",Skirmish,0,0,0
2159,,1863-07-29,1863-07-29,False,0.214782822909865,-0.517062384358612,,"Skirmish near Fort Donelson, Tenn.",Skirmish,0,0,0
2160,,1863-02-03,1863-02-03,False,0.20249754390826,-0.487487134499145,,"Attack on Fort Donelson, Tenn.",Skirmish,0,0,0
2161,,1863-07-29,1863-07-29,False,0.210149210033929,-0.505907549491619,,"Skirmish near Fort Donelson, Tenn.",Skirmish,0,0,0
2162,,1863-09-18,1863-09-18,False,0.0340110660935538,-0.0818773246885357,,"Affair near Fort Donelson, Tenn.",Skirmish,0,0,0
2163,,1864-10-11,1864-10-11,False,0.0288200728528241,-0.0693806673400684,,"Skirmish near Fort Donelson, Tenn.",Skirmish,0,0,0
2164,,1864-03-06,1864-03-06,False,0.0521732079069613,-0.127919147079163,,"Affair near Island No. 10, Tenn.",Skirmish,0,0,0
2165,,1862-02-13,1862-02-13,False,0.166065563025015,-0.40062406631871,,"Skirmish near Fort Heiman, Ky.",Skirmish,0,0,0
2166,,1864-02-28,1864-02-28,False,0.181506307133379,-0.441131407291868,,"Skirmish at Dukedom, Tenn. ",Skirmish,1,0,1
2167,,1862-01-17,1862-01-22,False,0.169630280224082,-0.409113806873279,,"Gunboat demonstrations on Fort Henry, Tenn.",Skirmish,0,0,0
2168,TN001,1862-02-06,1862-02-06,False,0.261938431266654,-0.631742331854625,,"Capture of Fort Henry, Tenn.",Battle,0,0,0
2169,,1863-10-27,1863-10-27,False,0.00762906067314401,-0.017350680229018,,"Skirmish at Clinch Mountain, Tenn.",Skirmish,0,0,0
2170,,1862-06-25,1862-06-25,False,0.00837726122745848,-0.0197329462406458,,"Affair near La Fayette Station, Tenn.",Skirmsih,0,0,0
2171,,1863-05-11,1863-05-11,False,0.105127646664868,-0.247632029575948,,"Skirmish at La Fayette, Tenn.",Skirmish,0,0,0
2172,,1863-11-27,1863-11-27,False,0.0747048005572888,-0.17596989914595,,"Skirmish at La Fayette, Ky.",Skirmish,0,0,0
2173,,1863-11-05,1863-11-05,False,0.168016021584616,-0.395767904506694,,"Skirmish at La Fayette, Tenn.",Skirmish,0,0,0
2174,,1863-12-04,1863-12-04,False,0.158168750635023,-0.372572296420787,,"Skirmish at La Fayette, Tenn.",Skirmish,0,0,0
2175,,1863-12-27,1863-12-27,False,0.26518176839158,-0.624645386790449,,"Skirmish at La Fayette, Tenn.",Skirmish,0,0,0
2176,,1864-06-09,1864-06-09,False,0.0268261361233141,-0.0631899480740201,,"Skirmish at La Fayette, Tenn.",Skirmish,0,0,0
2177,,1864-06-23,1864-06-23,False,0.10773614396573,-0.253776440691847,,"Attack on train near La Fayette, Tenn.",Skirmish,0,0,0
2178,,1864-06-29,1864-06-29,False,0.0340635721018564,-0.0802379941128112,,"Skirmish at La Fayette, Tenn.",Skirmish,0,0,0
2179,,1864-08-08,1864-08-08,False,0.166442751973858,-0.392062010204464,,"Skirmish at La Fayette, Tenn.",Skirmish,0,0,0
2180,,1862-11-25,1862-11-25,False,0.0573998798293492,-0.137278103823066,,"Skirmish at Clarksville, Tenn.",Skirmish,0,0,0
2181,,1863-10-28,1863-10-28,False,0.0727231833793773,-0.17392546374624,,"Skirmish at Clarksville, Tenn.",Skirmish,0,0,0
2182,,1864-02-22,1864-02-22,False,0.104031932441184,-0.238099958032633,,"Skirmishes at Powell's Bridge, Tenn.",Skirmish,0,0,0
2183,,1863-09-18,1863-09-18,False,0.232853174976636,-0.526064899641008,,"Skirmish at Kingsport, Tenn.",Skirmish,0,0,0
2184,,1864-10-06,1864-10-06,False,0.236217363532182,-0.53366531786603,,"Skirmish at Kingsport, Tenn.",Skirmish,0,0,0
2185,,1864-12-13,1864-12-13,False,0.141226163464819,-0.319059972092968,,Action at Kingsport. Tenn.,Skirmish,0,0,0
2186,,1862-09-06,1862-09-06,False,0.234246590584636,-0.560096278825905,,"Skirmish at New Providence, [TN?]",Skirmish,0,0,0
2187,,1864-03-28,1864-03-28,False,0.0022719059547183,-0.00530814578003669,,"Skirmish on Obey's River, Tenn.",Skirmish,0,0,0
2188,,1863-11-19,1863-11-19,False,0.109740238973634,-0.24979079170955,,"Skirmish at Mulberry Gap, Tenn,",Skirmish,0,0,0
2189,,1864-07-28,1864-07-28,False,0.25914661456059,-0.589869665178076,,"Skirmish at Long's Mills, near Mulberry Gap, Tenn.",Skirmish,0,0,0
2190,,1861-09-29,1861-09-29,False,0.00707339657944595,-0.0164340497693632,,"Affair at Travisville, TN",Skirmish,0,0,0
2191,,1862-02-24,1862-02-24,False,0.185281825943816,-0.453400222988777,,"Skirmish at New Madrid, Mo.",Skirmish,0,0,0
2192,,1862-03-02,1862-03-02,False,0.10596438442,-0.25930376754526,,"Skirmish near New Madrid, Mo.",Skirmish,0,0,0
2193,,1862-03-03,1862-03-14,False,0.263876642591836,-0.645728354538928,New Madrid,"Siege and capture of New Madrid, Mo.",Siege,0,0,0
2194,,1862-04-08,1862-04-08,False,0.223826678967146,-0.547722722601594,Island No. 10,"Garrison of Island No. 10 surrendered at Tiptonville, Tenn.",Surrender,4532,32,4500
2195,,1863-08-07,1863-08-07,False,0.055859747357088,-0.136693503417224,,"Skirmish at New Madrid, Mo.",Skirmish,0,0,0
2196,,1864-12-03,1864-12-03,False,0.191092328664344,-0.467619012207549,,"Skirmish near New Madrid, Mo.",Skirmish,0,0,0
2197,,1862-06-23,1862-06-23,False,0.204169768470274,-0.526602464256961,,"Skirmish at Pineville, Mo. ",Skirmish,0,0,0
2198,,1862-11-19,1862-11-19,False,0.0574484182204997,-0.148173154278638,,"Skirmish at Pineville, Mo.",Skirmish,0,0,0
2199,,1863-08-13,1863-08-13,False,0.231116158772976,-0.596103623231431,,"Skirmish at Pineville, Mo.",Skirmish,0,0,0
2200,,1863-09-19,1863-09-19,False,0.356596170847055,-0.80087916143235,,"Skirmish at Bristol, Tenn.",Skirmish,0,0,0
2201,,1863-10-15,1863-10-15,False,0.035605407468287,-0.0799661667928826,,"Skirmish at Bristol, Tenn.",Skirmish,0,0,0
2202,,1864-12-14,1864-12-14,False,0.206326953039486,-0.463389600450951,,"Affair at Bristol, Tenn.",Skirmish,0,0,0
2203,,1862-04-29,1862-04-29,False,0.0587178868178112,-0.134232004187581,,Skirmish near Cumberland Gap.,Skirmish,0,0,0
2204,,1862-08-26,1862-08-26,False,0.32675232425239,-0.746972034151003,,"Skirmish at Cumberland Gap, Tenn.",Skirmish,0,0,0
2205,,1862-08-27,1862-08-27,False,0.238324290949405,-0.544821160202566,,"Skirmish near Cumberland Gap, Tenn.",Skirmish,0,0,0
2206,,1863-09-23,1863-09-23,False,0.168245112728728,-0.384616679861379,,"Skirmish at Cumberland Gap, Tenn.",Skirmish,0,0,0
2207,,1863-11-12,1863-11-12,False,0.119313382943315,-0.272756316462388,,"Skirmish near Cumberland Gap, Tenn.",Skirmish,0,0,0
2208,,1864-02-22,1864-02-22,False,0.0978653542384327,-0.223506552024172,,"Skirmish at Gibson's Mills, on Indian Creek, Va.",Skirmish,0,0,0
2209,,1862-02-14,1862-02-14,False,0.329375339836576,-0.752980043970708,,"Skirmish near Cumberland Gap, Tenn.",Skirmish,0,0,0
2210,,1862-04-01,1862-04-01,False,0.051069752561604,-0.126675419945663,,"Skirmish at Doniphan, Mo.",Skirmish,0,0,0
2211,,1863-03-21,1863-03-21,False,0.0405777166752534,-0.100650420292457,,"Affair near Doniphan, Mo.",Skirmish,0,0,0
2212,,1863-06-01,1863-06-01,False,0.0862416381485292,-0.213916844947888,,"Skirmish near Doniphan, Mo.",Skirmish,0,0,0
2213,,1864-09-19,1864-09-19,False,0.29645198767292,-0.735330117133247,,"Affair at Doniphan, Mo.",Skirmish,0,0,0
2214,,1863-04-11,1863-04-11,False,0.223512840906872,-0.469176180286643,,"Skirmish on the South Quay Road, near the Blackwater.",Skirmish,0,0,0
2215,,1863-05-01,1863-05-01,False,0.320701772859315,-0.67329182510228,,Skirmish at South Quay Bridge.,Skirmish,0,0,0
2216,,1864-02-22,1864-02-22,False,0.108762202899267,-0.247997357718717,,"Skirmish at Wyerman's Mills, on Indian Creek, Va.",Skirmish,266,256,10
2217,,1863-05-04,1863-05-04,False,0.246290951565397,-0.515446119994234,,Skirmish at Leesville.,Skirmish,0,0,0
2218,,1863-04-15,1863-04-15,False,0.250100098758493,-0.522359844590624,,Skirmish on the Edenton Road.,Skirmish,0,0,0
2219,,1863-04-24,1863-04-24,False,0.312238392549768,-0.652142078380465,,Skirmish on the Edenton Road.,Skirmish,0,0,0
2220,,1864-03-10,1864-03-10,False,0.328410583583291,-0.797077688465908,,"Guerrilla raid on Clinton, Ky.",Skirmish,0,0,0
2221,,1864-07-10,1864-07-10,False,0.323809509209564,-0.785910527876092,,"Skirmish at Clinton, Ky.",Skirmish,0,0,0
2222,,1862-11-06,1862-11-06,False,0.146833404520798,-0.350558912924895,,"Skirmish at Garrettsburg, Ky.",Skirmish,0,0,0
2223,,1862-06-11,1862-06-11,False,0.114976431403161,-0.294262927710891,,"Skirmish near Cassville, Mo.",Skirmish,0,0,0
2224,,1862-08-21,1862-08-21,False,0.01644275556243,-0.0420824801429884,,"Skirmish at Cassville, Mo.",Skirmish,0,0,0
2225,,1863-07-04,1863-07-04,False,0.342544221818824,-0.876684589639166,,"Skirmish at Cassville, Mo.",Skirmish,0,0,0
2226,,1863-07-27,1863-07-27,False,0.250367336215795,-0.640773282479972,,"Affair near Cassville, Mo.",Skirmish,0,0,0
2227,,1863-09-26,1863-09-26,False,0.228822963951938,-0.585634068462919,,"Skirmish at Cassville, Mo.",Skirmish,0,0,0
2228,,1862-10-31,1862-10-31,False,0.238653267339999,-0.500538297459855,,"Skirmish at Franklin, Va.",Skirmish,0,0,0
2229,,1862-11-18,1862-11-18,False,0.186218429213423,-0.390564338603183,,"Skirmish st Franklin, Va.",Skirmish,0,0,0
2230,,1862-08-31,1862-08-31,False,0.17858118810959,-0.374546407225118,,"Skirmish at Franklin, Va.",Skirmish,0,0,0
2231,,1862-10-03,1862-10-03,False,0.362548982482184,-0.760077336810565,,"Skirmish on the Blackwater, near Franklin, Va.",Skirmish,0,0,0
2232,,1862-12-02,1862-12-02,False,0.0949377577607612,-0.199035279557327,,"Skirmish on the Blackwater, near Franklin, Va.",Skirmish,0,0,0
2233,,1861-07-22,1861-07-22,False,0.334489024189954,-0.849051445658914,,"Skirmish at Forsyth, Mo.",Skirmish,0,0,0
2234,,1863-11-29,1863-11-29,False,0.179556502031612,-0.40673940762628,,"Skirmish near Jonesville, Va.",Skirmish,0,0,0
2235,,1864-01-03,1864-01-03,False,0.243768004861517,-0.552194171604866,,"Skirmish at Jonesville, Va.",Skirmish,0,0,0
2236,,1863-01-02,1863-01-02,False,0.0886473990110728,-0.200808047346713,,"Skirmish at Jonesville, Lee County, Va.",Skirmish,0,0,0
2237,,1863-11-29,1863-11-29,False,0.175019175051171,-0.396461251907326,,"Skirmish near Jonesville, Va.",Skirmish,0,0,0
2238,,1863-12-01,1863-12-01,False,0.175270495243022,-0.397030553630192,,"Skirmish near Jonesville, Va.",Skirmish,0,0,0
2239,,1864-01-03,1864-01-03,False,0.0808837590849314,-0.183221503451875,,"Action at Jonesville, Va.",Skirmish,0,0,0
2240,,1864-01-28,1864-01-29,False,0.160657095388686,-0.363927627626921,,"Skirmishes near Jonesville, Va.",Skirmish,0,0,0
2241,,1864-08-04,1864-08-04,False,0.356646165719667,-0.80789082286456,,"Skirmish near Jonesville, Va.",Skirmish,0,0,0
2242,,1861-09-23,1861-09-23,False,0.353785912463975,-0.820911366256544,,"Affair at Albany, Ky.",Skirmish,0,0,0
2243,,1861-09-29,1861-09-29,False,0.0359801965746463,-0.0834870787323381,,"Affair at Albany, Ky.",Skirmish,0,0,0
2244,,1863-08-18,1863-08-18,False,0.0612522969443645,-0.142127498578876,,"Skirmish near Albany, Ky.",Skirmish,0,0,0
2245,,1865-04-08,1865-04-08,False,0.0562415939739741,-0.122431764918534,,"Action at Martinsville, N. C. [VA?]",Skirmish,0,0,0
2246,,1863-12-13,1863-12-13,False,0.14906087853806,-0.337205699035538,,"Skirmish at Powell's River, near Stickleyville, Va.",Skirmish,0,0,0
2247,,1862-06-06,1862-06-06,False,0.206901607634484,-0.483073654437711,,"Skirmish near Tompkinsville, Ky.",Skirmish,0,0,0
2248,,1862-11-19,1862-11-19,False,0.059531145954041,-0.138993256541958,,"Skirmish near Tompkinsville, Ky.",Skirmish,0,0,0
2249,,1862-11-24,1862-11-24,False,0.340937840655973,-0.796021309378809,,"Skirmish near Tompkinsville, Ky.",Skirmish,0,0,0
2250,,1862-12-01,1862-12-01,False,0.0429553117787712,-0.0899501543429908,,"Skirmish at Beaver Dam Church, Va.",Skirmish,0,0,0
2251,,1864-12-15,1864-12-15,False,0.14742833855373,-0.329258540948897,,"Skirmish near Abingdon, Va.",Skirmish,0,0,0
2252,,1862-10-15,1862-10-15,False,0.182879341545148,-0.382715211681604,,"Skirmish near Carrsville, Va.",Skirmish,0,0,0
2253,,1862-11-17,1862-11-17,False,0.199231049156908,-0.416934753304601,,"Affair near Carrsville, Va.",Skirmish,0,0,0
2254,,1863-05-15,1863-05-15,False,0.359222504252225,-0.751752032756232,,"Skirmish near Carrsville, Va.",Skirmish,0,0,0
2255,,1863-05-16,1863-05-16,False,0.00742599536009314,-0.0155405272250668,,"Skirmish near Carrsville, Va.",Skirmish,0,0,0
2256,,1863-04-17,1863-04-17,False,0.31913561779277,-0.665711843589929,,Skirmishing generally along the lines.,Skirmish,0,0,0
2257,,1863-07-05,1863-07-05,False,0.302166098305814,-0.712387980345035,,"Skirmish at Franklin, Ky.",Skirmish,0,0,0
2258,,1862-02-19,1862-02-19,False,0.0712504997828688,-0.178188756334825,,"Skirmish at West Plains, Mo.",Skirmish,0,0,0
2259,,1863-11-11,1863-11-11,False,0.0396345345252724,-0.0826425125175923,,"Raid on Suffolk, Va.",Skirmish,0,0,0
2260,,1863-06-11,1863-06-11,False,0.00628080989543123,-0.0130962030113617,,"Skirmish near Suffolk, Va.",Skirmish,0,0,0
2261,,1862-12-28,1862-12-28,False,0.05757231746175,-0.120074362181845,,"Skirmish near Suffolk, Va.",Skirmish,0,0,0
2262,,1864-03-09,1864-03-09,False,0.232960508330442,-0.485868655016723,,"Skirmish near Suffolk, Va.",Skirmish,0,0,0
2263,,1862-12-22,1862-12-22,False,0.120917480503703,-0.253190464999971,,"Skirmish at Joyner's Ferry on the Blackwater, Va.",Skirmish,0,0,0
2264,,1863-05-03,1863-05-03,False,0.0112411185419154,-0.0234320226574526,,"Skirmish near Reed's Ferry, Nansemond River. ",Skirmish,0,0,0
2265,,1864-03-10,1864-03-10,False,0.171486248201448,-0.413724004270984,,"Guerrilla raid on Mayfield, Ky.",Skirmish,0,0,0
2266,,1864-05-20,1864-05-20,False,0.100111774029757,-0.241527495415305,,"Skirmish near Mayfield, Ky.",Skirmish,0,0,0
2267,,1863-07-25,1863-07-25,False,0.199031129117414,-0.455929451849968,,"Skirmish at Williamsburg, KY",Skirmish,0,0,0
2268,,1863-04-14,1863-04-14,False,0.258326720657844,-0.538389470881841,,"Engagement at the mouth of West Branch and near the Norfleet House, Nansemond River.",Battle,0,0,0
2269,,1863-06-11,1863-06-11,False,0.0109495126677246,-0.0256778243675639,,"Affair at Scottsville, Ky.",Skirmish,0,0,0
2270,,1863-12-08,1863-12-08,False,0.107152781380917,-0.251285183577666,,"Skirmish near Scottsville, Ky.",Skirmish,0,0,0
2271,,1864-02-27,1864-02-27,False,0.0353580307123784,-0.0869518031187855,,"Affair near Poplar Bluff, Mo.",Skirmish,0,0,0
2272,,1865-04-03,1865-04-03,False,0.216696457409394,-0.475886000443071,,"Skirmish near Hillsville, Va.",Skirmish,0,0,0
2273,,1863-04-15,1863-04-15,False,0.0252345950994015,-0.052559851953779,,Engagement near the Norfleet House.,Battle,0,0,0
2274,,1864-03-06,1864-03-06,False,0.0476158876952999,-0.115412715498987,,"Attack on Union Pickets at Columbus, Ky.",Skirmish,0,0,0
2275,,1864-03-27,1864-03-27,False,0.036067105419696,-0.0874204551916028,,"Skirmish at Columbus, Ky.",Skirmish,0,0,0
2276,,1864-04-11,1864-04-11,False,0.340609356225708,-0.825578449317689,,"Skirmish at Columbus, Ky.",Skirmish,0,0,0
2277,,1864-04-18,1864-04-18,False,0.010593331951864,-0.0256764131873467,,"Skirmish at Columbus, Ky.",Skirmish,0,0,0
2278,,1861-11-11,1861-11-11,False,0.103567193782262,-0.251043664201211,,Engagement at Belmont,Battle,1142,501,641
2279,,1863-10-22,1863-10-22,False,0.167946766870621,-0.397331441399277,,"Skirmish near Volney, Ky.",Skirmish,0,0,0
2280,,1863-04-19,1863-04-19,False,0.116896864185807,-0.243366155205441,,"Capture of Battery Huger, Hill's Point.",Capture,0,0,0
2281,,1863-05-03,1863-05-03,False,0.0470293537065014,-0.0979078098317179,,"Skirmish near Hill's Point, Nansemond River",Skirmish,0,0,0
2282,,1863-01-09,1863-01-09,False,0.050279963310451,-0.104756325444442,,"Skirmish near Providence Church, Va.",Skirmish,0,0,0
2283,,1862-11-12,1862-11-12,False,0.25475923704167,-0.530780847645682,,"Skirmishes at Providence Church, VA",Skirmish,0,0,0
2284,,1862-12-28,1862-12-28,False,0.115746551341738,-0.241153386022989,,"Skirmish near Providence Church, Va.",Skirmish,0,0,0
2285,,1863-05-17,1863-05-17,False,0.242272292309184,-0.504764789556571,,"Skirmish near Providence Church, VA",Skirmish,0,0,0
2286,,1864-06-11,1864-06-11,False,0.335378343321348,-0.746463100292793,,"Skirmish near Midway, Va.",Skirmish,0,0,0
2287,,1862-11-08,1862-11-08,False,0.0186712047632162,-0.0433260632340119,,"Skirmish at Burkesville, Ky.",Skirmish,0,0,0
2288,,1864-12-15,1864-12-15,False,0.223422398542375,-0.496555417387242,,"Skirmish near Glade Springs, Va.",Skirmish,0,0,0
2289,,1862-10-29,1862-10-29,False,6.98253635512629E-05,-0.00014585099547412,,"Skirmish on the Blackwater, Va.",Skirmish,0,0,0
2290,,1864-03-22,1864-03-22,False,0.274497627763729,-0.662320179803956,,"Affair at Fancy Farms, Ky.",Skirmish,0,0,0
2291,,1862-11-14,1862-11-14,False,0.027572540734888,-0.0575842839424905,,"Skirmish at Blackwater Bridge, Va.",Skirmish,0,0,0
2292,,1863-04-23,1863-04-23,False,0.36103542697622,-0.751162802893484,,Affair at Chuckatuck.,Skirmish,0,0,0
2293,,1863-05-03,1863-05-03,False,0.342526081111945,-0.712652642725603,,Skirmish at Chuckatuck.,Skirmish,0,0,0
2294,,1862-12-22,1862-12-22,False,0.0128634314257292,-0.0268196875091163,,"Skirmish near Windsor, Va.",Skirmish,0,0,0
2295,,1863-03-09,1863-03-09,False,0.156391330881778,-0.32606903123801,,"Skirmish near Windsor, Va.",Skirmish,0,0,0
2296,,1864-05-08,1864-05-08,False,0.346470530330146,-0.729089426757929,,"Skirmish at Jarratt's Station, VA",Skirmish,0,0,0
2297,,1863-05-23,1863-05-23,False,0.126645510155659,-0.263759024081209,,"Skirmish at Barber's Cross-Roads, Va.",Skirmish,0,0,0
2298,,1863-09-15,1863-09-15,False,0.0804031159893919,-0.166277713472824,,"Affair near Kempsville, Va.",Skirmish,0,0,0
2299,,1863-07-02,1863-07-02,False,0.252465001526812,-0.586130337008377,,"Skirmish at Marrowbone, Ky.",Skirmish,0,0,0
2300,,1863-04-28,1863-05-02,False,0.279960457865967,-0.644986571902099,,"Skirmishes near Monticello, Ky.",Skirmish,0,0,0
2301,,1863-11-27,1863-11-27,False,0.00652484665203944,-0.0150322602926326,,"Skirmish at Monticello, Ky.",Skirmish,0,0,0
2302,,1862-08-17,1862-08-17,False,0.316809334105457,-0.720596840109872,,"Skirmish at Flat Lick, Ky.",Skirmish,0,0,0
2303,,1863-05-23,1863-05-23,False,0.145959811586455,-0.304283966907209,,"Skirmish at Antioch Church, VA",Skirmish,0,0,0
2304,,1864-12-16,1864-12-16,False,0.00904217948522512,-0.0200123876662553,,"Action at Marion, Va.",Skirmish,0,0,0
