page,year,date,locality,union_troops_engaged,union_killed,union_wounded,union_missing,confederate_killed,confederate_wounded,confederate_missing,remarks
,,May 30th,Hanover Court-House; Virginia,"3d Division, Wilson's, Cavalry Corps, Army of the Potomac",20,100,,,,,"Casualty List, S. G. O"
,,May 30th,"Ashland, Virginia","3d Division, Wilson’s, Cavalry Corps, Army of the Potomac",6,30,,,,,"Casualty List, S. G. O"
,,May 30th,"Old Church, Virginia","1st Division, Torbett’s, Cavalry Corps. Army of the . Potomac",16,74,,,,90 kwm,"Casualty List, S. G. O"
111,,June 1st to l2th,"Cold Harbor, Virginia","Second Corps, Major General W. S. Hancock; Fifth Corps, Major General G. K. Warren; Sixth Corps, Major General H. G. Wright; Ninth Corps, Major General A. E. Burnside, and Cavalry Corps, Major General P. H. Sheridan, —Army of the Potomac, and Eighteenth Corps, Major General Smith, Army of the James",1905,10570,2456,,1200,500,"Appendix to Part I, Medical and Surgical History of the War, page 156. Official Report of Major General U. S. Grant. Casualty List, S. G. O. Among the casualties was Brigadier Generals G. E. Doles and Keitt, C. S. A., and Brookes and Byrnes, U. S. V., killed. Brig. Generals Tyler, Stannard, and Johnson, U. S. V., and Kirkland, Finnegan, Law, and Lane, C. S. A., wounded"
,,June 2d,"Bermuda Hundred, Virginia","Tenth Corps, Major General Q. A. Gillmore, of the Army of Virginia and North Carolina, Major General B. F. Butler",25,100,,,,100,"Casualty List, S. G. O"
,,June 2d,"Engagements at Gaines’s Mills, Salem Church, and Hawe’s Shop, Virginia",Cavalry of the Army of the Potomac,,,,,,,"Included in Cold Harbor, June 1st to 12th"
,,June 3d,"Searcy, Arkansas",Detachment of the 8th Missouri Cavalry,,2,,,,,Official
,,June 3d,"Panther Gap, West Virginia","General Hayes’ Brigade of the 2d Division, Crook’s, of the Army of West Virginia",,,25 kwm,,,25 kwm,"Ohio in the War, Vol. 2, pages 224 and 507"
,,June 3d and 4th,"Ackworth, Georgia","Cavalry of the 2d Division, McCook’s, Army of the Cumberland",,,,,,,"Report of Adjutant General of Wisconsin, 1865, page 591"
,,June 6th,"Buffalo Gap, West Virginia","General Hayes’ Brigade of the 2d Division, Crook’s, of the Army of West Virginia",,,,,,,"Ohio in the War, Vol. 2, page 224"
,,June 5th,"Piedmont, Virginia","Cavalry and Infantry of the Army of West Virginia, commanded by Major General David Hunter",130,650,,460,1450,1060,"Official Report of Major General U. S. Grant. Casualty List, File A, No. 609, S. G. O. Appendix to Part I, Medical and Surgical History of the War, page 228. Also known as Mount Crawford. Gen. W. E. Jones, commanding confederate forces, killed"
,,June 6th,"Lake Chicot, Arkansas","Sixteenth Corps, commanded by Major General A. J. Smith",40,70,70,,,100 kwm,"Casualty List, File A, No. 419, S. G. O. Official reports. Also designated Old River Lake, Ditch Bayou, Columbia and Fish Bayou"
,,June 6th,"Greenland Gap Road, near Moorefield, West Virginia",22d Pennsylvania Cavalry,,12,,,,,"Casualty Return, S. G. O"
,,June 7th,"Ripley, Mississippi",Cavalry advance of Major General S. D. Sturgis’ command,,,,,,,"Engagement during expedition to Guntown, Miss., June 5th to 10th"
,,June 9th,"Point of Rocks, Maryland",2d U. S. Colored Cavalry,2,,,,,,Official
,,June 9th to 30th,"Kenesaw Mountain, Georgia","Fourth Corps. Major General O. O. Howard: Fourteenth Corps, Major General J. M. Palmer; and Twentieth Corps. Major General Joseph E. Hooker, —Army of the Cumberland, Major General George H. Thomas: Fifteenth Corps, Major General John A. Logan; Sixteenth Corps, Major Gen. G. M. Dodge; and Seventeenth Corps, Major General F. P. Blair. —Army of the Tennessee. Major General James B. McPherson: Twenty-third Corps, Army of the Ohio, Major Gen. J. M. Schofield: —Army of the Military Division of the Mississippi, commanded by Major General W. T. Sherman",1370,6500,800,,1100,3500,"Casualty List, S. G. O. Appendix to Part I, Medical and Surgical History of the War, page 299. Also designated Lost Mountain, Nose’s Creek, Marietta, and Big Shanty. Includes the engagements nt Pine Mountain, June 14th; Pine Knob, June 19th; Golgotha, June 16th; Culp’s House, June 22d; and the general assault, June 27th; the cavalry engagements at McAfee Cross Roads. Lattemore’s Mills, June 20th, and Powder Springs, June 20th. Among the casualties were Lieut. General Polk. C. S. A, and Brigadier Gen. C. G. Harker and McCook, U. S. V., killed"
,,June 9th,"Mount Sterling, Kentucky","Cavalry of the Division of Kentucky, commanded by General Burbridge",35,150,,50,200,250,"Casualty List, S. G. O. Attack on Morgan’s raiders"
,,June 9th,"Lafayette, Tennessee",7th Kansas Cavalry,,,,,,,
,,June 10th,"Frankfort, Kentucky",Enrolled Kentucky Militia and citizens,,3,,,5,,Morgan’s raid
,,June 10th and 11th,"Lexington, West Virginia","2d Division. Crook’s. Army of West Virginia, Major General David Hunter",6,18,,,,,
112,,June 10th,"Cano Creek, Alabama",l06th Ohio Volunteers,,2,,3,,,"Skirmish with guerrillas. Ohio in the War, Vol. 2, page 575"
,,June 10th,"Lexington, Kentucky",4th Kentucky Cavalry,,,,,,,"Casualty List, S. G. O. Engagement during Morgan’s raid"
,,June 10th,"Princeton, Kentucky",,,,,,,,
,,June 10th,"Petersburg, Virginia","Cavalry, Brigadier General A. V. Kautz, and portion of the Tenth Corps, Major General Q. A. Gillmore, of the Army of the James",20,67,,,,,"Casualty List, S. G. O. Official reports"
,,June 10th,"Brice’s Cross Roads, near Guntown, Mississippi","4th Missouri, 2d New Jersey, 19th Pennsylvania, 7th and 9th Illinois, 7th Indiana, 3d and 4th Iowa, and 10th Kansas Cavalry. Brigadier Gen. B. H. Grierson; 9th Minnesota, 81st, 95th, 108th, 113th, 114th, and 120th Illinois, 72d and 95th Ohio, and 93d Indiana Volunteers; 1st Illinois, 6th Indiana, and Co. E. 2d Illinois Batteries; 59th (1st Tennessee) and 55th (1st Alabama), U. S. Colored Troops, and Battery F, 2d U. S. Colored Artillery",223,394,1623,131,475,,"Official Report of Major General S. D. Sturgis, commanding"
,,June 10th,"Corinth, Mississippi",2d New Jersey Cavalry,,,,,,,Engagement during the Guntown expedition
,,June 10th,"Cynthiana, Kentucky",168th Ohio (100 days’ men),8,17,280,,,,"Captured by Morgan’s raiders. Ohio in the War, Vol. 2, page 698"
,,June 10th,"Kellar’s Bridge, Licking River, Kentucky","171st Ohio (100 days’ men), commanded by Brigadier General Hobson",13,54,700,,,,"Captured by Morgan’s raiders. Ohio in the War, Vol. 2, page 701"
,,June 10th and 11th,"Old Church, Virginia","3d Division, Wilson’s, Cavalry Corps, Army of the Potomac",,40,,,,,"Casualty List, S. G. O. Included in Cold Harbor"
,,June 11th,"Wilson’s Landing, Virginia",1st U. S. Colored Cavalry,2,,,,,,
,,June 11th,"Cynthiana, Kentucky","Cavalry of the Division of Kentucky, commanded by General Burbridge",,,150 kwm,,300 kw,400,"Casualty List, S. G. O. Attacks on Morgan’s raiders"
,,June 11th,"Ripley, Mississippi","3d and 4th Iowa, 2d New Jersey, and 4th Missouri Cav-alry",,,,,,,"Report of Adjutant General of Iowa, 1864. page 952. Official Report of Major General S. D. Sturgis"
,,June 11th and l2th,"Trevillian Station, Central Railroad, Virginia ","1st Division, Merritt’s, and 2d Division, Gregg's, Cavalry  Corps, Major General Philip Sheridan, —Army of the Potomac",85,490,160,,,370,"Casualty List, S. G. O. Official reports. Brigadier General Rosser, C. S. A., wounded"
,,June 12th,"McAfee's Cross Roads, Georgia",Cavalry of the Army of the Cumberland,,,,,,,"Included in Kenesaw Mountain, June 9th to 30th"
,,June 12th,"Kingsville, Missouri",Scouting party of the 1st Missouri Militia Cavalry,12,,,,,,"Report of Adjutant General of Missouri, 1865, page 448"
,,June 13th,"White Oak Swamp Bridge, Charles City Cross Roads, Virginia","3d Division, Wilson’s, Cavalry Corps, and 2d Division, Crawford’s, Fifth Corps, —Army of the Potomac",50,250,,,,,"Casualty List, S. G O. Also designated Riddle’s Shop"
,,June 13th,"White Post, West Virginia",6th West Virginia Cavalry,,2,,,,,
,,June 14th,"Pine Mountain, Georgia",,,,,,,,"See Kenesaw Mountain, June 9th to 30th"
,,June 14th,"Lexington, La Fayette County, Missouri",Detachment of the 1st Missouri Militia Cavalry,8,1,,,,,"Report of Adjutant General of Missouri, 1865, page 448"
,,June 14th,"Buchanan, near Lexington, Virginia",Advance of the Army of West Virginia,,,,,,,"Major General Hunter, commanding"
113,,June 10th,"Samaria Church, Malvern Hill, Virginia","3d Division, Wilson’s, Cavalry Corps, Army of the Potomac",25,3,100*,,,,"Casualty List, S. G. O"
,,June 15th,"Moscow, Tennessee",55th U. S. Colored Troops (1st Alabama),1,,,,,,Official
,,June 15th,"Baylor’s Farm, Virginia","3d Division, Hinks’, Tenth Corps, Army of the James",,,,,,,"See Petersburg, June 15th to 19th"
,,"June 15th to Apr. 2d, ’65","Siege of Petersburg, Virginia",,,,,,,,
,,June 15th to 19th,"Petersburg, Virginia","Tenth Corps, Major General Q. A. Gillmore; Eighteenth Corps, Major General W. F. Smith, —Army of the James, Major General B. F. Butler: Second Corps, Major General W. S. Hancock; Fifth Corps, Major General G. K. Warren; Sixth Corps, Major General H. G. Wright; and Ninth Corps, Maj. General A. E. Burnside, —Army of the Potomac, Major General G. G. Meade",1298,7474,1814,,,,"Appendix to Part I, Medical and Surgical History of the War, page 164. Casualty List,, S. G. O. Official Report of Major General U. S. Grant. Includes the engagements at Baylor’s Farm, June 15th; Walthal and Wier Bottom Church, June 16th"
,,June 16th,"West Point, Arkansas",9th Iowa Cavalry,1,,3,,,,Official
,,June 16th,"Otter Creek, near Liberty, Virginia","Advance of the Army of West Virginia, Major General D. Hunter",3,15,,,,25,Report of Adjutant General of West Virginia
,,June 16th,"Wier Bottom Church, Virginia","2d Division, Foster’s, Tenth Corps, Army of the James",,,,,,,"See Petersburg, June 15th to 19th"
,,June 16th,"Golgotha, Georgia",Twentieth Corps,,,,,,,"Casualty List, S. G. O. Included in Kenesaw Mountain"
,,June 16th,"Walthal, Virginia","1st Division, Terry’s, Tenth Corps, Army of the James",,,,,,,"See Petersburg, June 15th to 19th"
,,June 16th,"Pierson’s Farm, Virginia",36th U. S. Colored Troops,2,,,,,,Official
,,June 17th,"Nose’s Creek, Georgia",,,,,,,,"Included in Kenesaw Mountain, June 9th to 30th"
,,June 17th and 18th,"Lynchburg, Virginia","1st Division, Sullivan’s, 2d Division, Crook’s, and Averill’s and Duffle’s Cavalry, —Army of West Virginia, commanded by Major General D. Hunter",100,500,100,,,200 kwm,"Casualty List, File A, No. 324, S. G. O"
,,June 19th,"Pine Knob, Georgia",,,,,,,,"Included in Kenesaw Mountain, June 9th to 30th"
,,June 19th,"Kearsarge and Alabama, off Cherbourg, France",U. S. steamer Kearsarge,,3,,9,21,70,"Official Report of Captain John A. Winslow, U. S. Navy, commanding the Kearsarge"
,,June 20th,"White House, Virginia","Brigade of Union troops, commanded by Brigadier General Abercrombie",,,,,,,
,,June 20th,"Liberty, Virginia","2d Division, Averill's, Cavalry, Army of West Va.",,,,,,,
,,June 20th,"Powder Spring, Georgia",Cavalry of the Army of the Cumberland,,,,,,,"Included in Kenesaw Mountain, June 9th to 30th"
,,June 20th,"Lattemore’s Mills, Noonday Creek, Ga.",Cavalry of the Army of the Cumberland,,,,,,,"Included in Kenesaw Mountain, June 9th to 30th"
,,June 20th to 30th,Trenches in front of Petersburg,"Fifth and Ninth Corps, Army of the Potomac, and Tenth and Eighteenth Corps, Army of the James",112,506,800,,,,"Official Report of Lieutenant General U. S. Grant. Appendix to Part I, Medical and Surgical His-tory of the War. page 164. Generals Chamber-lain and Egan, U. S. V., wounded"
,,June 21st,"Salem, Virginia","Averill’s Cavalry, 2d Division, Army of West Va.",6,10,,,10 kw,,
,,July 21st,"Pine Bluff, Arkansas",27th Wisconsin,,,,,,,
,,June 21st,Naval engagement on the James River near Dutch Gap,,,,,,,,
,,June 21st,"White House Landing, Virginia","Portion of the 1st and 2d Divisions, Cavalry Corps, Army of the Potomac",,30,,,,,"Casualty List, S. G. O. Appendix to Part I. Medical and Surgical History of the War, p. 180"
,,June 21st,"Buford’s Gap, Virginia","23d Ohio Volunteers, of the Army of West Virginia",15,,,,,,
114,,June 22d,"White River, Arkansas","Three companies of the l2th Iowa, and U. S. steamer Lexington",2,4,2,2,3,3,"Report of Adjutant General of Iowa, 1864, p. 1079. Official Report of Ensign H. Booby, U. S. N"
,,June 22d to 30th,"Wilson’s raid on the Weldon Railroad, Virginia","Cavalry of the Army of the James, Brigadier General A. V. Kautz, and 3d Cavalry Division, Army of the Potomac, Major General Wilson, commanding",76,265,700,,300,,"Casualty Lists, S. G. O. Appendix to Part I, Medical and Surgical History of the War, page 164"
,,June 22d,"Culp's House, Georgia",,,,,,,,"Included in Kenesaw Mountain, June 9th to 30th"
,,June 22d,"Ream’s Station, Virginia","Kautz’s Cavalry, Army of the James, 3d Division, Cavalry, Army of the Potomac, Major General Wilson",,,,,,,"Casualty List, S. G. O. Wilson’s raid, June 22d to 30th"
,,June 22d and 23d,"Weldon Railroad, Virginia","Second Corps, Birney, Sixth Corps, Wright, and the 1st Division, Gibbons, of the Fifth Corps, —Army of the Potomac, Major General George G. Meade",604,2494,2217,,300 kw,200,"Also designated Williams’ Farm. Davis’ Farm, and Jerusalem Plank Road. Official Report of Lieut. General U. S. Grant. Casualty List. S. G. O. Appendix to Medical and Surgical History of the War, page 104"
,,June 23d,"Nottoway Court-House, Virginia","3d Cavalry Division, Wilson’s, Army of the Potomac",16,52,34,15,50,,"Casualty List, S. G. O. Wilson’s raid on the Weldon Railroad, June 22d to 30th"
,,June 23d,"Colliersville, Mississippi",Train on the Charlestown and Mississippi Railroad,2,8,5,,,,"Army and Navy Journal, Vol. I, page 786"
,,June 23d,"Jones’ Bridge, Virginia","1st Division, Torbett’s, and 2d Division, Gregg’s, Cavalry Corps, Army of the Potomac, and 28th U. S. Colored Troops",14,45,100,,,50 kwm,"Casualty List, S. G. O. Appendix to Part I, Medical and Surgical History of the War, page 180"
,,June 24th,"Samaria Church, Virginia","1st Division, Torbett’s, and 2d Division, Gregg’s, Cavalry Corps, Army of the Potomac",40,190,200,,200 kw,,"Casualty List, S. G. O. Appendix to Part I, Medical and Surgical History of the War, page 180"
,,June 24th,"White River, Arkansas",U. S. steamer Queen City and gunboats,,40,,,,,"Army and Navy Journal, Vol. I, page 786"
,,June 24th,"Staunton Bridge, Virginia","3d Division, Wilson’s. Cavalry Corps, Army of the Potomac, and Kautz’s Cavalry, Army of the James",,,,,,,"Casualty List, S. G. O. Wilson’s raid on the Weldon Railroad, June 22d to 30th"
,,June 24th,"La Fayette, Macon County, Tennessee",,,,,,,100 kw,
,,June 25th,"Point Pleasant, Louisiana",64th U. S. Colored Troops,,,,,,,Official
,,June 25th to 29th,"Clarendon, St. Charles River, Arkansas","11th Missouri, 9th Iowa, and 3d Michigan Cavalry, 126th Illinois Volunteers, and Battery D, 2d Missouri Artillery",,200,,,200,200,"Report of Adjutant General of Iowa, 1867, Vol. II, page 561. Also known as Pikesville and Saint Charles"
,,June 27th,Kenesaw Mountain (general assault),"Fourth Corps, Major General O. O. Howard; Fourteenth Corps. Major General J. M. Palmer; Twentieth Corps, Major Gen. Joseph E. Hooker, and Cavalry. —Army of the Cumberland. Major General Geo. H. Thomas’: Fifteenth Corps. Major General John A. Logan; Sixteenth Corps, Major Gen. G. M. Dodge; and Seventeenth Corps, Major General F. P. Blair, —Army of the Tennessee, Major General James B. McPherson: Twenty-third Corps, and Cavalry, —Army of the Ohio, Major General J. M. Schofield",,3000 kw,,,600 kw,,"Casualty Lists, S. G. O. Appendix to Part I, Medical and Surgical History of the War, page 301. Included in Kenesaw Mountain. June 9th to 30th. Generals Harker and McCook, U. S. V., killed"
,,June 27th,"Charlestown, West Virginia","1st Division, Army of West Virginia",,7,,,,,"Casualty List, S. G. O"
,,June 28th,"Stoney Creek, Virginia","Cavalry, Army of the James, Kautz’s, and 3d Division, Cavalry, Wilson’s, Army of the Potomac",,,,,,,"Casualty List. S. G. O. See Wilson’s raid on the Weldon Railroad, June 22d to 30th"
,,June 29th,"Ream's Station, Virginia","Cavalry, Army of the James, Kautz’s, and 3d Division, Cavalry, Wilson’s, Army of the Potomac",,,,,,,"Casualty List, S. G. O. See Wilson’s raid on the Weldon Railroad, June 22d to 30th"
115,,June ---,"La Fayette, Georgia",4th and 6th Kentucky Cavalry,,,,,,,"Report of Adjutant General of Kentucky, Vol. I page 465"
,,July 1st to 31st,"Front of Petersburg, Virginia","Second, Fifth, and Ninth Corps, Army of the Potomac, Major Gen. G. G. Meade, and Tenth and Eighteenth Corps, Army of the James, Major Gen. B. F. Butler",419,2076,1200,,,,"The losses at the crater July 30th, and Deep Bottom, July 27th, not included. Casualty Lists, S. G. O"
,,July 2d,"Pine Bluff, Arkansas",64th U. S. Colored Troops,6,,1,,,,Official
,,July 2d,"Saulsbury, Mississippi",3d Iowa Cavalry,,,,2,3,,"Report of Adjutant General of Iowa, 1864, p. 955"
,,July 2d,"Fort Johnson, James’ Island, South Carolina",Troops of the Department of the South,19,97,135,,,,"Casualty Return, S. G. O"
,,July 2d to 5th,"Nickajack Creek, Georgia","Army of the Cumberland, Major General George H. Thomas; Army of the Tennessee, Major General J. B. McPherson, —Grand Army of the Mississippi, Major General W. T. Sherman",60,310,,,100 kw,,"Appendix to Part I, Medical and Surgical History of the War, page 304. Casualty List, S. G. O. Official reports. Also known as Smyrna and Vining Station"
,,July 3d,"Platte City, Missouri",9th Missouri Militia Cavalry,,2,70,,,,Official
,,July 3d,"North Mountain, Virginia","Outpost of the 135th Ohio National Guards, of Sigel’s command",,,300,,,,"Ohio in the War, Vol. 2, page 664"
,,July 3d to 9th,"Expedition from Vicksburg to Jackson, Mississippi","Troops of the 1st Division, Seventeenth Corps, commanded by Major General Dennis",,150,,,200,,The Confederate General Gholson was wounded
,,July 3d,"Leetown, Virginia","1st New York Cavalry and 10th West Virginia Volunteers, commanded by Major General Sigel",3,12,17,,,,"Casualty List, File A, No. 429, S. G. O"
,,July 3d,"Hammack’s Mills, North River, West Va.",153d Ohio National Guards,3,7,,,,,"Ohio in the War, Vol. 2, page 684"
,,July 4th,"Searcy, Arkansas",Detachment of the 3d Arkansas Cavalry,,,,7,4,56,Official Report of Major General Steele
,,July 4th,"Vicksburg, Mississippi",48th U. S. Colored Troops (10th Louisiana),1,7,2,,,,Official
,,July 4th,"Clay County, Missouri",9th Missouri Militia Cavalry,2,2,,,,,Official
,,July 4th,"Clinton, Mississippi","2d Wisconsin Cavalry, advance of the 1st Division, Seventeenth Corps, commanded by Major General Dennis",,,,,,,"Engagement during Dennis’s expedition to Jackson, Mississippi"
,,July 4th,"Point of Rocks, Maryland",Maryland Potomac Home Brigade,,,,,,,"Casualty List, File A, No. 429, S. G. O"
,,July 4th and 5th,"Coleman’s Plantation, near Port Gibson, Mississippi",52d U. S. Colored Troops (2d Mississippi) and Mississippi Marine Brigade,6,18,15,,,,Official
,,July 5th to 18th,"Smith’s expedition from La Grange, Tennessee, to Tupelo, Mississippi","1st and 3d Divisions, Sixteenth Corps, Major General J. A. Mower; Cavalry Brigade, Brig. General B. H. Grierson; and one brigade U. S. Colored Troops",,,,,,,"Commanding expedition. Casualty Lists, S. G. O"
,,July 5th to 7th,"John’s Island, South Carolina","Troops of the Department of the South, Major General Foster",16,82,12,20,80,,Official
,,July 5th,"Hagerstown, Pleasant Valley, Maryland","1st Maryland Cavalry, Potomac Home Brigade, commanded by Major Cole",2,6,25,,,,"Casualty List, File A, No. 429, S. G. O"
,,July 5th and 6th,"Jackson, Mississippi","2d Wisconsin, 5th and 11th Illinois, and 3d U. S. Colored Cavalry, and 46th, 76th, and 79th Illinois Volunteers, of the 1st Division, Seventeenth Corps",,,,,,,"Engagement during the return of Major General Dennis’s expedition from Vicksburg to Jackson, Mississippi"
,,July 6th,"Little Blue, Missouri",2d Colorado Cavalry,8,1,,,,,Official
,,July 6th,"Mount Zion Church, Virginia",2d Massachusetts Cavalry,8,8,38,,5,,"Partizan Life with Mosby, page 249. Report of Adjutant General of Massachusetts"
,,July 4th to 7th,"Bolivar and Maryland Heights, Virginia","Reserve Division of the Army of West Virginia, Major General Sigel, commanding",20,80,,,,,"Casualty List, File A, No. 429, S. G. O"
116,,July 6th to 10th,"Chattahoochie River, Georgia","Army of the Ohio, Major Gen. J. M. Schofield; Army of the Tennessee, Major General J. B. McPherson; Army of the Cumberland, Major General George H. Thomas, —Army of the Military Division of the Mississippi, Major General W. T. Sherman",80,450,200,,,600 kwm,"Casualty Lists, S. G. O. Appendix to Part I, Medical and Surgical History of the War, page 301. Official reports"
,,July 7th,"Hagar’s Mountain and Middleton, Maryland",8th Illinois Cavalry and Alexander’s Baltimore Battery,,,,,,,Official Report of Colonel Clendenin
,,July 7th,"Clinton, Mississippi","11th Illinois and 2d Wisconsin Cavalry, and Battery of the 2d Illinois Artillery",,,,,,,"Engagement during the return of Dennis’s expedition from Vicksburg to Jackson, Mississippi"
,,July 7th,"Solomon's Gap, Frederick City, Maryland","8th Illinois Cavalry, 3d Maryland Potomac Home Brigade, and Alexander’s Baltimore Battery",5,20,,,,,Official Report of Major General Lew Wallace
,,July 7th,"Ripley, Mississippi",2d Iowa Cavalry,,4,,10,,,"Report of Adjutant General of Iowa, 1864, p. 933. Engagement during Smith’s expedition to Tupelo, July 5th to 18th"
,,July 9th,"Monocacy, Maryland","1st and 2d Brigades of the 3d Division, Sixth Corps, Major General J. B. Ricketts, and detachment of the Eight Corps, Brigadier General E. B. Tyler",90,579,1290,,400,,"Casualty List, File A, No. 603, S. G. O. Official Report of Major General Lew Wallace, commanding"
,,July 11th to 22d,Roseau's raid in Alabama and Georgia,"8th Indiana, 5th Iowa, 9th Ohio, 2d Kentucky, and 4th Tennessee Cavalry, and Battery E, 1st Michigan Artillery",3,30,,,,,"Casualty List, S. G. O. Includes engagements at Ten Islands, July 14th; Stone’s Ferry, 15th; Auburn, 18th; and Chewa Station, 20th"
,,July 11th,"Pontotoc, Mississippi","8th Wisconsin, 5th Minnesota, and 11th Missouri Volunteers. and 2d Iowa Cavalry, of Major General A. J. Smith’s forces",,,,,,,"Engagement during Smith’s expedition to Tupelo, July 5th to 18th. •"
,,July 12th,"Fort Stevens, Washington, D. C.","1st and 2d Divisions, Sixth Corps, Twenty-second Corps, convalescents, Marines, Home Guards, and citizens, commanded by Major General Augur",54,319,,,,500 kwm,"Casualty Return, File F, No. 106, S. G. O"
,,July 12th,"Petit Jean, Arkansas River, Arkansas",One company of the 3d Arkansas Cavalry,,,,2,8,,Official Report of Major General F. Steele
,,July 12th,"Lee’s Mills, near Ream’s Station, Va.","2d Division, Gregg’s, Cavalry Corps, Army of the Potomac",3,13,30,,,25 kwm,"Casualty List, S. G. O"
,,July 13th to 15th,"Tupelo, Mississippi","1st and 3d Divisions, Sixteenth Corps, Major General J. A. Mower; Cavalry, Brigadier General B. H. Grierson; and a Brigade of Colored Troops, Major General A. J. Smith, commanding",85,563,,100,600,,"Casualty List, File A, No. 202, S. G. O. Official reports. Includes the engagements at Harrisburg, July 13th, and Old Town Creek, July 15th"
,,July 14 th and 15th,"Ozark, Missouri",14th Kansas Cavalry,2,1,,,,,Official
,,July 14th,"Ten Islands, Coosa River, Alabama",8th Indiana and 5th Iowa Cavalry,,,,15,40,22,"Also designated Jackson’s Ford. Engagement during Rosseau’s raid, July 11th to 22d"
,,July 14th,"Farr’s Mills, Montgomery County, Ark.",A battalion of the 4th Arkansas Cavalry,1,7,,4,6,,Official Report of Major General F. Steele
,,July 15th,"Stone’s Ferry, Tallapoosa River, Ala.",,,,,,,,"Engagement during Rosseau’s raid in Alabama and Georgia, July 11th to 22d"
,,July 16th and 17th,"Grand Gulf, Port Gibson, Mississippi","72d and 76th Illinois Volunteers, 2d Wisconsin Cavalry, and 53d U. S. Colored Troops, of the Seventeenth Corps, Major General Slocum",,,,,,,"Report of Adjutant General of Illinois, Vol. II, page 210"
,,July 17th,"Snicker’s Gap, Virginia","Army of West Virginia, Major General Crook",,,,,,,
117,,July 17th,"Fredericksburg, Missouri",2d Colorado Cavalry,6,1,,,,,Official
,,July 18th,"Auburn, Georgia",9th Ohio and 4th Tennessee Cavalry,,,,,,,"Engagement during Rosseau’s raid in Alabama and Georgia, July 11th to 22d"
,,July 18th,"Chewa Station, Montgomery and West Point Railroad, Georgia","8th Indiana, 5th Iowa, and 4th Tennessee Cavalry",,,,,,40 kwm,"Engagement during Rosseau’s raid in Alabama and Georgia, July 11th to 22d"
,,July 18th,"Snicker’s Ferry, Island Ford, Shenandoah River, Virginia","Army of West Virginia, Major General Crook, and a portion of the Sixth Corps, Major General Wright",30,181,100,,,,"Official reports. Casualty Returns, S. G. O"
,,July 18th,"Ashby’s Gap, Virginia","Cavalry of the Army of West Virginia, Brigadier Gen. Duffle",,,200 kwm,,,,
,,July 19th,"Darksville, Virginia","Portion of the Army of West Virginia, commanded by General Averill",,,,,,,
,,July 20th,"Winchester, Virginia","2d Cavalry Division, Army of West Virginia, commanded by Brigadier General Averill",37,175,30,,300,200,"Casualty List. S. G. O. General Dilly, C. S. A., was wounded. Also designated Stevenson’s Depot and Carter's Farm"
