page,year,date,locality,union_troops_engaged,union_killed,union_wounded,union_missing,confederate_killed,confederate_wounded,confederate_missing,remarks
,,Oct. 24th,"Blackwater, Virginia","1st New York Mounted Rifles, 39th Illinois and 62d Ohio Volunteers, and other troops commanded by Brigadier General Terry",1,,,3,,,"Ohio in the War, Vol. 2, page 369"
,,Oct. 24th,"Morgantown, Kentucky",,,,,,,16,Newspaper report
,,Oct. 27th,"Pittman’s Ferry, Missouri","23d Iowa and 24th and 25th Missouri Volunteers, 1st Missouri Militia, and 12th Missouri Cavalry",,,,,,40,"Report of Adjutant General of Iowa, 1863, p. 825. Official Report of Colonel Wm. Dewey"
,,Oct. 27th,"Labadiesville, Louisiana","8th New Hampshire, 12th and 13th Connecticut, and 75th New York Volunteers. 1st Louisiana Cavalry, and 1st Maine Battery, commanded by Brig. General G. Weitzel",18,68,,6,15,208,"Official Report of Major General B. OF. Butler, U. S. V. Also known as Thibodeauxville and Georgia Landing"
,,Oct. 28th,"Cross Hollows, Fayetteville, Arkansas","One division of the Army of the Frontier, commanded by Brigadier General Herron",,5,,8,7,,Official. Also known as Oxford Bend
,,Oct. 28th,"Clarkson, Missouri","Detachments, commanded by Captain Rodger’s, 2d Illinois Artillery",,,,10,2,45,"Report of Adjutant General of Illinois, Vol. III, page 202"
,,Oct. 28th,"Williamsburg, Kentucky",,,,,,,,
,,Oct. 29th,"Butler and Osage, Missouri",1st Kansas Colored Troops (79th U. S. C. T. ),9,9,,,30 kw,,"Casualty List, File A, No. 570, S. G. O. Official. Also known as Island Mounds"
,,Oct. 31st,"Aldie, Virginia","1st New Jersey and 2d New York Cavalry, of General Bayard's Cavalry Brigade, Army of the Potomac",,,,,,,"New Jersey in the Rebellion, page 433"
,,Oct. 31st,"Franklin, Virginia",,,,,,,,"Rebellion Record, Vol. VI, page 9"
,,Nov. 1st,"Philomont, Virginia","Cavalry of the Army of the Potomac, commanded by General Pleasonton",1,14,,5,10,,Official Report of Major General McClellan
,,Nov. 2d and 3d,"Bloomfield and Union, Loudoun County, Virginia","Cavalry advance of the Army of the Potomac, commanded  by General Pleasonton",2,10,,3,15,,Official Report of Major General McClellan
,,Nov. 2d,"Snicker’s Gap, Virginia","Batteries of the Second Corps, Army of the Potomac",,16,,,,,
62,,Nov. 3d,"Upperville, Virginia","Cavalry advance of the Army of the Potomac, commanded  by General Pleasonton",,5,,3,10,,Official
,,Nov. 3d,"Rawles’ Mills, Williamston, North Carolina","24th and 44th Massachusetts and 9th New Jersey Volunteers , and New York and Marine Batteries",6,8,,,,5,"Official Report of Major General J. G. Foster, commanding. Also called Little Creek"
,,Nov. 3d,"Bayou Teche (14 miles from Brashear City), Louisiana","Union gunboats Kinsman. Estelle. St. Mary, Calhoun, and Diana, and 2st Indiana Volunteers",6,7,,,,,"Report of Adjutant General of Indiana, Vol. II, page 208"
,,Nov. 3d,"Harrisonville, Cass County, Missouri",5th and 6th Missouri Cavalry,10,3,6,6,20,,Official
,,Nov. 5th,"Lamar, Missouri",8th Missouri and 8th Missouri Militia Cavalry,2,2,,,,,Official
,,Nov. 5th,"Manassas Gap, Virginia","Cavalry Brigade, advance of the Army of the Potomac, commanded by General Averill",,,,,,,Official Report of Major General McClellan
,,Nov. 5th,"Barbee's Cross Roads and Chester Gap, Virginia","Cavalry Brigade, Army of the Potomac, commanded by General Pleasonton",5,10,,36,,,Official. Also called Markham
,,Nov. 5th,"Greenville Road, Kentucky",8th Kentucky Cavalry,,,,8,,,
,,Nov. 5th,"New Baltimore, Salem, and Thorough-fare Gap, Virginia","Cavalry Brigade, advance of the Army of the Potomac, commanded by General Bayard",,,,,,,Official
,,Nov. 5th,"Nashville, Tennessee","16th and 51st Illinois, 69th Ohio, 14th Michigan, and 78th Pennsylvania Volunteers, and 5th Tennessee and 7th Pennsylvania Cavalry",,26,19,,,23,"Official Report of Brigadier General James S. Negley, commanding"
,,Nov. 6th,Leatherwood. Kentucky,Captain Ambrose Powell’s command,,,,7,,,"Rebellion Record, Vol. VI, pago 12"
,,Nov. 6th,"Garrettsburg, Kentucky",8th Kentucky Cavalry,,,,17,85,60,
,,Nov. 7th,"Rhea’s Mills, Arkansas",3d Kansas Indian Home Guards,3,3,,,,,Official
,,Nov. 7th,"Big Beaver Creek, Missouri",10th Illinois and two companies Missouri Militia Cavalry,,,300,,,,"Rebellion Record, Vol. VI, page 12"
,,Nov. 7th,"Marianna, Arkansas",3d and 4th Iowa and 9th Illinois Cavalry,3,20,,,,50 kwm,"Report of Adjutant General of Illinois, Vol. III, page 96. Also called La Grange"
,,Nov. 8th,"Rappahannock Bridge, Virginia","Cavalry Brigade, Army of the Potomac, commanded by General Bayard. ‘",,8,,,,,
,,Nov. 8th,"Hudsonville, Mississippi",7th Kansas and 2d Iowa Cavalry,,,,16,,185,"Rebellion Record. Vol. VI, Doc. 39, page 189. Also known as Cold Water"
,,Nov. 9th,"Fredericksburg, Virginia",1st Indiana Cavalry,1,,4,3,,39,Official Report of Captain Ulric Dahlgren
,,Nov. 9th,"Moorefield, Virginia","1st New York, Ringgold, and Washington Cavalry, and 23d Illinois Volunteers",,5,,,,50,"Official Report of Brigadier General B. F. Kelley. Also called South Fork, Potomac"
,,Nov. 9th,"Perry County, near Kentucky River, Kentucky",14th Kentucky Cavalry,,,,3,,,"Rebellion Record, Vol. VI, page 14"
,,Nov. 11th,"Huntsville, Tennessee",Tennessee Home Guards,,,,4,,,"Rebellion Record, Vol. VI, page 14"
,,Nov. 11th,"New Berne, North Carolina",,,,,,,,Newspaper report. Also known as Bachelor’s Creek
,,Nov. 11th,"Lebanon, Tennessee",1st Kentucky and 4th Michigan Cavalry,,,,,,125,Report of Adjutant General of Kentucky. Also designated La Grange
63,,Nov. 12th,"Lamar and Holly Springs, Mississippi","2d Illinois, 3d Michigan, 2d Iowa, and 7th Kansas Cav",,,,4,,,Official
,,Nov. 15th,"Fayetteville and White Sulphur Springs, Virginia","1st and 2d Brigades, Sturgis’s Division, Ninth Corps, and Cavalry, Army of the Potomac",,,,,,,Report of Adjutant General of Maine. Also known as Little Washington
,,Nov. 17th,"Gloucester, Virginia",104th Pennsylvania Volunteers ,1,3,2,,,,"Rebellion Record, Vol. VI, page 16"
,,Nov. 18th,"Cove Creek, North Carolina",3d New York Cavalry,,,,,,,Newspaper report
,,Nov. 18th,"Rural Hills, Tennessee",8th Kentucky Cavalry,,,,16,,,Newspaper statement
,,Nov. 21st,"Bayou Bontecou, near Fort Pike, La.",31st Massachusetts Volunteers,,1,,4,,,Newspaper statement
,,Nov. 24th,"Beaver Creek, Texas County, Missouri",3d Missouri Cavalry and 21st Iowa Volunteers,6,10,22,5,20,,Official
,,Nov. 25th,"Camp Babcock, Arkansas",3d Kansas Indian Home Guards,1,1,,,,,Official
,,Nov. 25th,"Crawford County, Missouri",Missouri Enrolled Militia,,,,,,,Official
,,Nov. 26th,"Cold Knob Mountain, Virginia","2d West Virginia Cavalry, commanded by Colonel J. C. Paxton",,,,2,2,111,Official. Also known as Sinking Creek and Frankfort
,,"Nov., 26th","Summerville, Mississippi",7th Illinois Cavalry,,,,,,28,"Rebellion Record, Vol. VI, page 19"
,,Nov. 27th,"Carthage, Arkansas",2d Kansas Cavalry,1,,1,,,,Official
,,Nov. 27th,"Scrougesville and La Vergne, Tennessee","5th Brigade, Sill’s Division, Army of the Ohio",,10,,,,,Newspaper report
,,Nov. 28th,"Cane Hill, Boston Mountains, and Boonsboro’, Arkansas","1st Division, Army of the Frontier, commanded by Brigadier General James G. Blunt",4,36,,75,300,60,Official Report of Major General H. W. Halleck
,,Nov. 28th,"Little Bear Creek, Alabama","Portion of the 2d Division, Sixteenth Corps",4,14,,,,70,"Report of Adjutant General of Iowa, 1865, p. 157"
,,Nov. 28th,"Hartwood Church, Virginia",3d Pennsylvania Cavalry,4,9,200,,,,Official
,,Nov. 29th,"Cold Water River, Mississippi",1st Indiana Cavalry,,,,3,5,,Official Report of General C. C. Washburne
,,Nov. 29th and 30th,"Waterford and Lumkin's Mills, Miss.",Advance Cavalry of General Grant's Army,,,,,,,
,,Nov. 30th,"Stahel’s reconnoissance to Snicker’s Ferry, and Berryville, Virginia",,,,,,,,Official Report of Major General OF. Sigel
,,Dec. 1st,"Charleston and Berryville, Virginia","2d Division, Twelfth Corps",,,,5,18,,"Official Report of Brigadier General J. W, Geary"
,,Dec. 2d,"Franklin, Virginia",11th Pensylvania Cavalry,,,,,,20,Newspaper report
,,Dec. 2d,"King George Court-House, Virginia",8th Pennsylvania Cavalry,,,,,,,"Rebellion Record, Vol VI, page 21"
,,Dec. 2d,"Ozark, Missouri",3d and 9th Missouri Cavalry,,,,4,,2,Official
,,Dec. 3d,"Oakland, Mississippi",1st Indiana Cavalry,,10,,,12,,Official Report of Brigadier General C. C. Washburne
,,Dec. 3d,"Oxford, Mississippi","2d Cavalry Brigade, commanded by Colonel Hatch",,,,,20 kw,92,
,,Dec. 4th,"Wireman’s Shoals, Big Sandy River, Kentucky",39th Kentucky Volunteers,3,,16,,,,"Report of Adjutant General of Kentucky, p. 485"
,,Dec. 4th,"Water Valley, Mississippi","1st and 2d Cavalry Brigades, commanded by Colonels Hatch and Lee",,,,,,300,
,,Dec. 5th,"Coffeeville, Mississippi","1st, 2d, and 3d Cavalry Brigades, of General Grant’s Army, commanded by Colonels Lee, Hatch, and Mizener",10,54,35,7,43,10,"Official reports, Union and Confederate"
,,Dec. 5th,"Helena, Arkansas",30th Iowa and 2. 9th Wisconsin Volunteers ,,,,8,,30,"Rebellion Record, Vol. VI, page 22"
,,Dec. 5th,"Reed’s Mountains, Arkansas",2d Kansas Cavalry,2,5,,,,,Official
,,Dec. 6th,"Lebanon, Tennessee",93d Ohio Volunteers,1,3,,,,,Official
64,,Dec. 7th,"Prairie Grove, Arkansas","1st, 2d, and 3d Divisions of the Army of the Frontier, commanded by Brigadier Generals J. G. Blunt and F. J. Herron",167,798,183,300,,1200 wm,"Appendix to Part I, Medical and Surgical History of the War. page 312. Official Report of Major General S. R. Curtis. Also known as Fayetteville and Illinois Creek"
,,Dec. 7th,"Hartsville, Tennessee","106th and 108th Ohio and 104th Illinois Volunteers, 2d Indiana and 11th Kentucky Cavalry, and 13th Indiana Battery",55,,1800,21,114,14,"Official Report of Brigadier General John Morgan, C. S. A"
,,Dec. 9th,"Dobbin's Ferry, Tennessee","35th Indiana, 51st Ohio, and 8th and 21st Kentucky Volunteers, and 7th Indiana Battery",5,48,6,,,,"Ohio in the War, page 310. Casualty List, S. G. O. Also known us La Vergne"
,,Dec. 9th,"Brentville, Tennessee","25th Illinois. 8th Kansas, and 81st Indiana Volunteers and 8th Wisconsin Battery",,1,,,,,Official Report of Colonel John A. Martin
,,Dec. 12th,"Little Bear Creek, Alabama","Troops commanded by Colonel Sweeney, 52d Illinois Volunteers",1,,2,11,30,40,"Report of Adjutant General of lllinois, Vol. II, p. 59"
,,Dec. 12th,"Zuni, near Blackwater, Virginia","Brigade, commanded by General Ferry",3,11,,,,,"Ohio in the War. Vol. 2. page 369. Casualty List, S. G. O"
,,Dec. 12th,"Trenton, North Carolina","3d New York Cavalry, advance of Major General Foster’s troops",,,,3,,18,Official
,,Dec. 12th,"Franklin, Tennessee","Stanley's Cavalry Division, Army of the Cumberland",1,,,5,10,12,
,,Dec. 12th to 18th,"Foster's expedition to Goldsboro’, North Carolina","Wessell’s Brigade of Peck’s Division, 1st, 2d. and 3d Brigades, 1st Division, Department of North Carolina",90,478,9,71,268,400,"Official Reports of Major Generals J. G. Foster, commanding Union, and G. W. Smith, commanding Confederate forces"
,,Dec. 13th,"Fredericksburg, Virginia","Second Corps, Major General Couch, and Ninth Corps, Major General Wilcox—Right Grand Division, Major General Sumner; First Corps. Major General Reynolds, and Sixth Corps. Major General W. F. Smith— Left Grand Division, Major General Franklin; Fifth Corps, Major General Butterfield, and Third Corps, Major General Stoneman—Centre Grand Division, Major General Hooker; Army of the Potomac, Major General A. E. Burnside",1180,9028,2145,579,3870,127,"Casualty List, S. G O. Appendix to Part I. Medical and Surgical History of the War, page 92. Official Reports of Major General A. E. Burnside, U. S. V., and Lieut. General R. E. Lee, C. S. A. In the Union Army, Brigadier Generals C. F. Jackson and G. D. Bayard were killed, and Gibbons and Vinton wounded; in the Confederate Army, Brigadier General T. R. R. Cobb was killed and Maxey Gregg wounded"
,,Dec. 13th,"South-West Creek, North Carolina","9th New Jersey and 85th Pennsylvania Volunteers, 3d New York Cavalry, and 3d New York Artillery",3,8,,,,,"New Jersey and the Rebellion, page 220"
,,Dec. 14th,"Kingston, North Carolina","Wessell’s Brigade of Peck’s Division and the 1st, 2d, and 3d Brigades, 1st Division, Department of North Carolina",40,120,,50,75,400,"Casualty List, File A, No. 581, S. G. O. Official Report of Major Gen. J. G. Foster, commanding"
,,Dec. 14th,"Fort Brown Road, Texas",,,,,,,,Newspaper report
,,Dec. 16th,"Whitehall, North Carolina","9th New Jersey, 17th, 23d, 24th, and 45th Massachusetts  Volunteers. 3d New York Cavalry, and 3d and 23d New York Batteries",,,,,,,"Casualty List, S. G. O. Official Report of Major General J. G. Foster, commanding"
,,Dec. 17th,"Goldsboro’, North Carolina","9th New Jersey, 3d, 17th, 25th, 27th, and 43d Massachusetts  Volunteers, 3d New York Cavalry, and 3d and 23d New York Artillery",,,,,,,"Casualty List, S. G. O. Official Report of Major General J. G. Foster, U. S. A"
,,Dec. 18th,"Lexington, Tennessee","11th Illinois, 5th Ohio, and 2d Tennessee Cavalry",7,10,124,7,28,,Official
,,Dec. 18th,"Jackson, Tennessee","11th Illinois and 5th Ohio Cavalry, and 43d and 61st Illinois Volunteers",1,5,,,70,3,"Report of Adjutant General of Illinois, Vol. I, page 664. Also called Salem Cemetery"
65,,Dec. 19th,"Occoquan, Dumfries, Virginia",Wagon train guard of the Twelfth Army Corps,,,,,,,"Casualty List, S. G. O"
,,Dec. 20th,"Holly Springs, Mississippi",2d Illinois Cavalry,,,1000,,,,"Surrendered by Colonel Murphy, 8th Wisconsin Vols., to the Confederates under Van Dorn"
,,Dec. 20th,"Trenton, Tennessee","Detachments 7th Tennessee Cavalry, 122d Illinois Volunteers, and convalescents",1,,250,17,50,,"Official Report of Colonel Jacob Fry, 61st Illinois Volunteers. Post captured by Forrest"
,,Dec. 21st,"Davis Mills, Wolf River, Mississippi",Six companies 25th Indiana Volunteers and two companies 5th Ohio Cavalry,,3,,22,50,20,"Official Report of Colonel Wm. H. Morgan, 25th Indiana, commanding post"
,,Dec. 22d,"Isle of Wight Court-House, Virginia",Detachment of 2d New York Mounted Rifles,,,,,2,,Unofficial
,,Dec. 24th,"Middleburg, Mississippi Central R. R.",One hundred and fifteen men of the 12th Michigan Volunteers,,9,13,9,11,15,"Report of Adjutant General of Michigan, 1862, p. 83"
,,Dec. 24th,Glasgow. Kentucky,Five companies of the 2d Michigan Cavalry,1,1,16,3,3,7,Official Report of Colonel E. H. Hobson
,,Dec. 25th,"Green’s Chapel, Kentucky",Detachment of the 4th and 5th Indiana Cavalry,1,,2,9,22,5,Official Report of Colonel E. H. Hobson
,,Dec. 25th,"Bear Wallow, Kentucky",Two battalions of the 12th Kentucky Cavalry,,,,1,3,12,Official Report of Colonel E. H. Hobson
,,Dec. 26th,"Bacon Creek, Kentucky",Detachment of the 2d Michigan Cavalry,,23,,,,,Official Report of Colonel E. H. Hobson
,,Dec. 26th,"Nolansville, Tennessee","2d brigade, 1st division, McCook’s Corps, advance of the right wing of the Army of the Cumberland",,,,,,,Also known as Knob Gap
,,Dec. 27th,"Elizabethtown, Kentucky",91st Illinois Volunteers,,,500,,,,"Report of Adjutant General of Illinois, Vol. II. page 345. Post captured by General Morgan"
,,Dec. 27th,"Dumfries, Virginia","5th, 7th, and 65th Ohio Volunteers, 6th Maine Battery, 12th Illinois and 1st Maryland Cavalry",3,8,5,25,40,,"Ohio in the War, Vol. II, page 45"
,,Dec. 28th,"Muldraugh's Hill, Kentucky",6th Indiana Cavalry,,,400,,,,"Report of Adjutant General of Indiana. Vol. II, page 663"
,,Dec. 28th,"Suffolk, Virginia","Reconnoitering force, commanded by Acting Brigadier General Gibbs",,,,,,,"Rebellion Record, Vol, VI. page 29"
,,Dec. 28th,"Dripping Springs, near Van Buren, Ark.",Army of the Frontier,2,6,,7,,120,Official Report of Brigadier General J. G. Blunt
,,Dec. 28th,"Elk Fork, Campbell County, Tennessee",6th and 10th Kentucky Cavalry,,,,30,176,51,Official dispatches
,,Dec. 28th,"Occoquan, Virginia",2d and 17th Pennsylvania Cavalry,,20,100,,,,Unofficial
,,Dec. 28th,"Clinton, Louisiana",,,,,,,,Confederate sources
,,Dec. 28th and 29th,"Ckickasaw Bayou, Vicksburg, Mississippi","Brigadier Generals G. W. Morgan’s, Frederick Steele’s, Morgan L. Smith’s, and A. J. Smith’s divisions, right wing, Army of Tennessee, commanded by Major General W. T. Sherman",191,982,756,,207,,"Casualty List, File A, No. 273. Official reports. Major General M. L. Smith, wounded"
,,Dec. 29th,"Stewart Creek, Tennessee","3d Kentucky, in advance of Crittenden’s Corps, left wing of the Army of the Cumberland",,,,,,,"Report of Adjutant General of Kentucky, Vol. I. page 629"
,,Dec. 30th,"Wautauga Bridge and Carter’s Station, Tennessee",7th Ohio and 9th Pennsylvania Cavalry,1,2,,7,15,273,"Ohio in the War. Vol. II, page 797. Carter’s raid into East Tennessee"
,,Dec. 30th,"Parker’s Cross Roads, Tennessee","18th. 106th, 119th, and 122d Illinois, 27th, 39th, and 63d Ohio. 50th Indiana 39th Iowa, and 7th Tennessee Volunteers, 7th Wisconsin Battery, commanded by Colonel C. L. Dunham, and Brigadier General J. C. Sullivan",23,139,58,50,150,300,"Casualty List, S. G. O. Official reports. Also known as Red Mound"
,,Dec. 30th,"Jefferson, Tennessee","2d brigade, 1st division, Thomas’s Corps, guarding wagon train",20,40,,15,30,,Official Report of Major General G. H. Thomas
66,,"Dec. 31st, 1862, to Jan. 2d, ’63","Stone’s River, Tennessee","McCook's Corps, right wing; Thomas’s Corps, centre; and Crittenden’s Corps, left wing, Army of the Cumberland , commanded by Major General W. S. Rosecrans ",1533,7245,2800,,9600 kw,14560 kwm 2000,"Casualty List, S. G. O. Appendix to Part I. Medical and Surgical History of the War, page 255. Among the casualties in the Union Army were Brigadier General Sill, killed. and Kirk, wounded: in the Confederate Army, Brigadier Generals Raines and Hanson, killed, and Chalmers and Davis, wounded. Also known as Murfreesboro’"
,1863,Jan. 1st,"Galveston, Texas","U. S. gunboats Westfield, Harriet Lane, Owasco, Sachem, Clifton, and Coryphaeus, and three companies of the 42d Massachusetts Volunteers",,,600 kwm,,50 kw,,"Official Report of Committee of Inquiry, January 12, 1863. Commanders Wainright and Renshaw were killed. Report of Adjutant General of Massachusetts, 1862, page 438"
,,Jan. 1st,"Stewart’s Creek, Tennessee","3d Ohio Cavalry and 10th Ohio Volunteers, guarding wagon train",,,,,,,Official Reports
,,Jan. 1st,"La Vergne, Tennessee",1st Michigan Engineers and Mechanics,1,6,,,,,"Report of Adjutant General of Michigan, 1863, p. 21"
,,Jan. 3d,"La Grange, Arkansas",Portion of General Washburn’s Cavalry division,,,,,10 kw,12,Official
,,Jan. 3d,Moorefield. West Virginia,116th Ohio Volunteers,,,65,,,,"Ohio in the War, Vol. 2. page 606"
,,Jan. 5th,"Middletown, Tennessee",Cavalry of the Army of the Cumberland,,,,,,,Official reports
,,Jan. 5th,"Hardy County, West Virginia",,1,,33,,,,"Rebellion Record, Vol. VI, page 32"
,,Jan. 7th and 8th,"Springfield, Missouri","Missouri Militia, convalescents, and citizens",14,144,5,40,,200,"Official Report of Major General H. W. Halleck. Brigadier General E. B. Brown, commanding Union troops, was wounded"
,,Jan. 8th,"Ripley, Tennessee",2d Illinois Cavalry,,3,,8,20,46,"Rebellion Record, Vol. VI, page 33"
,,Jan. 10th,"Catlett's Station, Virginia",,,,,,,,"Rebellion Record, Vol. VI, page 33"
,,Jan. 11th,"Hatteras and Alabama, off the coast of Texas","United States steamer Hatteras, eight guns",2,3,110,,1,,"Official Report of Lieutenant R. G. Blake, U. S. N"
,,Jan. 11th,"Fort Hindman, Arkansas Post, Arkansas","Thirteenth Corps, Major General J. A. McClernand, and Fifteenth Corps, Major General W. T. Sherman, Army of Mississippi, and gunboats of the Mississippi squadron",129,831,17,100,400,5000,Casualty List. S. G. O. Official Reports of Major General II. W. Halleck and Rear-Admiral D. D. Porter
,,Jan. 11th,"Hartsville, Missouri","21st Iowa and 99th Illinois Volunteers, 3d Iowa and 3d Missouri Cavalry, and Battery L, 2d Missouri Artillery",7,64,7,,300 kw,29,"Official Report of Brigadier General Fitz-Henry Warren. Also known as Woods Fork. Brigadier General McDonald, C. S. A., killed"
,,Jan. 12th,"Lick Creek, Arkansas",2d Wisconsin Cavalry,1,1,9,,,,Official
,,Jan. 14th,"Bayou Teche, Louisiana","8th Vermont, 16th and 75th New York, 12th Connecticut, 6th Michigan, and 21st Indiana Volunteers, 1st Louisiana Cavalry, 4th and 6th Massachusetts, and 1st Maine Battery, and gunboats Calhoun, Diana, Kinsman, and Estrella",10,27,,15,,,"Official. Army commanded by Brigadier General Weitzel; Navy by Commodore Buchanan; rebel gunboat Cotton destroyed; Commodore Buchanan, U. S. N., was killed"
,,Jan. 15th,"Helena and Clarendon Road, Arkansas",2d Wisconsin Cavalry,,,17,1,6,,
,,Jan. 16th,"Duval’s Bluff and Des Arcs, Arkansas",U. S. gunboat DeKalb and 24th Indiana Volunteers,,,,,,7,Official
,,Jan. 17th,"Pollocksville and Northeast River, North Carolina",3d Now York Cavalry,,,,,,,"Colonel S. H. Mix’s raid in North Carolina, January 16th to 22d"
67,,Jan. 19th,"Burnt Ordinary, Virginia",5th Pennsylvania Cavalry,,,1,,,4,"Rebellion Record, Vol. VI, page 36"
,,Jan. 23d,"Fish Springs, Tennessee",,4,,,,,,Confederate sources
,,Jan. 24th,"Woodbury, Tennessee","2d division, Crittenden’s Corps ",2,1,,35,,100,Official reports
,,Jan. 25th,"Construction train, near Murfreesboro', Tennessee","Train guard, reinforced by part of the 10th Michigan Volunteers",,,,,,,"Report of Adjutant General of Michigan. 1863, page 78"
,,Jan. 26th,"Township, Florida",,1,6,,,,,Official
,,Jan. 26th,"Bear River, Washington Territory",Four companies of the 2d California Cavalry and one company of the 3d California Volunteers,14,49,,224,,,"Casualty Lists, S. G. O. Indian fight. 142 men of the command had their feet frozen"
,,Jan. 27th,"Indian Village, Plaquemine Bayou, La.","1st Louisiana Cavalry, commanded by Capt. Williamson",,,,,,,Tribune Almanac. Official
,,Jan. 29th,"Pinos Altos, Arizona Territory",One company of the 1st California Volunteers,,,,,,,Official 
,,Jan. 30th,"Dyersburg, Tennessee",22d Ohio Volunteers,,,,,34,,"Ohio in the War, Vol. 2, page 157. "
,,Jan. 30th,"Deserted House, near Suffolk, Virginia","Portion of Major General Peck’s forces, commanded by Brigadier General Michael Corcoran anil Colonel S. P. Spear",24,80,,,50,,"Casualty List. File A. No. 544. S. G. O. Appendix to Part I, Medical and Surgical History of the War, page 81. Also designated Carsvillc and Kelly's Store"
,,Jan. 31st,"Rover, Tennessee",4th Ohio Cavalry,,,,12,12,300,Unofficial
,,Jan. 31st,"Middleton, Tennessee",2d and 3d Tennessee Cavalry,,,,,,42,"Report of the Adjutant General of Tennessee, 1866, page 386"
,,Jan. 31st,Off Charleston Bar. South Carolina,"U. S. steamers Mercedita, Keystone State, Augusta, Quaker City, Housatonic, and Memphis",4,23,,,,,"Official Report of Rear Admiral S. F. Dupont, U. S. N., and Flag Officer  N. Ingraham, C. S. N"
,,Feb. 1st,"Fort McAlister, Genesis Point, Georgia",U. S. Navy,,,,,,,Unofficial
,,Feb. 1st,"Franklin, Tennessee",,1,,,,,3,
,,Feb. 3d,"Mingo Swamp, Missouri","12th Missouri Militia, commanded by Major P. W. Reeder",,,,8,20,,Newspaper reports. 
,,Feb. 3d,"Fort Donelson, Tennessee","83d Illinois Volunteers. 2d Illinois Artillery, and a battalion  of the 5th Iowa Cavalry",16,60,50,140,400,130,"Casualty List, S. G. O. Official Reports. Also known as Cumberland Iron Works"
,,Feb. 4th,"Batesville, Arkansas","Brigade of Cavalry, commanded by Colonel George E. Waring, jr",,,,,,,General Davidson s official dispatches
,,Feb. 5th,"Bear Creek, Johnson County, Missouri","40th Missouri Enrolled Militia, commanded by Capt. W. K. Ranney",,,,7,,,Official report of Lieutenant Colonel Brown
,,Feb. 7th,"Williamsburg, Virginia","5th Pennsylvania Cavalry, commanded by Lieutenant Colonel William Lewis",1,1,35,,,,
,,Feb. 3d and 8th,"Independence, Missouri","5th Missouri Militia Cavalry, commanded by Lieutenant Colonel D. A. Colvin",,,,8,2,,Official Report of Colonel Penicks
,,Feb. 8th,"Lebanon, Tennessee",,,,,,,600,"Rebellion Record. Vol. VI, page 44"
,,Feb. 9th,"Summerville, Virginia",Cavalry commanded by Major Knox,,,,,,,
,,Feb. 10th,"Old River, Lake Providence, Louisiana","Detailed men from the 1st Kansas, 17th and 95th Illinois, and 16tth Wisconsin Volunteers, and 3d Louisiana Cavalry, commanded by Captain T. Tucker",1,7,,4,7,26 ,Official report
,,Feb. 10th,"Gloucester Point, Virginia",,,,,,,,"Lossing's Civil War in America, Vol. III, page 21"
,,Feb. 10th,"Wachita Indiana Agency, Texas",Loyal Delawares and Shawnees,,4,,,,100,Official
,,Feb. 10th,"Bone Yard, Tennessee",18th Missouri Volunteers,,,,,,,Official
,,Feb. 13th,"Smithfield, Virginia",12th Pennsylvania Cavalry,1,2,4,1,,3,Official dispatches of General B. F. Kelley
68,,Feb. 13th,"Bolivar, Tennessee",Cavalry,,,,4,5,,Newspaper report
,,Feb. 14th,"Brentsville, Virginia",1st Michigan Cavalry,,15,,,,,"Report of Adjutant General of Michigan, 1863"
,,Feb. 14th,"Gordon’s Landing, Red River, Louisiana",U. S. ram Queen of the West,1,1,18,,,,Official Report of Colonel Charles L. Ellet
,,Feb. 15th,"Cainsville, Tennessee",123d Illinois Volunteers and one company of the 5th Tennessee Cavalry,,3,,8,20,6,Newspaper statement
,,Feb. 15th,"Nolensville, Tennessee","Detachment from the 2d Minnesota Volunteers, guarding a wagon train",,,,8,20,4,Newspaper reports
,,Feb. 15th,"Arkadelphia, Arkansas",Captain Brown’s command,2,12,,14,12,,Unofficial
,,Feb. 16th,"Romney, near, Virginia","Detachments of the 116th and 122d Ohio Volunteers, guarding a wagon train",,,72,,,,"Official Report of Lieutenant General R. E. Lee, C. S. A"
,,Feb. 18th,"Milton, Tennessee",2d Michigan and 3d Ohio Cavalry,,,,,,,"Report of Adjutant General of Michigan, 1863, p. 26"
,,Feb. 19th,"Spring River, Missouri",One company of the 9th Kansas,,,,,,,Official
,,Feb. 19th,"Cold Water, Mississippi","Cavalry, commanded by Lieutenant Colonel W. F. Wood, 1st Indiana Cavalry",,,,6,3,15,
