year,date,event1,event2,event3,event4,event5,event6,event7,event8,
1860,Thurs 20 Dec,South Carolina seceded,,,,,,,,
1861,Wed 9 Jan,Mississippi seceded,,,,,,,,
1861,Thurs 10 Jan,Florida seceded,,,,,,,,
1861,Fri 11 Jan,Alabama seceded,,,,,,,,
1861,Sat 19 Jan,Georgia seceded,,,,,,,,
1861,Sat 26 Jan,Louisiana seceded,,,,,,,,
1861,Tues 29 Jan,Kansas admitted to the Union,,,,,,,,
1861,Fri 1 Feb,Texas seceded,,,,,,,,
1861,Mon 18 Feb,"Inauguration of Jefferson Davis as Provisional President of the C.S.A. at Montgomery, Ala. @ David E. Twiggs surrendered the Dept, of Texas to the State of Texas ",,,,,,,,
1861,Thurs 28 Feb,Colorado Territory organized,,,,,,,,
1861,Sat 2 Mar,Nevada Territory and Dakota Territory organized,,,,,,,,
1861,Mon 4 Mar,"Inauguration of Abraham Lincoln as President of the United States at Washington, D.C.  ",,,,,,,,
1861,Fri 12 Apr,"Fort Sumter, S.C.",,,,,,,,
1861,Sat 13 Apr,"Fort Sumter, S.C.",,,,,,,,
1861,Wed 17 Apr,Virginia seceded,,,,,,,,
1861,Thurs 18 Apr,"Harpers Ferry I, Va.",,,,,,,,
1861,Fri 19 Apr,"Riot in Baltimore, Md.@ Naval blockade of southern ports",,,,,,,,
1861,Sat 20 Apr,"Gosport Navy Yard, Va. (Norfolk I)",,,,,,,,
1861,Tues 23 Apr,"San Antonio, Tex.",,,,,,,,
1861,Thurs 25 Apr,"Port Lavaca and Saluria, Tex.@ Fort Smith I, Ark.",,,,,,,,
1861,Mon 6 May,Arkansas and Tennessee seceded,,,,,,,,
1861,Thurs 9 May,"San Lucas Springs, Tex.",,,,,,,,
1861,Fri 10 May,"Camp Jackson, Mo.",,,,,,,,
1861,Mon 20 May,North Carolina seceded,,,,,,,,
1861,Sat 1 June,"Fairfax Court House I, Va.",,,,,,,,
1861,Mon 3 June,"Philippi, Va.",,,,,,,,
1861,Mon 10 June,"Big Bethel, Va. (Great Bethel, Bethel Church)",,,,,,,,
1861,Thurs 13 June,"Romney, Va.",,,,,,,,
1861,Mon 17 June,"Vienna, Va.@ Boonville I, Mo.",,,,,,,,
1861,Tues 2 July,"Falling Waters, Va. (Hainesville, Hoke's Run)",,,,,,,,
1861,Fri 5 July,"Carthage I, Mo. (Dry Forks)",,,,,,,,
1861,Wed 10 July,"Laurel Hill I, Va.",,,,,,,,
1861,Thurs 11 July,"Rich Mountain, Va.@ Laurel Hill I, Va.",,,,,,,,
1861,Fri 12 July,"Laurel Hill I, Va. Beverly I, Va.",,,,,,,,
1861,Sat 13 July,"Laurel Hill I, Va.@  Beverly I, Va.@  Corrick's Ford, Va. (Cheat River)",,,,,,,,
1861,Wed 17 July,"Scarey Creek, Va.",,,,,,,,
1861,Thurs 18 July,"Blackburn's Ford, Va.",,,,,,,,
1861,Sun 21 July,"Bull Run I, Va. (Manassas I)",,,,,,,,
1861,Sat 27 July,"St. Augustine Springs, N.Mex. Terr. (Fort Fillmore)",,,,,,,,
1861,Fri 2 Aug,"Dug Springs, Mo. (Dry Creek)",,,,,,,,
1861,Wed 7 Aug,"Hampton, Va.",,,,,,,,
1861,Sat 10 Aug,"Wilson's Creek, Mo. (Oak Hills, Springfield)",,,,,,,,
1861,Tues 27 Aug,"Cape Hatteras Expedition commenced (Pamlico Sound, N.C.@ Forts Clark and Hatteras, N.C.@ USS Minnesota and seven other ships)",,,,,,,,
1861,Wed 28 Aug,Cape Hatteras Expedition,,,,,,,,
1861,Thurs 29 Aug,Cape Hatteras Expedition ended,,,,,,,,
1861,Tues 10 Sept,"Camifix Ferry, Va.",,,,,,,,
1861,Wed 11 Sept,"Cheat Mountain Campaign, Va. commenced",,,,,,,,
1861,Thurs 12 Sept,"Cheat Mountain Campaign, Va. (Elkwater, Greenbrier River)@  Siege of Lexington, Mo. commenced",,,,,,,,
1861,Fri 13 Sept,"Cheat Mountain Campaign, Va. ","Siege of Lexington, Mo.",,,,,,,
1861,Sat 14 Sept,"Cheat Mountain Campaign, Va.@ Siege of Lexington, Mo.",,,,,,,,
1861,Sun 15 Sept,"Cheat Mountain Campaign, Va.@ Siege of Lexington, Mo.",,,,,,,,
1861,Mon 16 Sept,"Cheat Mountain Campaign, Va. (Princeton)@ Siege of Lexington, Mo.",,,,,,,,
1861,Tues 17 Sept,"Cheat Mountain Campaign, Va.@ ended Siege of Lexington, Mo.",,,,,,,,
1861,Wed 18 Sept,"Siege of Lexington, Mo.",,,,,,,,
1861,Thurs 19 Sept,"Siege of Lexington, Mo.",,,,,,,,
1861,Fri 20 Sept,"Siege of Lexington, Mo. ended",,,,,,,,
1861,Thurs 3 Oct,"Greenbrier River, Va.",,,,,,,,
1861,Mon 21 Oct,"Ball's Bluff, Va. (Leesburg I, Harrison's Island, Conrad's Ferry, Edward's Ferry, Va.)",,,,,,,,
1861,Tues 29 Oct,"Port Royal, S.C. expedition commenced (Fort Walker, Hilton Head, Fort Beauregard and Baypoint@ USS Wabash and 76 other ships)",,,,,,,,
1861,Wed 30 Oct,"Port Royal, S.C. expedition",,,,,,,,
1861,Thurs 31 Oct,"Port Royal, S.C. expedition@ Missouri seceded in part and was counted by both the U.S.A. and the C.S.A.",,,,,,,,
1861,Fri 1 Nov,"Port Royal, S.C. expedition",,,,,,,,
1861,Sat 2 Nov,"Port Royal, S.C. expedition",,,,,,,,
1861,Sun 3 Nov,"Port Royal, S.C. expedition",,,,,,,,
1861,Mon 4 Nov,"Port Royal, S.C. expedition",,,,,,,,
1861,Tues 5 Nov,"Port Royal, S.C. expedition",,,,,,,,
1861,Wed 6 Nov,"Port Royal, S.C. expedition",,,,,,,,
1861,Thurs 7 Nov,"Port Royal, S.C. expedition ended@ Belmont, Mo. (USS Lexington and Tyler)",,,,,,,,
1861,Fri 8 Nov,USS San Jacinto vs. RMS Trent in the Old Bahama Channel (James M. Mason and John Slidell affair),,,,,,,,
1861,Wed 20 Nov,Kentucky seceded in part and was thus counted by both the U.S.A. and the C.S.A.,,,,,,,,
1861,Fri 22 Nov,"Fort Pickens, Fla. (Forts McRae and Barrancas)",,,,,,,,
1861,Thurs 12 Dec,"Great fire at Charleston, S.C.",,,,,,,,
1861,Fri 13 Dec,"Alleghany Summit, Va. (Alleghany Mountain, Camp Alleghany)",,,,,,,,
1861,Fri 20 Dec,"Dranesville, Va.",,,,,,,,
1861,Wed 1 Jan,"Port Royal Ferry, S.C. (Coosawhatchie River)",,,,,,,,
1862,Fri 10 Jan,"Big Sandy River, Ky. (Middle Creek)",,,,,,,,
1862,Sun 19 Jan,"Mill Springs, Ky. (Logan's Cross Roads, Somerset I, Beech Grove, Fishing Creek)",,,,,,,,
1862,Thurs 6 Feb,"Fort Henry, Tenn. vs. USS Essex, Carondelet, Cincinnati, Conestoga, Tyler, St. Louis, and Lexington.",,,,,,,,
1862,Fri 7 Feb,"Roanoke Island, N.C. (Albemarle Sound Expedition, Burnside's Expedition)",,,,,,,,
1862,Sat 8 Feb,"Roanoke Island, N.C.",,,,,,,,
1862,Thurs 13 Feb,"Fort Donelson, Tenn. (USS St. Louis, Carondelet, Louisville, Pittsburgh, Tyler, and Conestoga)",,,,,,,,
1862,Fri 14 Feb,"Fort Donelson, Tenn. (Dover)",,,,,,,,
1862,Sat 15 Feb,"Fort Donelson, Tenn.",,,,,,,,
1862,Sun 16 Feb,"Fort Donelson, Tenn.",,,,,,,,
1862,Fri 21 Feb,"Valverde, N.Mex. Terr. (Fort Craig)",,,,,,,,
1862,Sat 22 Feb,"Inauguration of Jefferson Davis as President of the Confederate States at Richmond, Va.",,,,,,,,
1862,Tues 25 Feb,"Nashville I, Tenn.",,,,,,,,
1862,Tues 4 Mar,"Femandina, Fla. (USS Pawnee)",,,,,,,,
1862,Thurs 6 Mar,"Pea Ridge, Ark. (Elkhom Tavern, Bentonville, Leetown)",,,,,,,,
1862,Fri 7 Mar,"Pea Ridge, Ark.",,,,,,,,
1862,Sat 8 Mar,"Pea Ridge, Ark.@  USS Congress, Cumberland, and Minnesota vs. CSS Virginia, Hampton Roads, Va.",,,,,,,,
1862,Sun 9 Mar,"USS Monitor vs. CSS Virginia [ex-USS Merrimack], Hampton Roads, Va. @ New Bern I, N.C. Campaign commenced",,,,,,,,
1862,Mon 10 Mar,"New Bern I, N.C. Campaign",,,,,,,,
1862,Tues 11 Mar,"New Bern I, N.C. Campaign",,,,,,,,
1862,Wed 12 Mar,"New Bern I, N.C. Campaign",,,,,,,,
1862,Thurs 13 Mar,"New Bern I, N.C. Campaign",,,,,,,,
1862,Fri 14 Mar,"New Bern I, N.C. Campaign ended New Madrid, Mo.",,,,,,,,
1862,Sun 16 Mar,"Pound Gap I, Ky. Va.  Island No. 10, Tenn., Campaign commenced",,,,,,,,
1862,Mon 17 Mar,"Island No. 10, Tenn.",,,,,,,,
1862,Tues 18 Mar,"Island No. 10, Tenn.",,,,,,,,
1862,Wed 19 Mar,"Island No. 10, Tenn.",,,,,,,,
1862,Thurs 20 Mar,"Island No. 10, Tenn.",,,,,,,,
1862,Fri 21 Mar,"Island No. 10, Tenn.",,,,,,,,
1862,Sat 22 Mar,"Winchester I, Va. (Kernstown I)@ Island No. 10, Tenn.",,,,,,,,
1862,Sun 23 Mar,"Winchester I, Va. (Kernstown I)@ Island No. 10, Tenn.",,,,,,,,
1862,Mon 24 Mar,"Island No. 10, Tenn.",,,,,,,,
1862,Tues 25 Mar,"Island No. 10, Tenn.",,,,,,,,
1862,Wed 26 Mar,"Glorieta, N.Mex. Terr. (Apache Canyon, Glorieta Pass, Glorieta Canyon, Pigeon's Ranch, Johnson's Ranch)@  Island No. 10, Tenn.",,,,,,,,
1862,Thurs 27 Mar,"Glorieta, N.Mex. Terr. (Apache Canyon, Glorieta Pass, Glorieta Canyon, Pigeon's Ranch, Johnson's Ranch)@  Island No. 10, Tenn.",,,,,,,,
1862,Fri 28 Mar,"Glorieta, N.Mex. Terr. (Apache Canyon, Glorieta Pass, Glorieta Canyon, Pigeon's Ranch, Johnson's Ranch)@  Bealeton Station, Va. (Rappahannock Station)@  Island No. 10, Tenn.",,,,,,,,
1862,Sat 29 Mar,"Island No. 10, Tenn.",,,,,,,,
1862,Sun 30 Mar,"Island No. 10, Tenn.",,,,,,,,
1862,Mon 31 Mar,"Island No. 10, Tenn.",,,,,,,,
1862,Tues 1 Apr,"Island No. 10, Tenn.",,,,,,,,
1862,Wed 2 Apr,"Island No. 10, Tenn.",,,,,,,,
1862,Thurs 3 Apr,"Island No. 10, Tenn.",,,,,,,,
1862,Fri 4 Apr,"Island No. 10, Tenn.",,,,,,,,
1862,Sat 5 Apr,"Siege of Yorktown, Va. Commenced@ Island No. 10, Tenn.",,,,,,,,
1862,Sun 6 Apr,"Siege of Yorktown, Va.@  Shiloh, Tenn. (Pittsburg Landing)@ Island No. 10, Tenn.",,,,,,,,
1862,Mon 7 Apr,"Siege of Yorktown, Va.@  Shiloh, Tenn. (Pittsburg Landing)@  Island No. 10, Tenn. (New Madrid Bend, Tiptonville)",,,,,,,,
1862,Tues 8 Apr,"Siege of Yorktown, Va.@  Island No. 10, Tenn. campaign ended",,,,,,,,
1862,Wed 9 Apr,"Siege of Yorktown, Va.",,,,,,,,
1862,Thurs 10 Apr,"Siege of Yorktown, Va.@ Fort Pulaski, Ga.",,,,,,,,
1862,Fri 11 Apr,"Siege of Yorktown, Va. Fort Pulaski, Tenn.",,,,,,,,
1862,Sat 12 Apr,"Siege of Yorktown, Va.@  Andrews' Raid (The General, Western and Atlantic railroad engine, followed by Texas, from Big Shanty to Ringgold, Ga.)",,,,,,,,
1862,Sun 13 Apr,"Siege of Yorktown, Va.",,,,,,,,
1862,Mon 14 Apr,"Siege of Yorktown, Va.",,,,,,,,
1862,Tues 15 Apr,"Siege of Yorktown, Va.",,,,,,,,
1862,Wed 16 Apr,"Siege of Yorktown, Va.",,,,,,,,
1862,Thurs 17 Apr,"Siege of Yorktown, Va.",,,,,,,,
1862,Fri 18 Apr,"Siege of Yorktown, Va.@  Forts Jackson and St. Philip, La. Campaign commenced (USS Hartford and 35 other ships vs. 14 C.S.N. ships)",,,,,,,,
1862,Sat 19 Apr,"Siege of Yorktown, Va.@  Forts Jackson and St. Philip, La.@ South Mills, N.C. (Camden)",,,,,,,,
1862,Sun 20 Apr,"Siege of Yorktown, Va.@  Forts Jackson and St. Philip, La.",,,,,,,,
1862,Mon 21 Apr,"Siege of Yorktown, Va.@  Forts Jackson and St. Philip, La.",,,,,,,,
1862,Tues 22 Apr,"Siege of Yorktown, Va.@  Forts Jackson and St. Philip, La.",,,,,,,,
1862,Wed 23 Apr,"Siege of Yorktown, Va.@  Forts Jackson and St. Philip, La.",,,,,,,,
1862,Thurs 24 Apr,"Siege of Yorktown, Va.@  Forts Jackson and St. Philip, La.",,,,,,,,
1862,Fri 25 Apr,"Siege of Yorktown, Va.@  Forts Jackson and St. Philip, La.@  Fort Macon, N.C. (Beaufort@ USS Daylight, State of Georgia, and Chippewa)@  New Orleans, La.",,,,,,,,
1862,Sat 26 Apr,"Siege of Yorktown, Va.@  Forts Jackson and St. Philip, La.",,,,,,,,
1862,Sun 27 Apr,"Siege of Yorktown, Va.@  Forts Jackson and St. Philip, La.",,,,,,,,
1862,Mon 28 Apr,"Siege of Yorktown, Va.@  Forts Jackson and St. Philip, La. campaign ended",,,,,,,,
1862,Tues 29 Apr,"Siege of Yorktown, Va.@  Corinth Campaign, Miss, commenced",,,,,,,,
1862,Wed 30 Apr,"Siege of Yorktown, Va.@ Corinth Campaign, Miss.",,,,,,,,
1862,Thurs 1 May,"Siege of Yorktown, Va.@ Corinth Campaign, Miss.",,,,,,,,
1862,Fri 2 May,"Siege of Yorktown, Va.@ Corinth Campaign, Miss.",,,,,,,,
1862,Sat 3 May,"Siege of Yorktown, Va. Ended@ Corinth Campaign, Miss. (Farmington, Miss.)",,,,,,,,
1862,Sun 4 May,"Corinth Campaign, Miss. (Farmington, Miss.)",,,,,,,,
1862,Mon 5 May,"Williamsburg, Va.@  Corinth Campaign, Miss. (Farmington, Miss.)",,,,,,,,
1862,Tues 6 May,"Corinth Campaign, Miss. (Farmington, Miss.)",,,,,,,,
1862,Wed 7 May,"West Point, Va. (Eltham's Landing, Barhamsville)@  Corinth Campaign, Miss. (Farmington, Miss.)",,,,,,,,
1862,Thurs 8 May,"McDowell, Va. (Bull Pasture, Bull Pasture Mountain)@  Corinth Campaign, Miss. (Farmington, Miss.)",,,,,,,,
1862,Fri 9 May,"Corinth Campaign, Miss. (Farmington, Miss.)",,,,,,,,
1862,Sat 10 May,"Plum Run Bend, Tenn. (Plum Point)@ Corinth Campaign, Miss. (Farmington, Miss.)@  Norfolk H, Va.@  Pensacola, Fla.",,,,,,,,
1862,Sun 11 May,"Corinth Campaign, Miss.@ Norfolk H, Va.",,,,,,,,
1862,Mon 12 May,"Corinth Campaign, Miss.",,,,,,,,
1862,Tues 13 May,"Corinth Campaign, Miss.",,,,,,,,
1862,Wed 14 May,"Drewry's Bluff I, Va. (Fort Darling I; USS Galena, Port Royal, Aroostook, Naugatuck, and Monitor)@ Corinth Campaign, Miss.",,,,,,,,
1862,Thurs 15 May,"Drewry's Bluff I, Va. (Fort Darling I)@ Corinth Campaign, Miss.",,,,,,,,
1862,Fri 16 May,"Princeton, Va.@  Corinth Campaign, Miss.",,,,,,,,
1862,Sat 17 May,"Corinth Campaign, Miss. Russell's House, Miss. Princeton, Va.",,,,,,,,
1862,Sun 18 May,"Corinth Campaign, Miss.",,,,,,,,
1862,Mon 19 May,"Corinth Campaign, Miss.@ Searcy Landing, Ark.",,,,,,,,
1862,Tues 20 May,"Corinth Campaign, Miss.",,,,,,,,
1862,Wed 21 May,"Corinth Campaign, Miss.",,,,,,,,
1862,Thurs 22 May,"Corinth Campaign, Miss.",,,,,,,,
1862,Fri 23 May,"Front Royal I, Va.@ Lewisburg, Va.@ Corinth Campaign, Miss.",,,,,,,,
1862,Sat 24 May,"Newtown, Va.@  Corinth Campaign, Miss.",,,,,,,,
1862,Sun 25 May,"Winchester II, Va.@ Corinth Campaign, Miss.",,,,,,,,
1862,Mon 26 May,"Corinth Campaign, Miss.",,,,,,,,
1862,Tues 27 May,"Hanover Court House I, Va. (Slash Church, Peake's Station, Kinney's Farm I)  ","Corinth Campaign, Miss.",,,,,,,
1862,Fri 30 May,"Corinth I, Miss. (Campaign ended) ","Front Royal H, Va","Booneville I, Miss.",,,,,,
1862,Sat 31 May,"Fair Oaks I, Va. (Seven Pines)",,,,,,,,
1862,Sun 1 June,"Fair Oaks, Va. (Seven Pines)",,,,,,,,
1862,Wed 4 June,"Fort Pillow I, Tenn. (USS Benton and five other ships)",,,,,,,,
1862,Thurs 5 June," Memphis I, Tenn.","Fort Pillow I, Tenn.",,,,,,,
1862,Fri 6 June,"Memphis I, Tenn. (USS Queen of the West and three other ships vs. CSS Van Dorn and seven other ships)  ","Fort Pillow I, Tenn.",,,,,,,
1862,Sun 8 June,"Cross Keys, Va. (Union Church)",,,,,,,,
1862,Mon 9 June," Grand Gulf I, Miss.","Port Republic I, Va.",,,,,,,
1862,Fri 13 June,"New Market I, Va.",,,,,,,,
1862,Mon 16 June,"Secessionville, S.C. (James Island, Fort Johnson)",,,,,,,,
1862,Wed 18 June,"Cumberland Gap I, Tenn.",,,,,,,,
1862,Wed 25 June,"The Seven Days (Oak Grove, Henrico, French's Field, King's Schoolhouse, The Orchard, Meadow Bridge, Va.)",,,,,,,,
1862,Thurs 26 June,"The Seven Days (Mechanicsville I, Ellerson's Mill, Beaver Dam Creek, Meadow Bridge, Va.)",,,,,,,,
1862,Fri 27 June,"The Seven Days (Gaines's Mill I, Cold Harbor I, Kinney's Farm II, Hanover Court House II, Chickahominy, Va.)",,,,,,,,
1862,Sat 28 June,"The Seven Days (Garnett's Farm, Golding's Farm, Dispatch Station, Boatswain's Swamp, White House Landing, Va.)",,,,,,,,
1862,Sun 29 June,"The Seven Days (Savage's Station, Peach Orchard, Allen's Farm, Fair Oaks Station, James River Road, Va.)",,,,,,,,
1862,Mon 30 June,"The Seven Days (Glendale, Frayser's Farm, White Oak Swamp, Charles City Crossroads, New Market Road I, Willis Church, Turkey Bridge, Nelson's Crossroads, Nelson's Farm, Malvern Cliff, Va.)",,,,,,,,
1862,Tues 1 July,"The Seven Days (Malvern Hill I, Crew's Farm, Turkey Run, Poindexter's Farm, Va.) "," Booneville II, Miss.",,,,,,,
1862,Fri 4 July,"USS Maratanza vs. CSS Teaser, James River I, Va.  Morgan's Raid I commenced (Knoxville I, Sparta I, Tenn.)",,,,,,,,
1862,Sat 5 July,Morgan's Raid I,,,,,,,,
1862,Sun 6 July,Morgan's Raid I,"Forrest's Raid I commenced (McMinnville I, Tenn.)"," Devall's Bluff, Ark.  ",,,,,,
1862,Mon 7 July,Morgan's Raid I Forrest's Raid I,,,,,,,,
1862,Tues 8 July,"Morgan's Raid I (Celina, Tenn.) ",Forrest's Raid I,,,,,,,
1862,Wed 9 July,"Morgan's Raid I (Tompkinsville I, Ky.)", Forrest's Raid I,,,,,,,
1862,Thurs 10 July,"Morgan's Raid I (Lebanon, Glasgow I, Horse Cave, Ky.)  ",Forrest's Raid I,,,,,,,
1862,Fri 11 July,"Morgan's Raid I (Glasgow, Mackville, Lebanon I, Ky.) ", Forrest's Raid I,,,,,,,
1862,Sat 12 July,"Morgan's Raid I (Lebanon, Harrodsburg, Ky.)",  Forrest's Raid I,,,,,,,
1862,Sun 13 July,"Morgan's Raid I (Springfield I, Midway, Harrodsburg, Ky.) "," Forrest's Raid I (Murfreesboro I, Tenn.)",,,,,,,
1862,Mon 14 July,"Morgan's Raid I (Lawrenceburg I, Harrodsburg, Versailles I, Georgetown I, Ky.)", Forrest's Raid I,,,,,,,
1862,Tues 15 July,"Morgan's Raid I (Georgetown I, Ky.)", Forrest's Raid I,"  Yazoo River, Miss. (USS Queen of the West, Tyler, and Carondelet vs. CSS Arkansas)",,,,,,
1862,Wed 16 July,"Morgan's Raid I (Georgetown I, Ky.) Forrest's Raid I",,,,,,,,
1862,Thurs 17 July,"Morgan's Raid I (Cynthiana I, Georgetown I, Ky.) ", Forrest's Raid I,,,,,,,
1862,Fri 18 July,"Morgan's Raid I (Georgetown I, Paris, Ky.)"," Newburg, Ind.  ",Forrest's Raid I,,,,,,
1862,Sat 19 July,"Morgan's Raid I (Paris, Winchester, Ky.)", Forrest's Raid I,,,,,,,
1862,Sun 20 July,"Morgan's Raid I (Winchester, Richmond, Crab Orchard I, Ky.) ", Forrest's Raid I,,,,,,,
1862,Mon 21 July,"Morgan's Raid I (Crab Orchard, Somerset D,Ky.) "," Forrest's Raid I ended (McMinnville, Tenn.)",,,,,,,
1862,Tues 22 July,"Morgan's Raid I (Somerset n, Monticello, Ky., Sparta II, Tenn.)",,,,,,,,
1862,Wed 23 July,Morgan's Raid I,,,,,,,,
1862,Thurs 24 July,Morgan's Raid I,,,,,,,,
1862,Fri 25 July,Morgan's Raid I,,,,,,,,
1862,Sat 26 July,Morgan's Raid I,,,,,,,,
1862,Sun 27 July,Morgan's Raid I,,,,,,,,
1862,Mon 28 July,"Morgan's Raid I (Livingston, Tenn.)",,,,,,,,
1862,Tues 29 July,"Morgan's Raid I ended (Knoxville II, Tenn.)",,,,,,,,
1862,Tues 5 Aug,"Baton Rouge, La.",,,,,,,,
1862,Wed 6 Aug,"USS Essex, Sumter, Cayuga, Kineo, and Katahdin vs. CSS Arkansas, Miss. River near Baton Rouge, La.",,,,,,,,
1862,Sat 9 Aug,"Cedar Mountain, Va. (Slaughter's Mountain, Southwest Mountain, Mitchell's Station, Cedar Run)",,,,,,,,
1862,Sun 10 Aug,"Nueces River, Tex.",,,,,,,,
1862,Tues 12 Aug,"Gallatin I, Tenn.",,,,,,,,
1862,Mon 18 Aug,"Clarksville I, Tenn.",,,,,,,,
1862,Wed 20 Aug,"Brandy Station I, Va.",,,,,,,,
1862,Thurs 21 Aug,"Hartsfield, Tenn.",,,,,,,,
1862,Fri 22 Aug,"Stuart's Raid (Catlett's Station I, Rappahannock Station I, Va.)",,,,,,,,
1862,Sat 23 Aug,"Stuart's Raid (Catlett's Station I, Rappahannock Station I, Va.) "," Big Hill, Ky.",,,,,,,
1862,Tues 26 Aug,"Bull Run II, Va. commenced (Bristoe Station I, Manassas Junction I)",,,,,,,,
1862,Wed 27 Aug,"Bull Run II, Va. (Kettle Run, Cub Run,  Bull Run Bridge, Broad Run, Buckland Run)",,,,,,,,
1862,Thurs 28 Aug,"Bull Run II, Va. (Groveton, Brawner's Farm, Gainesville, Thoroughfare Gap)",,,,,,,,
1862,Fri 29 Aug,"Bull Run II, Va. (Groveton, Manassas Plains, Manassas Junction II, Gainesville, Kettle Run)",,,,,,,,
1862,Sat 30 Aug,"Bull Run II, Va. (Manassas II, Groveton Heights)  ","Richmond, Ky. (White's Farm)",,,,,,,
1862,Sun 31 Aug,"Bull Run II, Va. (Manassas II)",,,,,,,,
1862,Mon 1 Sept,"Bull Run II, Va. ended (Chantilly, Ox Hill)",,,,,,,,
1862,Wed 3 Sept,"Natchez, Miss.",,,,,,,,
1862,Sat 6 Sept,"Clarksville II, Tenn. (Rickett's Hill)",,,,,,,,
1862,Fri 12 Sept,"Harpers Ferry II, Va.",,,,,,,,
1862,Sat 13 Sept,"Harpers Ferry II, Va.",,,,,,,,
1862,Sun 14 Sept,"Harpers Ferry II, Va.  South Mountain, Md. (Turner's Gap, Fox's Gap, Crampton's Gap, Boonesboro)",,,,,,,,
1862,Mon 15 Sept,"Harpers Ferry II, Va.",,,,,,,,
1862,Tues 16 Sept,"Munfordville I, Ky.",,,,,,,,
1862,Wed 17 Sept,"Munfordville, Ky.","Antietam, Md. (Sharpsburg) ",,,,,,,
1862,Fri 19 Sept,"Shepherdstown, Va. (Blackford's Ford, Boteler's Ford) "," Iuka, Miss.",,,,,,,
1862,Thurs 25 Sept,"Davis' Bridge, Tenn. (Pocahontas)",,,,,,,,
1862,Tues 30 Sept,"Newtonia I, Mo.",,,,,,,,
1862,Fri 3 Oct,"Corinth II, Miss.",,,,,,,,
1862,Sat 4 Oct,"Corinth II, Miss.",,,,,,,,
1862,Sun 5 Oct,"Hatchie River, Miss. (Big Hatchie River, Hatchie Bridge, Davis' Bridge, Metamora)",,,,,,,,
1862,Wed 8 Oct,"Perryville, Ky. (Chaplin Hills)",,,,,,,,
1862,Fri 17 Oct,"Morgan's Raid II commenced (Clay's Ferry, Ky.)",,,,,,,,
1862,Sat 18 Oct,"Morgan's Raid II, (Crab Orchard II, Lexington I, Versailles II, Ky.)",,,,,,,,
1862,Sun 19 Oct,"Morgan's Raid II (Lawrenceburg II, Bardstown I, Elizabethtown, Ky.)",,,,,,,,
1862,Mon 20 Oct,Morgan's Raid II,,,,,,,,
1862,Tues 21 Oct,Morgan's Raid II,,,,,,,,
1862,Wed 22 Oct,"Cumberland Gap II, Tenn. ","Pocotaligo, S.C. (Yemassee) ",Morgan's Raid II,,,,,,
1862,Thurs 23 Oct,Morgan's Raid II,,,,,,,,
1862,Fri 24 Oct,"Morgan's Raid II (Morgantown, Ky.)",,,,,,,,
1862,Sat 25 Oct,"Morgan's Raid II (Hopkinsville, Ky.)",,,,,,,,
1862,Sun 26 Oct,Morgan's Raid II,,,,,,,,
1862,Mon 27 Oct,Morgan's Raid II,,,,,,,,
1862,Tues 28 Oct,Morgan's Raid II,,,,,,,,
1862,Wed 29 Oct,Morgan's Raid II,,,,,,,,
1862,Thurs 30 Oct,Morgan's Raid II,,,,,,,,
1862,Fri 31 Oct,Morgan's Raid II,,,,,,,,
1862,Sat 1 Nov,Morgan's Raid II,,,,,,,,
1862,Sun 2 Nov,Morgan's Raid II,,,,,,,,
1862,Mon 3 Nov,"Bayou Teche I, La. (USS Calhoun, Diana, Estrella, Kinsman, and St Mary) ",Morgan's Raid II,,,,,,,
1862,Tues 4 Nov,Morgan's Raid II,,,,,,,,
1862,Wed 5 Nov,"Morgan's Raid II ended (Gallatin II, Tenn.)","Chester Gap, Va. (Barbee's Crossroads) ",,,,,,,
1862,Fri 28 Nov,"Cane Hill, Ark. (Boston Mountains, Boonsboro I)",,,,,,,,
1862,Fri 5 Dec,"Coffeeville, Miss.",,,,,,,,
1862,Sun 7 Dec,"Prairie Grove, Ark.",,,,,,,,
1862,Thurs 11 Dec,"Forrest's Raid II commenced (Columbia I, Tenn.)","Fredericksburg I, Va. (Marye's Heights I) ",,,,,,,
1862,Fri 12 Dec,"Fredericksburg I, Va. (Marye's Heights I) ","USS Cairo, Yazoo River, Miss.  ","Kinston I, N.C.  ",Forrest's Raid II,,,,,
1862,Sat 13 Dec,"Fredericksburg I, Va. (Marye's Heights I) ",Forrest's Raid II,,,,,,,
1862,Sun 14 Dec,Forrest's Raid II,,,,,,,,
1862,Mon 15 Dec,Forrest's Raid II,,,,,,,,
1862,Tues 16 Dec,Forrest's Raid II,,,,,,,,
1862,Wed 17 Dec,Forrest's Raid II,,,,,,,,
1862,Thurs 18 Dec,"Forrest's Raid II (Lexington, Tenn.)",,,,,,,,
1862,Fri 19 Dec,"Forrest's Raid II (Salem Church, Salem Cemetery, Jackson, Tenn.)",,,,,,,,
1862,Sat 20 Dec,"Holly Springs, Miss.","Forrest's Raid II (Trenton, Tenn.) ",,,,,,,
1862,Sun 21 Dec,Forrest's Raid II ," Morgan's Raid III, Ky. commenced (Alexandria, Tenn.)",,,,,,,
1862,Mon 22 Dec,Forrest's Raid II ," Morgan's Raid III, Ky. (Tompkinsville II)"," Kelly's Ford I, Va.",,,,,,
1862,Tues 23 Dec,Forrest's Raid II ,"Morgan's Raid III, Ky.",,,,,,,
1862,Wed 24 Dec,Forrest's Raid II,"  Morgan's Raid III, Ky. (Glasgow II)",,,,,,,
1862,Thurs 25 Dec,Forrest's Raid II  ,"Morgan's Raid III, Ky. (Cave City)",,,,,,,
1862,Fri 26 Dec,Forrest's Raid II ," Morgan's Raid III, Ky. (Nolan, Upton, Munfordville, Bacon Creek)",,,,,,,
1862,Sat 27 Dec,Forrest's Raid II ," Morgan's Raid III, Ky. (Elizabethtown)",,,,,,,
1862,Sun 28 Dec,Forrest's Raid II  ,"Morgan's Raid III, Ky. (Lebanon Junction, Muldraugh's Hill)  ","Chickasaw Bayou, Miss. (Chickasaw Bluff, Walnut Hills)",,,,,,
1862,Mon 29 Dec,Forrest's Raid II  ,"Morgan's Raid III, Ky. (Boston, New Haven, Bardstown II)  ","Chickasaw Bayou, Miss.",,,,,,
1862,Tues 30 Dec,Forrest's Raid II  ,"Morgan's Raid III, Ky. (Springfield II)"," Carter's Station, Tenn. (Wautauga Bridge) ","Chickasaw Bayou, Miss.",,,,,
1862,Wed 31 Dec,"Forrest's Raid II (Parker's Crossroads, Tenn.) "," Morgan's Raid III, Ky. (Lebanon II, Camp-bellsville II) "," Stones River, Tenn. (Murfreesboro I)",,,,,,
1863,Thurs 1 Jan,"Stones River, Tenn. (Murfreesboro I) ","Morgan's Raid m, Ky. (Columbia I)"," Helena, Ark.  ","Galveston I, Tex. (USS Harriet Lane, Owasco, Corypheus, Sachem, Westfield, and Clifton vs. CSS Bayou City and Neptune)",,,,,
1863,Fri 2 Jan,"Stones River, Tenn. (Murfreesboro I) ","Morgan's Raid III, Ky. ended (Burkesville, Ky., Smithville, Tenn.)",,,,,,,
1863,Sat 10 Jan,"Arkansas Post, Ark. (Fort Hindman)",,,,,,,,
1863,Sun 11 Jan,"Arkansas Post, Ark. (USS Black Hawk) ","USS Hatteras vs. CSS Alabama off Galveston II, Tex.",,,,,,,
1863,Wed 14 Jan,"Bayou Teche II, La. (USS Calhoun, Diana, Estrella, and Kinsman vs. CSS Cotton)",,,,,,,,
1863,Tues 20 Jan,"The ""Mud March"" in Va.",,,,,,,,
1863,Wed 21 Jan,"Sabine Pass I, Tex. ","""Mud March""",,,,,,,
1863,Thurs 22 Jan,"""Mud March""",,,,,,,,
1863,Fri 23 Jan,"""Mud March""",,,,,,,,
1863,Sun 1 Feb,"Fort McAllister I, Ga.",,,,,,,,
1863,Tues 24 Feb,"Arizona Terr, organized ",Capture of USS Indianola,,,,,,,
1863,Sat 28 Feb,"USS Montauk vs. CSS Rattlesnake in Ossabaw Sound, Ga.",,,,,,,,
1863,Tues 3 Mar,"Idaho Terr, organized",,,,,,,,
1863,Wed 4 Mar,"Thompson's Station I, Tenn. (Spring Hill I, Unionville)",,,,,,,,
1863,Thurs 5 Mar,"Thompson's Station I, Tenn.",,,,,,,,
1863,Wed 11 Mar,"Fort Pemberton, Miss. (USS Chillicothe and Baron de Kalb)",,,,,,,,
1863,Sat 14 Mar,"Port Hudson, La. (USS Mississippi, Hartford, Richmond, Monongahela, Albatross, Genesee, and Kineo)",,,,,,,,
1863,Mon 16 Mar,"Steele's Bayou, Miss.",,,,,,,,
1863,Tues 17 Mar,"Kelly's Ford II, Va. (Kellysville) ","Steele's Bayou, Miss.",,,,,,,
1863,Wed 18 Mar,"Steele's Bayou, Miss.",,,,,,,,
1863,Thurs 19 Mar,"Steele's Bayou, Miss.",,,,,,,,
1863,Fri 20 Mar,"Steele's Bayou, Miss.",,,,,,,,
1863,Sat 21 Mar,"Fort Pemberton II, Miss. (USS Chillicothe and Baron de Kalb)  ","Steele's Bayou, Miss.",,,,,,,
1863,Sun 22 Mar,"Steele's Bayou, Miss.",,,,,,,,
1863,Mon 23 Mar,"Jacksonville I, Fla. (USS Paul Jones)",,,,,,,,
1863,Wed 25 Mar,"Brentwood I, Tenn.",,,,,,,,
1863,Tues 7 Apr,"Fort Sumter II, S.C. (USS Weehawken, Passaic, Montauk, Nantucket, Patapsco, Keokuk, Catskill, Nahant, and New Ironsides)",,,,,,,,
1863,Sat 11 Apr,"Siege of Suffolk, Va. commenced",,,,,,,,
1863,Sun 12 Apr,"Irish Bend, La. (Centreville, Fort Bisland, Bethel Place, Bayou Teche, Indian Ridge, Indian Bend)  ","Siege of Suffolk, Va.",,,,,,,
1863,Mon 13 Apr,"Irish Bend, La. (Centreville, Fort Bisland, Bethel Place, Bayou Teche, Indian' Ridge, Indian Bend) "," Siege of Suffolk, Va.",,,,,,,
1863,Tues 14 Apr,"Irish Bend, La. (Centreville, Fort Bisland, Bethel Place, Bayou Teche, Indian Ridge, Indian Bend)","  Siege of Suffolk, Va.",,,,,,,
1863,Wed 15 Apr,"Siege of Suffolk, Va.",,,,,,,,
1863,Thurs 16 Apr,"Siege of Suffolk, Va.",,,,,,,,
1863,Fri 17 Apr,"Grierson's Raid commenced (Lagrange, Tenn.)",  Marmaduke's Raid commenced .,"Siege of Suffolk, Va",,,,,,
1863,Sat 18 Apr,"Grierson's Raid (Ripley, Miss.)"," Marmaduke's Raid Siege of Suffolk, Va."," Fayetteville I, Ark.",,,,,,
1863,Sun 19 Apr,"Grierson's Raid (Pontotoc I, Miss.) ",Marmaduke's Raid ,"Fort Huger, N.C. "," Siege of Suffolk, Va.",,,,,
1863,Mon 20 Apr,Grierson's Raid  ,"Marmaduke's Raid (Patterson I, Mo.) ","Siege of Suffolk, Va.",,,,,,
1863,Tues 21 Apr,"Grierson's Raid (Palo Alto, Miss.) ",Marmaduke's Raid ,W. E. Jones' Va. Raid commenced ,"Imboden's Va. Raid commenced (Beverly, Va.)  ","Streight's Raid commenced (Eastport, Miss.)  ","Siege of Suffolk, Va.",,,
