year,date,event1,event2,event3,event4,event5,event6,event7,event8,
1864,Mon 4 Apr,"Red River Expedition  @ Camden Expedition, Ark. (Elkin's Ferry) @ Forrest's Raid III",,,,,,,,
1864,Tues 5 Apr,"Red River Expedition @ Camden Expedition, Ark. @ Forrest's Raid III",,,,,,,,
1864,Wed 6 Apr,"Red River Expedition @ Camden Expedition, Ark. @ Forrest's Raid III",,,,,,,,
1864,Thurs 7 Apr,"Red River Expedition (Wilson's Plantation, La.)  @ Camden Expedition, Ark. @ Forrest's Raid III",,,,,,,,
1864,Fri 8 Apr,"Red River Expedition (Sabine Cross Roads, La., Mansfield, Pleasant Grove) @  Camden Expedition, Ark.  @ Forrest's Raid III",,,,,,,,
1864,Sat 9 Apr,"Red River Expedition (Pleasant Hill, La.) @ Camden Expedition, Ark.  @ Forrest's Raid III",,,,,,,,
1864,Sun 10 Apr,"Red River Expedition (Pleasant Hill, La.) @ Camden Expedition, Ark.  @ Forrest's Raid III",,,,,,,,
1864,Mon 11 Apr,"Red River Expedition @ Camden Expedition, Ark. @ Forrest's Raid III",,,,,,,,
1864,Tues 12 Apr,"Red River Expedition (Blair's Landing, Pleasant Hill Landing, La.; USS Lexington and Osage)  @ Camden Expedition, Ark. @  Forrest's Raid III (Fort Pillow II, Tenn.)",,,,,,,,
1864,Wed 13 Apr,"Red River Expedition (Blair's Landing, La.) @ Camden Expedition, Ark.  @ Forrest's Raid III",,,,,,,,
1864,Thurs 14 Apr,"Red River Expedition @ Camden Expedition, Ark.  @ Forrest's Raid HI ended (Jackson, Tenn.)",,,,,,,,
1864,Fri 15 Apr,"Red River Expedition @ Camden Expedition, Ark. (Camden I, Ark.)",,,,,,,,
1864,Sat 16 Apr,"Red River Expedition @ Camden Expedition, Ark.",,,,,,,,
1864,Sun 17 Apr,"Red River Expedition @ Camden Expedition, Ark. @ Plymouth I, N.C. (USS Southfield vs. CSS Albemarle)",,,,,,,,
1864,Mon 18 Apr,"Red River Expedition @ Camden Expedition, Ark. (Poison Springs, Ark.)  @ Plymouth I, N.C.",,,,,,,,
1864,Tues 19 Apr,"Red River Expedition @ Camden Expedition, Ark. @ Plymouth I, N.C.",,,,,,,,
1864,Wed 20 Apr,"Red River Expedition@  Camden Expedition, Ark.  @ Plymouth I, N.C.",,,,,,,,
1864,Thurs 21 Apr,"Red River Expedition @ Camden Expedition, Ark.",,,,,,,,
1864,Fri 22 Apr,"Red River Expedition @ Camden Expedition, Ark.",,,,,,,,
1864,Sat 23 Apr,"Red River Expedition (Cane River Crossing, Monett's Ferry II, Monett's Bluff, Cloutiersville II, La.)  @ Camden Expedition, Ark.",,,,,,,,
1864,Sun 24 Apr,"Red River Expedition @ Camden Expedition, Ark.",,,,,,,,
1864,Mon 25 Apr,"Red River Expedition  @ Camden Expedition, Ark. (Mark's Mill, Ark.)",,,,,,,,
1864,Tues 26 Apr,"Red River Expedition (USS Cricket, Eastport, Fort Hindman, Juliet, Champion 3, and Champion 5)  @ Camden Expedition, Ark.",,,,,,,,
1864,Wed 27 Apr,"Red River Expedition @ Camden Expedition, Ark.",,,,,,,,
1864,Thurs 28 Apr,"Red River Expedition @ Camden Expedition, Ark.",,,,,,,,
1864,Fri 29 Apr,"Red River Expedition @ Camden Expedition, Ark.",,,,,,,,
1864,Sat 30 Apr,"Red River Expedition  @ Camden Expedition, Ark. ended (Jenkins' Ferry, Saline River)",,,,,,,,
1864,Sun 1 May,"Red River Expedition (USS Emma,  Moore's Plantation, Alexandria HI, La.)",,,,,,,,
1864,Mon 2 May,"Red River Expedition (Alexandria HI, La.)",,,,,,,,
1864,Tues 3 May,"Red River Expedition (Alexandria HI, La., USS City Belle)",,,,,,,,
1864,Wed 4 May,"Red River Expedition (Alexandria III, La.) ","Wilderness, Va. Campaign commenced (Germanna Ford, Wilderness Tavern, Overland Campaign)",,,,,,,
1864,Thurs 5 May,"Red River Expedition (Alexandria III, La., USS Signal and Covington)  ","Wilderness, Va. Campaign (Todd's Tavern, Parker's Store)  ","Atlanta Campaign, Ga. commenced (Rocky Face Ridge II, Varnell's Station, Mill Creek Gap)",,,,,,
1864,Fri 6 May,"Red River Expedition (Alexandria HI, La.) ","Wilderness, Va. Campaign (Todd's Tavern) ","Atlanta Campaign, Ga. (Rocky Face Ridge II, Mill Creek Gap, Vamell's Station) ","Port Walthall Junction, Va.  ","James River II, Va. (USS Commodore Jones)",,,,
1864,Sat 7 May,"Red River Expedition (Alexandria III, La.) ","Wilderness, Va. Campaign ended (Todd's Tavern)  ","Atlanta Campaign, Ga. (Buzzard Roost II, Rocky Face Ridge II, Vamell's Station, Mill Creek Gap) "," Port Walthall Junction, Va.",,,,,
1864,Sun 8 May,"Red River Expedition (Alexandria III, La.) ","Spotsylvania, Va. Campaign commenced (Laurel Hill II, Corbins Bridge, Alsop's Farm, Va.)  ","Atlanta Campaign, Ga. (Dug Gap, Buzzard Roost II, Rocky Face Ridge II, Mill Creek Gap, Varnell's Station, Snake Creek Gap)",,,,,,
1864,Mon 9 May,Red River Expedition,"Spotsylvania, Va. Campaign (Spotsylvania Court House)  ","Atlanta Campaign, Ga. (Snake Creek Gap, Rocky Face Ridge II, Mill Creek Gap, Vamell's Station, Buzzard Roost II) ","James River, Va. Campaign commenced (Swift Creek)","Cloyd's Mountain, Va. (New River Bridge) ","Sheridan's Raid, Va. commenced (Beaver Dam Station)",,,
1864,Tues 10 May,Red River Expedition ,"Spotsylvania, Va. Campaign (Po River,  Ny River)  ","Atlanta Campaign, Ga. (Rocky Face Ridge II)  ","Sheridan's Raid, Va. (Beaver Dam Station)"," James River, Va. Campaign (Ware Bottom Church, Procter's Creek I)",,,,
1864,Wed 11 May,"Red River Expedition Spotsylvania, Va. Campaign (Po River,  Ny River)  ","Atlanta Campaign, Ga. (Rocky Face Ridge II)  ","James River, Va. Campaign (Ware Bottom Church)  ","Sheridan's Raid, Va. (Yellow Tavern, Ashland Station, Ground Squirrel Bridge)",,,,,
1864,Thurs 12 May,"Red River Expedition Spotsylvania, Va. Campaign (Po River, Ny River)  ","Atlanta Campaign, Ga. (Dalton II)  ","James River, Va. Campaign (Drewry's Bluff II, Fort Darling II, Ware Bottom Church)  ","Sheridan's Raid, Va. (Mechanicsville II)",,,,,
1864,Fri 13 May,"Red River Expedition Spotsylvania, Va. Campaign (Beaver Dam, Po River, Ny River)  ","Atlanta Campaign, Ga. (Resaca)  ","James River, Va. Campaign (Drewry's Bluff II, Fort Darling II, Ware Bottom Church)  ","Sheridan's Raid, Va.",,,,,
1864,Sat 14 May,"Red River Expedition (Mansura, La.) ","Spotsylvania, Va. Campaign (Po River,  Ny River)  ","Atlanta Campaign, Ga. (Resaca, Sugar Valley, Oostenaula)  ","James River, Va. Campaign (Drewry's Bluff II, Fort Darling II, Ware Bottom Church)  ","Sheridan's Raid, Va.",,,,
1864,Sun 15 May,"Red River Expedition (Marksville Prairie, Avoyelles Prairie, Mansura, La.) Spotsylvania, Va. Campaign (Po River, Ny River)  ","Atlanta Campaign, Ga. (Resaca)  ","James River, Va. Campaign (Drewry's Bluff II, Fort Darling II, Ware Bottom Church)  ","New Market II, Va. "," Sheridan's Raid, Va.",,,,
1864,Mon 16 May,"Red River Expedition (Mansura, Belle Prairie, Smith's Plantation, La.)  ","Spotsylvania, Va. Campaign (Po River,  Ny River)","Atlanta Campaign, Ga. (Lay's Ferry)"," James River, Va. Campaign (Drewry's Bluff II, Fort Darling II, Ware Bottom Church, Procter's Creek II)  ","Sheridan's Raid, Va.",,,,
1864,Tues 17 May,Red River Expedition ,"Spotsylvania, Va. Campaign ","Atlanta Campaign, Ga. (Adairsville)  ","James River, Va. Campaign (Ware Bottom Church) "," Sheridan's Raid, Va.",,,,
1864,Wed 18 May,"Red River Expedition ended (Yellow Bayou, Bayou de Glaise, Norwood's Plantation, Old Oaks, Calhoun Station, Simmsport, La.)  ","Spotsylvania, Va. Campaign ","Atlanta Campaign, Ga. (Cassville) "," James River, Va. Campaign (Ware Bottom Church, Bermuda Hundred)  ","Sheridan's Raid, Va.",,,,
1864,Thurs 19 May,"Spotsylvania, Va. Campaign ","Atlanta Campaign, Ga. (Cartersville, Cassville)  ","James River, Va. Campaign (Harris's Farm, Ware Bottom Church)  ","Sheridan's Raid, Va.",,,,,
1864,Fri 20 May,"Spotsylvania, Va. Campaign ended ","Atlanta Campaign, Ga. (Allatoona Pass I) ","James River, Va. Campaign ended (Ware Bottom Church, Bermuda Hundred) ","Sheridan's Raid, Va.",,,,,
1864,Sat 21 May,"North Anna River, Va. Campaign commenced (Guinea's Station)  ","Atlanta Campaign, Ga. "," Sheridan's Raid, Va.",,,,,,
1864,Sun 22 May,"North Anna River, Va. Campaign (Hanover Junction I)  "," Sheridan's Raid, Va.","Atlanta Campaign, Ga. ",,,,,,
1864,Mon 23 May,"North Anna River, Va. Campaign (Old Chesterfield, Chesterfield Road, Hanover Court House III, Oxford, Eaton Church, Matadequin Creek) ","Atlanta Campaign, Ga.  ","Sheridan's Raid, Va.",,,,,,
1864,Tues 24 May,"North Anna River, Va. Campaign","Sheridan's Raid, Va."," Atlanta Campaign, Ga. (Cass Station, Burnt Hickory)  ",,,,,,
1864,Wed 25 May,"North Anna River, Va. Campaign ","Atlanta Campaign, Ga. (Dallas, New Hope Church, Pumpkinvine Creek, Burnt Hickory, Allatoona Hill)  ","Sheridan's Raid, Va. Ended",,,,,,
1864,Thurs 26 May,"North Anna River, Va. Campaign (Jericho Bridge) ","Montana Terr, organized"," Atlanta Campaign, Ga. (Dallas, New Hope Church)  ",,,,,,
1864,Fri 27 May,"North Anna River, Va. Campaign (Totopotomy Creek, Hanovertown, Pamunkey River, Hanover Junction H, Jericho Mills, Jericho Bridge, Salem Church II) ","Atlanta Campaign, Ga. (Mount Zion Church, Dallas, Pickett's Mill)",,,,,,,
1864,Sat 28 May,"North Anna River, Va. Campaign (Haw's Shop, Enon Church, Totopotomy Creek) ","Atlanta Campaign, Ga. (Dallas)",,,,,,,
1864,Sun 29 May,"North Anna River, Va. Campaign ended (Jones's Farm, Old Church, Salem Church, Atlee's Station, Ashland, Totopotomy Creek)  ","Atlanta Campaign, Ga. (Dallas)",,,,,,,
1864,Mon 30 May,"Cold Harbor n, Va. Campaign commenced (Totopotamy River, Bethesda Church I, Gaines's Mill n, Hanover)  ","Atlanta Campaign, Ga. (Allatoona, Burned Church, Dallas)",,,,,,,
1864,Tues 31 May,"Cold Harbor II, Va. Campaign (Bethesda Church)  ","Atlanta Campaign, Ga. (Dallas)  ","Morgan's Raid V commenced (Abingdon I, Va.)",,,,,,
1864,Wed 1 June,"Cold Harbor H, Va. Campaign (Hanover Court House IV, Bethesda Church II) ","Atlanta Campaign, Ga. (Allatoona Pass, Dallas)  ","Morgan's Raid V (Pound Gap H, Ky. Va.)",,,,,,
1864,Thurs 2 June,"Cold Harbor II, Va. Campaign (Bethesda Church) "," Atlanta Campaign, Ga.  ","Covington, Va.  ",Morgan's Raid V,,,,,
1864,Fri 3 June,"Cold Harbor II, Va. Campaign (Bethesda Church)  ","Atlanta Campaign, Ga. (Acworth)", Morgan's Raid V,,,,,,
1864,Sat 4 June,"Cold Harbor II, Va. Campaign"," Atlanta Campaign, Ga. (Big Shanty I) ",Morgan's Raid V ," Harrisonburg, Port Republic II, Va.",,,,,
1864,Sun 5 June,"Cold Harbor II, Va. Campaign ",Morgan's Raid V ,"Piedmont, Staunton I, Va.","Atlanta Campaign, Ga. (Pine Mountain I, Big Shanty I)  ",,,,,
1864,Mon 6 June,"Cold Harbor II, Va. Campaign",Morgan's Raid V  ,"Lake Chicot, Ark. (Ditch Bayou, Old River Lake)"," Atlanta Campaign, Ga. (Big Shanty I, Raccoon Creek)  ",,,,,
1864,Tues 7 June,"Cold Harbor II, Va. Campaign ",Morgan's Raid V,"Atlanta Campaign, Ga. (Big Shanty I) ",,,,,,
1864,Wed 8 June,"Atlanta Campaign, Ga. (Big Shanty I) ","Morgan's Raid V (Mt. Sterling, Ky.)","Cold Harbor II, Va. Campaign ",,,,,,
1864,Thurs 9 June,"Cold Harbor II, Va. Campaign ","Atlanta Campaign, Ga. (Big Shanty I) ","Morgan's Raid V (Mt. Sterling, Ky.) ","Petersburg, Va. Campaign commenced",,,,,
1864,Fri 10 June,"Cold Harbor II, Va. Campaign ended ","Atlanta Campaign, Ga. "," Morgan's Raid V (Lexington II, Kellar's Bridge, Georgetown n, Ky.) "," Brice's Crossroads, Miss. (Guntown, Tishomingo Creek)  ","Petersburg, Va. Campaign Waynesboro I, Va.)",,,,
1864,Sat 11 June,"Atlanta Campaign, Ga. "," Morgan's Raid V (Cynthiana II, Ky.) ","Trevilian Station, Va.  ","Petersburg, Va. Campaign",,,,,
1864,Sun 12 June,"Atlanta Campaign, Ga. (McAfee's Crossroads)  ",Morgan's Raid V," Trevilian Station, Va. "," Petersburg, Va. Campaign",,,,,
1864,Mon 13 June,"Atlanta Campaign, Ga. ",Morgan's Raid V ,"Riddell's Shop, Va. ","Petersburg, Va. Campaign",,,,,
1864,Tues 14 June,"Atlanta Campaign, Ga. (Pine Mountain n. Pine Knob I)  ",Morgan's Raid V ," Petersburg, Va. Campaign (James River)",,,,,,
1864,Wed 15 June,"Atlanta Campaign, Ga. (Gilgal Church) ",Morgan's Raid V  ,"Petersburg, Va. Campaign (James River, Fort Powhatan, Baylor's Farm)",,,,,,
1864,Thurs 16 June,"Atlanta Campaign, Ga. (Golgatha, Mud Creek)  ",Morgan's Raid V  ,"Petersburg, Va. Campaign (James River)",,,,,,
1864,Fri 17 June,"Atlanta Campaign, Ga. (Lost Mountain, Brush Mountain, Mud Creek, Noyes' Creek)  ",Morgan's Raid V," Lynchburg, Va.  ","Petersburg, Va. Campaign (James River)",,,,,
1864,Sat 18 June,"Atlanta Campaign, Ga.  ",Morgan's Raid V  ,"Petersburg, Va. Campaign (James River)"," Lynchburg, Va.",,,,,
1864,Sun 19 June,"Atlanta Campaign, Ga. (Pine Knob II)", Morgan's Raid V ,"Petersburg, Va. Campaign ","USS Kearsarge vs. CSS Alabama off Cherbourg, France",,,,,
1864,Mon 20 June,"Atlanta Campaign, Ga. (Kennesaw Mountain I, Lattermore's Mills, Powder Springs, Noonday Creek) "," Morgan's Raid V ended (Abingdon n, Va.) ","Petersburg, Va. Campaign ","Kinston II, N.C.",,,,,
1864,Tues 21 June,"Atlanta Campaign, Ga.","Petersburg, Va. Campaign (Weldon Railroad I) "," Kinston I, N.C.",,,,,,
1864,Wed 22 June,"Atlanta Campaign, Ga. (Culp's House, Kolb's Farm)@Petersburg, Va. Campaign (Ream's Station I, Jerusalem Plank Road, Williams's Farm, Weldon Railroad I, Wilson & Kautz Raid)@Kinston I, N.C.",,,,,,,,
1864,Thurs 23 June,"Atlanta Campaign, Ga.@Early's Washington Raid commenced (Buchanan, Va.) @Petersburg, Va. Campaign (Jerusalem Plank Road, Nottoway Court House, William's Farm, Davis's Farm, Weldon Railroad I, Wilson and Kautz Raid)@Kinston I, N.C.",,,,,,,,
1864,Fri 24 June,"Atlanta Campaign, Ga. @Early's Washington Raid@Petersburg, Va. Campaign (St. Mary's Church, Jones's Bridge, Samaria, Danville Railroad, Wilson and Kautz Raid)",,,,,,,,
1864,Sat 25 June,"Atlanta Campaign, Ga.@Early's Washington Raid@Petersburg, Va. Campaign (Wilson and Kautz Raid; Petersburg mine adit commenced; mine exploded on 30 July)",,,,,,,,
1864,Sun 26 June,"Atlanta Campaign, Ga.@Early's Washington Raid (Staunton II, Va.)@Petersburg, Va. Campaign (Wilson and Kautz Raid)",,,,,,,,
1864,Mon 27 June,"Atlanta Campaign, Ga. (Kennesaw Mountain II)@Early's Washington Raid@Petersburg, Va. Campaign (Wilson and Kautz Raid, Stony Creek I)",,,,,,,,
1864,Tues 28 June,"Atlanta Campaign, Ga.@Early's Washington Raid@Petersburg, Va. Campaign (Wilson and Kautz Raid, Ream's Station II)",,,,,,,,
1864,Wed 29 June,"Atlanta Campaign, Ga.@Early's Washington Raid@Petersburg, Va. Campaign (Wilson and Kautz Raid, Ream's Station II)",,,,,,,,
1864,Thurs 30 June,"Atlanta Campaign, Ga.@Early's Washington Raid@Petersburg, Va. Campaign",,,,,,,,
1864,Fri 1 July,"Atlanta Campaign, Ga. @ Early's Washington Raid @ Petersburg, Va. Campaign",,,,,,,,
1864,Sat 2 July,"Atlanta Campaign, Ga. @  Early's Washington Raid (Winchester IV, Va.) @  Petersburg, Va. Campaign",,,,,,,,
1864,Sun 3 July,"Atlanta Campaign, Ga. (Nickajack Creek, Vining Station I)  @ Early's Washington Raid (Martinsburg II, W.Va.) @ Petersburg, Va. Campaign",,,,,,,,
1864,Mon 4 July,"Atlanta Campaign, Ga. (Chattahoochie River) @  Early's Washington Raid (Harpers Ferry III, W.Va.) @ Petersburg, Va. Campaign",,,,,,,,
1864,Tues 5 July,"Atlanta Campaign, Ga. (Paces Ferry, Smyrna, Chattahoochie River) @ Early's Washington Raid @ Petersburg, Va. Campaign",,,,,,,,
1864,Wed 6 July,"Atlanta Campaign, Ga. (Chattahoochie River) @  Early's Washington Raid (Hagerstown II, Md.) @  Petersburg, Va. Campaign",,,,,,,,
1864,Thurs 7 July,"Atlanta Campaign, Ga. (Chattahoochie River) @  Early's Washington Raid @ Petersburg, Va. Campaign",,,,,,,,
1864,Fri 8 July,"Atlanta Campaign, Ga. (Chattahoochie River)  @ Early's Washington Raid (Frederick, Md.) @ Petersburg, Va. Campaign",,,,,,,,
1864,Sat 9 July,"Atlanta Campaign, Ga. (Chattahoochie River, Vining Station II)  @  Early's Washington Raid (Monocacy, Md.) @ Petersburg, Va. Campaign @ Rousseau's Raid, Ala. commenced (Decatur I)",,,,,,,,
1864,Sun 10 July,"Atlanta Campaign, Ga. (Chattahoochie River) @  Early's Washington Raid @ Petersburg, Va. Campaign @ Rousseau's Raid, Ala.",,,,,,,,
1864,Mon 11 July,"Atlanta Campaign, Ga. @  Early's Washington Raid (Fort Stevens, D.C.) @  Petersburg, Va. Campaign @ Rousseau's Raid, Ala.",,,,,,,,
1864,Tues 12 July,"Atlanta Campaign, Ga. @ Early's Washington Raid (Fort Stevens, D.C.) @  Petersburg, Va. Campaign @ Rousseau's Raid, Ala.",,,,,,,,
1864,Wed 13 July,"Atlanta Campaign, Ga.  @ Early's Washington Raid (Tenallytown, Md.) @ Petersburg, Va. Campaign @ Rousseau's Raid, Ala. (Coosa River)",,,,,,,,
1864,Thurs 14 July,"Atlanta Campaign, Ga. @ Early's Washington Raid (Leesburg D, Va.)  @Petersburg, Va. Campaign  @Andrew J. Smith's Expedition, Miss. (Tupelo II, Harrisburg)  @ Rousseau's Raid, Ala.",,,,,,,,
1864,Fri 15 July,"Atlanta Campaign, Ga.  @ Early's Washington Raid @ Petersburg, Va. Campaign @ Rousseau's Raid, Ala. @  A. J. Smith's Expedition, Miss. (Tupelo II, Old Town Creek)",,,,,,,,
1864,Sat 16 July,"Atlanta Campaign, Ga.",Early's Washington Raid ,"Petersburg, Va. Campaign ","Rousseau's Raid, Ala.",,,,,
1864,Sun 17 July,"Atlanta Campaign, Ga. @ Early's Washington Raid  @Petersburg, Va. Campaign @ Rousseau's Raid, Ala. ended",,,,,,,,
1864,Mon 18 July,"Atlanta Campaign, Ga. @ Early's Washington Raid (Snicker's Gap, Parker's Ford, Snicker's Ferry, Va.) @ Petersburg, Va. Campaign",,,,,,,,
1864,Tues 19 July,"Atlanta Campaign, Ga.  @ Early's Washington Raid (Berry's Ford, Va.) @  Petersburg, Va. Campaign",,,,,,,,
1864,Wed 20 July,"Atlanta Campaign, Ga. (Peach Tree Creek, Howard House, Hood's First Sortie) @ Early's Washington Raid (Winchester V, Stephenson's Depot II, Va.) @ Petersburg, Va. Campaign",,,,,,,,
1864,Thurs 21 July,"Atlanta Campaign, Ga. (Decatur I, Leggett's Hill, Bald Hill) @ Early's Washington Raid @ Petersburg, Va. Campaign",,,,,,,,
1864,Fri 22 July,"Atlanta Campaign, Ga. (Atlanta, Decatur, Sugar Creek, Hood's Second Sortie) Early's Washington Raid (Strasburg I, Va.) @ Petersburg, Va. Campaign",,,,,,,,
1864,Sat 23 July,"Atlanta Campaign, Ga. @ Early's Washington Raid (Winchester VI, Kemstown II, Va.)  @ Petersburg, Va. Campaign",,,,,,,,
1864,Sun 24 July,"Atlanta Campaign, Ga. @  Early's Washington Raid (Winchester VI, Kemstown II, Va.) @ Petersburg, Va. Campaign",,,,,,,,
1864,Mon 25 July,"Atlanta Campaign, Ga. @ Early's Washington Raid (Bunker Hill, Va.) @ Petersburg, Va. Campaign",,,,,,,,
1864,Tues 26 July,"Atlanta Campaign, Ga. @ Early's Washington Raid @ Petersburg, Va. Campaign @ McCook's Raid, Ga. commenced (Lovejoy Station I) @ Stoneman's Raid, Ga. commenced",,,,,,,,
1864,Wed 27 July,"Atlanta Campaign, Ga. @ Early's Washington Raid @ Petersburg, Va. Campaign (New Market Road II, Deep Bottom, Strawberry Plains I, Malvern Hill II, Darbytown) @ McCook's Raid, Ga.  Stoneman's Raid, Ga.",,,,,,,,
1864,Thurs 28 July,"Atlanta Campaign, Ga. (Ezra Church, Ezra Chapel, Hood's Third Sortie)  @ Early's Washington Raid @ Petersburg, Va. Campaign (New Market Road H, Deep Bottom, Strawberry Plains I, Malvern Hill II, Darbytown) @ McCook's Raid, Ga. (Campbellton) @ Stoneman's Raid, Ga. (Flat Shoals, Flatrock)",,,,,,,,
1864,Fri 29 July,"Atlanta Campaign, Ga.  @ Early's Washington Raid @ Petersburg, Va. Campaign (New Market Road II, Deep Bottom, Strawberry Plains I, Malvern Hill II, Darbytown) @ McCook's Raid, Ga. (Lovejoy Station II) @Stoneman's Raid, Ga. (Macon)",,,,,,,,
1864,Sat 30 July,"Atlanta Campaign, Ga.  @ Early's Washington Raid @ Petersburg, Va. Campaign (Battle of the Crater, Petersburg Mine explosion) @ Chambersburg, Pa.  @ McCook's Raid, Ga. (Newnan)  @Stoneman's Raid, Ga. (Hillsboro, Clinton I, Macon, Sunshine Creek)",,,,,,,,
1864,Sun 31 July,"Atlanta Campaign, Ga.  @ Early's Washington Raid (Cumberland, Md.) @ Petersburg, Va. Campaign @ McCook's Raid, Ga. @  Stoneman's Raid, Ga. (Hillsboro)",,,,,,,,
1864,Mon 1 Aug,"Atlanta Campaign, Ga. Ended @ Early's Washington Raid (Cumberland, Md.) @ Petersburg, Va. Campaign  @Stoneman's Raid, Ga.",,,,,,,,
1864,Tues 2 Aug,"Early's Washington Raid @ Petersburg, Va. Campaign @ Stoneman's Raid, Ga.",,,,,,,,
1864,Wed 3 Aug,"Early's Washington Raid @ Petersburg, Va. Campaign @ Stoneman's Raid, Ga. (Jug Tavern)",,,,,,,,
1864,Thurs 4 Aug,"Early's Washington Raid @ Petersburg, Va. Campaign",,,,,,,,
1864,Fri 5 Aug,"Early's Washington Raid @ Petersburg, Va. Campaign @ Mobile Bay, Ala. (Fort Gaines I, Fort Morgan I, USS Hartford, Brooklyn, Tecumseh, Phillipi, Chickasaw, Lackawanna, Monongahela, Manhattan, Winnebago, Octorora, Metacomet, Port Royal, Seminole, Kennebec, Ossipee, Itasca, Oneida, and Galena vs. CSS Tennessee, Selma, Gaines, and Morgan)  @ Utoy Creek, Ga.",,,,,,,,
1864,Sat 6 Aug,"Early's Washington Raid @ Petersburg, Va. Campaign @ Utoy Creek, Ga.",,,,,,,,
1864,Sun 7 Aug,"Early's Washington Raid ended (Moorefield I, W.Va.) @ Petersburg, Va. Campaign",,,,,,,,
1864,Mon 8 Aug,"Petersburg, Va. Campaign ","Fort Gaines II, Ala.",,,,,,,
1864,Tues 9 Aug,"Petersburg, Va. Campaign (City Point I: munitions explosion by sabotage)",,,,,,,,
1864,Wed 10 Aug,"Petersburg, Va. Campaign ","Wheeler's Raid II commenced (Covington, Ga.)",,,,,,,
1864,Thurs 11 Aug,"Petersburg, Va. Campaign ",Wheeler's Raid II,,,,,,,
1864,Fri 12 Aug,"Petersburg, Va. Campaign", Wheeler's Raid II,,,,,,,
1864,Sat 13 Aug,"Petersburg, Va. Campaign (Deep Bottom II, Strawberry Plains II, Fussell's Mill I, Charles City Road I, White's Tavern I, Gravel Hill)  ", Wheeler's Raid II,,,,,,,
1864,Sun 14 Aug,"Petersburg, Va. Campaign (Deep Bottom II, Strawberry Plains II, New Market Road BI)  ","Wheeler's Raid II (Dalton III, Ga.)",,,,,,,
1864,Mon 15 Aug,"Petersburg, Va. Campaign (Deep Bottom II. Strawberry Plains II) "," Wheeler's Raid II (Dalton III, Ga.)",,,,,,,
1864,Tues 16 Aug,"Petersburg, Va. Campaign (Deep Bottom II, Strawberry Plains II, Charles City Road II, White's Tavern II, Bailey's Creek) ",Wheeler's Raid II  ,"Front Royal III, Va. (Guard Hill, Cedarville)",,,,,,
1864,Wed 17 Aug,"Petersburg, Va. Campaign (Deep Bottom II, Strawberry Plains)  ",Wheeler's Raid II,,,,,,,
1864,Thurs 18 Aug,"Petersburg, Va. Campaign (Deep Bottom II, Strawberry Plains, Weldon Railroad II, Globe Tavern, Yellow House, Blick's Station, Six Mile House)  ",Wheeler's Raid II ,"Kilpatrick's Raid, Ga. commenced (Sandtown)",,,,,,
1864,Fri 19 Aug,"Petersburg, Va. Campaign (Deep Bottom II, Strawberry Plains, Weldon Railroad II, Globe Tavern, Six Mile House) ",Wheeler's Raid II  ,"Kilpatrick's Raid, Ga. (Jonesboro I)",,,,,,
1864,Sat 20 Aug,"Petersburg, Va. Campaign (Deep Bottom II. Strawberry Plains, Weldon Railroad II, Globe Tavern, Six Mile House, Fussell's Mill H)  Wheeler's Raid II  Kilpatrick's Raid, Ga. (Lovejoy Station m, McDonough)",,,,,,,,
1864,Sun 21 Aug,"Petersburg, Va. Campaign (Deep Bottom II, Strawberry Plains, Weldon Railroad II, Globe Tavern, Summit Point)  ",Wheeler's Raid II ,"Memphis II, Tenn.  ","Kilpatrick's Raid, Ga. (Latimer, Decatur II)",,,,,
1864,Mon 22 Aug,"Petersburg, Va. Campaign (Weldon Railroad II, Globe Tavern)  ",Wheeler's Raid II  ,"Kilpatrick's Raid, Ga. ended (Decatur, Buckhead)",,,,,,
1864,Tues 23 Aug,"Petersburg, Va. Campaign ","Fort Morgan II, Ala. ",Wheeler's Raid II,,,,,,
1864,Wed 24 Aug,"Petersburg, Va. Campaign (Ream's Station HI)  ",Wheeler's Raid II,,,,,,,
1864,Thurs 25 Aug,"Petersburg, Va. Campaign (Ream's Station III)  ",Wheeler's Raid II,,,,,,,
1864,Fri 26 Aug,"Petersburg, Va. Campaign ",Wheeler's Raid II,,,,,,,
1864,Sat 27 Aug,"Petersburg, Va. Campaign ",Wheeler's Raid II,,,,,,,
1864,Sun 28 Aug,"Petersburg, Va. Campaign (Fort Gilmer, Fort Harrison I, Laurel Hill HI, New Market Heights I, Chaffin's Farm I) ",Wheeler's Raid II  ,"Price's Mo. Expedition commenced (Camden II, Ark.)",,,,,,
1864,Mon 29 Aug,"Petersburg, Va. Campaign (Poplar Springs Church I, Jones's House, Chappell's House I, Vaughan Road I, Watt's Farm, Pegram's Farm I, Peeble's Farm I) ","Price's Mo. Expedition (Princeton, Ark.)", Wheeler's Raid II,,,,,,
1864,Tues 30 Aug,"Petersburg, Va. Campaign ","Price's Mo. Expedition (Tulip, Ark.) ",Wheeler's Raid II,,,,,,
1864,Wed 31 Aug,"Petersburg, Va. Campaign Price's Mo. Expedition ","Jonesboro II, Ga. (Rough and Ready) ",Wheeler's Raid II ,"Martinsburg III, W.Va.",,,,,
1864,Thurs 1 Sept,"Petersburg, Va. Campaign @ Price's Mo. Expedition @ Jonesboro II, Ga. @ Wheeler's Raid II",,,,,,,,
1864,Fri 2 Sept,"Petersburg, Va. Campaign @  Price's Mo. Expedition @  Wheeler's Raid II (Lovejoy Station IV, Ga.)",,,,,,,,
1864,Sat 3 Sept,"Petersburg, Va. Campaign @ Price's Mo. Expedition @ Sheridan's Va. Valley Campaign commenced (Berryville II)  @ Wheeler's Raid II (Lovejoy Station IV, Ga.)",,,,,,,,
1864,Sun 4 Sept,"Petersburg, Va. Campaign @ Price's Mo. Expedition @ Sheridan's Va. Valley Campaign @ Wheeler's Raid II (Lovejoy IV, Ga.)",,,,,,,,
1864,Mon 5 Sept,"Petersburg, Va. Campaign  @Price's Mo. Expedition @  Sheridan's Va. Valley Campaign (Berryville III)  @ Wheeler's Raid II (Lovejoy Station IV, Ga.)",,,,,,,,
1864,Tues 6 Sept,"Petersburg, Va. Campaign @ Price's Mo. Expedition (Dardanelle, Ark.) @ Sheridan's Va. Valley Campaign @ Wheeler's Raid II (Lovejoy Station IV, Ga.)",,,,,,,,
1864,Wed 7 Sept,"Petersburg, Va. Campaign @ Price's Mo. Expedition @ Sheridan's Va. Valley Campaign @ Wheeler's Raid II",,,,,,,,
1864,Thurs 8 Sept,"Petersburg, Va. Campaign @ Price's Mo. Expedition @ Sheridan's Va. Valley Campaign  @Wheeler's Raid II",,,,,,,,
1864,Fri 9 Sept,"Petersburg, Va. Campaign  @Price's Mo. Expedition @ Sheridan's Va. Valley Campaign  @ Wheeler's Raid II ",,,,,,,,
1864,Sat 10 Sept,"Petersburg, Va. Campaign @ Price's Mo. Expedition @ Sheridan's Va. Valley Campaign @ Wheeler's Raid II ended (Tuscumbia II, Ala.) ",,,,,,,,
1864,Sun 11 Sept,"Petersburg, Va. Campaign @ Price's Mo. Expedition  @ Sheridan's Va. Valley Campaign",,,,,,,,
1864,Mon 12 Sept," Petersburg, Va. Campaign @ Price's Mo. Expedition @ Sheridan's Va. Valley Campaign ",,,,,,,,
1864,Tues 13 Sept,"Petersburg, Va. Campaign @ Price's Mo. Expedition (Batesville, Ark.) @ Sheridan's Va. Valley Campaign",,,,,,,,
1864,Wed 14 Sept,"Petersburg, Va. Campaign @ Price's Mo. Expedition @ Sheridan's Va. Valley Campaign ",,,,,,,,
1864,Thurs 15 Sept,"Petersburg, Va. Campaign @ Price's Mo. Expedition (Powhatan, Ark.) @ Sheridan's Va. Valley Campaign",,,,,,,,
1864,Fri 16 Sept,"Petersburg, Va. Campaign (Coggin's Point, Hampton's ""Beefsteak Raid"") @ Price's Mo. Expedition @ Sheridan's Va. Valley Campaign  ",,,,,,,,
